MP,games_starts,minutes,goals,assists,goals_pens,pens_made,pens_att,cards_yellow,cards_red,cards_yellow_red,fouls,fouled,offsides,crosses,interceptions,tackles_won,pens_won,pens_conceded,main_info,country
26,9,842,5,1,4,1,1,4,0,0,11,14,1,3,3,5,,,"Ahmed Yasser Rayan Ahmed Yasser Anwer Mohamed Mohamed Rayan Position: FW ▪  Footed: Right Born: January 24, 1998 (Age: 24-212d) National Team: Egypt eg Club: Altay",Egypt 
1,0,10,0,0,0,0,0,0,0,0,,,,,,,,,"Ahmed Yassin Ahmed Ibrahim Yassin Mahmoud Position: DF 180cm (5-10½) Born: January 1, 1997 (Age: 25-235d) National Team: Egypt eg Club: National Bank of Egypt Club",Egypt 
3,3,270,0,,0,0,,0,0,0,,,,,,,,,"Rabie Yassin Mohamed Rabie Yassin ربيع ياسين Position: DF (FB, left) 186cm (6-1) Born: September 7, 1960 in Banī Suwayf, Egypt eg National Team: Egypt eg",Egypt 
3,3,270,0,,0,0,,0,0,0,,,,,,,,,"Ismail Youssef Ismail Youssef Awadallah Mohamed إسماعيل يوسف Position: MF Born: June 28, 1964 in Al Jīzah, Egypt eg National Team: Egypt eg",Egypt 
3,3,254,0,0,0,0,0,1,0,,,,,,,,,,"Mohamed Youssef Mohamed Youssef Al Booz محمد يوسف Position: DF 183cm (6-0) Born: October 9, 1970 in Cairo, Egypt eg National Team: Egypt eg",Egypt 
6,2,234,1,0,1,0,0,0,0,0,,,,,,,,,"Moamen Zakaria مؤمن زكريا Position: MF (AM) ▪  Footed: Right 180cm, 72kg (5-10½, 159lb) Born: April 12, 1988 in Markaz Sūhāj, Egypt eg National Team: Egypt eg",Egypt 
43,29,"2,751",10,1,6,4,4,6,0,,44,,,,,,,,"Amr Zaki Amr Hassan Zaki عمرو زكي Position: FW 186cm, 86kg (6-1, 190lb) Born: April 1, 1983 in Al Manşūrah, Egypt eg National Team: Egypt eg",Egypt 
3,3,267,0,,0,0,0,0,0,0,,,,,,,,,"Aliaa El Zenouki Aliaa Shoukry Mohamed Ibrahim El Zenouki Position: FW Born: June 15, 1997 National Team: Egypt eg",Egypt 
201,140,"12,392",77,28,71,6,8,10,1,,116,,,,,,,,"Mohamed Zidan Mohamed Abdullah Zidan محمد زيدان Position: FW ▪  Footed: Right 172cm, 72kg (5-7½, 159lb) Born: December 11, 1981 in Port Said, Egypt eg National Team: Egypt eg",Egypt 
