MP,games_starts,minutes,goals,assists,goals_pens,pens_made,pens_att,cards_yellow,cards_red,cards_yellow_red,fouls,fouled,offsides,crosses,interceptions,tackles_won,pens_won,pens_conceded,main_info,country
12,11,857,0,0,0,0,0,0,0,0,2,11,0,1,8,17,0,0,"Elizabeth Ralston Position: DF 162cm, 55kg (5-3½, 121lb) Born: May 16, 1995 (Age: 27-097d) in Camden, Australia au Citizenship: Australia au Club: Western Sydney Wanderers",Australia 
1,0,8,0,0,0,0,0,0,0,0,0,0,0,0,0,1,,,"Hassan Ramazani Hassan Ramazani Position: DF Born: August 8, 2001 Citizenship: Australia au",Australia 
27,27,"2,388",2,2,2,0,0,1,0,0,15,24,3,78,87,65,,,"Jamilla Rankin Jamilla Sofia Rankin Position: DF Born: May 9, 2003 (Age: 19-104d) in Lismore, Australia au National Team: Australia au Club: Brisbane Roar",Australia 
122,81,"7,477",25,14,25,0,0,12,0,0,94,74,25,110,33,50,2,1,"Hayley Raso Position: FW-MF (WM) ▪  Footed: 73% Right* 162cm, 58kg (5-3½, 128lb) Born: September 5, 1994 (Age: 27-350d) in Brisbane, Australia au National Team: Australia au Club: Manchester City Twitter: @HayleyRaso Instagram: @hayleyraso",Australia 
27,19,"1,755",0,1,0,0,0,2,0,0,7,10,1,10,30,21,0,0,"Jessie Rasschaert Position: DF Born: July 19, 1987 (Age: 35-033d) Citizenship: Australia au Club: Brisbane Roar",Australia 
36,25,"2,341",0,1,0,0,0,3,0,0,17,37,4,51,31,29,,,"Joshua Rawlins Joshua James Rawlins Position: DF 181cm (5-11) Born: April 23, 2004 (Age: 18-120d) Youth National Team: Australia au Club: Utrecht",Australia 
33,20,"1,759",1,3,1,0,0,1,0,0,9,10,0,19,38,12,0,0,"Taylor Ray Taylor Jade Ray Position: MF Born: April 22, 2001 (Age: 21-121d) National Team: Australia au Club: Sydney FC",Australia 
2,0,44,0,0,0,0,0,1,0,,2,,,,,,,,"Alex Read Position: FW Born: November 22, 1991 in Belmont, Australia au Citizenship: Australia au",Australia 
4,1,123,0,0,0,0,0,1,0,0,1,0,0,0,1,4,0,1,"Aaron Reardon Aaron John Reardon Position: DF 181cm, 74kg (5-11, 163lb) Born: March 11, 1999 (Age: 23-163d) Youth National Team: Australia au Club: Mohammedan Sporting Club",Australia 
13,10,822,0,1,0,0,0,1,0,,20,,,,,,,,"Carl Recchia Position: DF-MF (CB-CM) 180cm (5-10½) Born: December 13, 1984 in Melbourne, Australia au Citizenship: Australia au",Australia 
323,323,"28,975",0,0,0,0,0,26,3,0,0,16,0,0,6,1,0,1,"Liam Reddy Liam Rhys Reddy Position: GK 188cm, 89kg (6-2, 196lb) Born: August 8, 1981 (Age: 41-013d) in Sydney, Australia au Citizenship: Australia au Club: Perth Glory",Australia 
203,199,"18,064",0,0,0,0,0,8,0,0,0,18,0,0,12,0,0,1,"Andrew Redmayne Andrew James Redmayne Position: GK 194cm, 83kg (6-4, 183lb) Born: January 13, 1989 (Age: 33-220d) in Gosford, Australia au National Team: Australia au Club: Sydney FC",Australia 
112,94,"8,526",7,0,7,0,0,20,1,,155,,,,,,,,"Kristian Rees Position: DF (CB) 193cm, 94kg (6-3½, 207lb) Born: January 6, 1980 in Adelaide, Australia au Citizenship: Australia au",Australia 
106,86,"7,697",1,0,1,0,0,27,3,2,74,9,0,2,51,19,0,0,"Taylor Regan Position: DF (CB) 188cm, 77kg (6-2, 170lb) Born: November 16, 1988 (Age: 33-278d) in Newcastle, Australia au Citizenship: Australia au Club: Newcastle Jets",Australia 
172,152,"13,202",10,14,10,0,0,20,1,,163,,,,,,,,"Paul Reid Paul James Reid Position: DF-MF (CM-FB) 178cm, 79kg (5-10, 174lb) Born: July 6, 1979 in Sydney, Australia au National Team: Australia au",Australia 
3,3,270,0,,0,0,,0,0,0,,,,,,,,,"Jack Reilly John William Beattie Reilly Position: GK 185cm, 79kg (6-½, 174lb) Born: August 27, 1945 in Stonehaven, Scotland, United Kingdom sco Citizenship: Australia au",Australia 
17,4,517,0,1,0,0,0,0,0,0,12,1,0,0,0,1,0,0,"Jamal Reiners Position: FW Born: May 19, 1998 in South Africa za Youth National Team: Australia au",Australia 
4,2,181,0,0,0,0,0,1,0,,3,,,,,,,,"Brendan Renaud Position: DF-MF (FB-WM, left) Born: August 21, 1973 Citizenship: Australia au",Australia 
158,110,"9,431",4,8,4,0,0,37,2,0,165,86,4,110,82,108,1,0,"Paulo Retre Position: DF-MF (CM-DM) 178cm, 63kg (5-10, 139lb) Born: March 4, 1993 (Age: 29-170d) in Melbourne, Australia au Youth National Team: Australia au Club: Sydney FC",Australia 
6,4,245,0,0,0,0,0,0,0,0,2,,,,,,,,"Karla Reuter Position: DF 172cm (5-7½) Born: June 14, 1984 in Brisbane, Australia au National Team: Australia au",Australia 
15,13,"1,156",2,1,2,0,0,7,0,0,31,13,1,6,26,25,,,"Jay Rich Position: DF Born: October 22, 1999 (Age: 22-303d) in England, England, United Kingdom eng Youth National Team: Australia au Club: Accrington Stanley",Australia 
1,1,90,0,0,0,0,0,0,0,0,0,0,0,0,0,0,,,"Isaac Richards Isaac Michael Richards Position: GK Born: April 9, 1999 Citizenship: Australia au",Australia 
16,16,"1,422",0,0,0,0,0,0,0,0,0,1,0,0,0,2,,,"Keeley Richards Keeley Richards Position: GK Born: November 23, 1994 (Age: 27-271d) Citizenship: Australia au Club: Canberra United",Australia 
3,3,262,0,,0,0,,1,1,0,,,,,,,,,"Ray Richards Raymond Richards Position: MF 175cm, 74kg (5-8½, 163lb) Born: May 18, 1946 in Croydon, England, United Kingdom eng Citizenship: Australia au",Australia 
35,21,"2,196",1,1,1,0,0,5,0,,43,,,,,,,,"Jonti Richter Jonathan Richter Position: FW-MF 170cm (5-6½) Born: April 12, 1983 in Johannesburg, South Africa za Youth National Team: Australia au",Australia 
50,50,"4,425",0,1,0,0,0,6,0,0,55,45,4,73,106,89,0,0,"Natasha Rigby Position: DF Born: January 24, 1993 (Age: 29-209d) in Margaret River, Australia au Citizenship: Australia au Club: Perth Glory",Australia 
60,39,"3,530",10,9,10,0,0,3,0,0,9,13,4,16,7,8,0,0,"Indiah-Paige Riley Indiah-Paige Janita Riley Position: FW 171cm, 58kg (5-7, 128lb) Born: December 20, 2001 (Age: 20-244d) in Auckland, New Zealand nz National Team: Australia au  Other: New Zealand Club: Fortuna Hjørring",Australia 
203,199,"17,197",3,27,3,0,0,45,1,0,274,57,10,221,183,214,0,1,"Josh Risdon Joshua Risdon Position: DF-MF (FB, right) ▪  Footed: Right 167cm, 69kg (5-5½, 152lb) Born: July 27, 1992 (Age: 30-025d) in Bunbury, Australia au National Team: Australia au Club: Western United FC",Australia 
82,54,"3,993",5,3,4,1,1,5,1,,39,,,,,,,,"Nick Rizzo Nicholas Anthony Rizzo Position: MF (WM, left) 174cm, 69kg (5-8½, 152lb) Born: June 9, 1979 in Sydney, Australia au Youth National Team: Australia au",Australia 
1,1,90,0,,0,0,0,0,0,0,,,,,,,,,"Ricardo Rizzo Ricardo Rizzo Trejo Position: GK Born: August 29, 2000 (Age: 21-357d) Citizenship: Australia au Club: Central Coast Mariners",Australia 
9,1,136,0,0,0,0,0,0,0,0,2,3,0,0,3,1,,,"Emma Robers Emma Viktoria Robers Position: MF Born: June 9, 1998 (Age: 24-073d) Citizenship: Australia au Club: Melbourne Victory",Australia 
3,0,77,0,0,0,0,0,0,0,0,1,1,0,3,0,0,,,"Alexander Robertson Alexander Robertson Position: MF Born: April 17, 2003 (Age: 19-126d) Citizenship: Australia au Club: Manchester City",Australia 
63,40,"3,669",1,2,1,0,0,11,0,,52,,,,,,,,"Mark Robertson Position: DF-MF (CB-CM) 180cm (5-10½) Born: April 6, 1977 in Sydney, Australia au Youth National Team: Australia au",Australia 
50,38,"3,583",1,2,1,0,0,4,0,0,29,7,1,52,54,52,0,2,"Karly Roestbakken Position: DF 165cm, 60kg (5-4½, 132lb) Born: January 17, 2001 (Age: 21-216d) in Queanbeyan, Australia au National Team: Australia au Club: LSK Kvinner",Australia 
2,2,180,0,0,0,0,0,1,0,,0,,,,,,,,"Nikola Roganovic Position: GK Born: December 12, 1985 in Belgrade, Serbia rs Citizenship: Australia au",Australia 
207,139,"11,861",37,34,37,0,0,11,1,0,152,61,0,48,9,19,,,"Tom Rogić Tomas Petar Rogić Position: FW-MF (AM) ▪  Footed: 75% Left* 188cm, 88kg (6-2, 194lb) Born: December 16, 1992 (Age: 29-248d) in Griffith, Australia au National Team: Australia au Club: Celtic",Australia 
3,3,270,0,,0,0,,0,0,0,,,,,,,,,"Jimmy Rooney James Rooney Position: MF (WM, left) Born: December 10, 1945 in Dundee, Scotland, United Kingdom sco Citizenship: Australia au",Australia 
28,13,"1,450",3,2,3,0,0,1,0,,17,,,,,,,,"Sean Rooney Sean Daniel Rooney Position: FW 177cm (5-9½) Born: March 1, 1989 in Blacktown, Australia au Youth National Team: Australia au",Australia 
211,149,"13,448",14,11,14,0,0,20,1,1,116,17,1,7,52,19,0,0,"Andy Rose Andrew Patrick Rose Position: DF-MF ▪  Footed: 84% Right* 188cm, 77kg (6-2, 170lb) Born: February 13, 1990 (Age: 32-189d) in Melbourne, Australia au Citizenship: Australia au Club: Vancouver Whitecaps FC",Australia 
319,312,"27,362",18,24,18,0,0,43,3,1,134,20,1,74,53,57,0,1,"Josh Rose Joshua Rose Position: DF-MF (FB, left) 179cm, 87kg (5-10, 192lb) Born: December 16, 1981 in Rockhampton, Australia au Citizenship: Australia au",Australia 
49,26,"2,609",5,2,5,0,0,4,0,0,27,44,7,97,32,18,,,"Lachlan Rose Lachlan Rose Position: FW Born: May 10, 1999 (Age: 23-103d) Citizenship: Australia au Club: Macarthur FC",Australia 
106,60,"5,636",0,4,0,0,0,16,2,1,101,43,1,15,105,54,1,1,"Liam Rose Liam Joseph Rose Position: DF-MF 175cm, 73kg (5-8½, 161lb) Born: April 7, 1997 (Age: 25-136d) in Baulkham Hills, Australia au Youth National Team: Australia au Club: El Paso Locomotive",Australia 
3,0,73,0,0,0,0,0,0,0,,1,,,,,,,,"Jarrad Ross Jarrad Mychael Ross Position: DF Born: May 4, 1990 in Newcastle, Australia au Citizenship: Australia au",Australia 
107,102,"9,043",2,5,2,0,0,21,3,0,85,49,1,25,178,112,0,2,"Kye Rowles Position: DF (CB) 183cm, 89kg (6-0, 196lb) Born: June 24, 1998 (Age: 24-058d) in Kiama, Australia au National Team: Australia au Club: Heart of Midlothian",Australia 
87,79,"6,904",5,1,5,0,0,21,3,,93,,,,,,,,"Mark Rudan Marko Ante Rudan Position: DF (CB) 192cm (6-3½) Born: August 27, 1975 in Sydney, Australia au Youth National Team: Australia au",Australia 
2,0,24,0,0,0,0,0,0,0,0,0,2,0,0,0,1,,,"Cushla Rue Cushla Rue Position: FW Born: July 9, 2003 (Age: 19-043d) Citizenship: Australia au Club: Wellington Phoenix FC",Australia 
26,4,652,2,1,2,0,0,5,0,0,12,2,3,14,5,8,,,"Michael Ruhs Michael Klaude Ruhs Position: FW 180cm (5-10½) Born: August 27, 2002 (Age: 19-359d) Citizenship: Australia au Club: Macarthur FC",Australia 
8,1,214,2,0,2,0,0,0,0,0,3,2,0,10,1,4,0,0,"Dylan Ruiz-Diaz Dylan Enrique Ruiz-Diaz Position: FW Born: March 12, 2001 Youth National Team: Australia au",Australia 
162,110,"9,509",30,20,30,0,0,4,0,,67,,,,,,,,"Nikita Rukavytsya Nikita Vladmírovich Rukavytsya Рукавиця Микита Вадимович Position: FW-MF (WM) ▪  Footed: Left 183cm, 73kg (6-0, 161lb) Born: June 22, 1987 (Age: 35-060d) in Mykolayiv, Ukraine ua National Team: Australia au  Other: Ukraine Club: Maccabi Haifa",Australia 
21,11,"1,060",3,2,3,0,0,0,0,0,20,10,0,47,29,32,,,"Charlize Rule Charlize Jayde Rule Position: MF Born: February 16, 2003 (Age: 19-186d) Youth National Team: Australia au Club: Sydney FC",Australia 
69,53,"4,734",4,5,4,0,0,5,0,0,43,25,3,202,53,57,0,0,"Tate Russell Tate Jackson Russell Position: DF-MF 178cm, 74kg (5-10, 163lb) Born: August 24, 1999 (Age: 22-362d) in Wollongong, Australia au Youth National Team: Australia au Club: Western Sydney Wanderers",Australia 
180,137,"12,254",9,5,9,0,0,33,1,0,130,3,0,5,14,6,0,0,"Sebastian Ryall Sebastian John Henry Ryall Position: DF (CB-FB, right) 180cm, 74kg (5-10½, 163lb) Born: July 18, 1989 in Sydney, Australia au Youth National Team: Australia au",Australia 
26,23,"1,964",2,0,2,0,0,4,0,0,27,14,2,0,46,16,,,"Dylan Ryan Dylan James Ryan Position: DF 184cm, 74kg (6-0, 163lb) Born: June 10, 2000 (Age: 22-072d) in Wollongong, Australia au Youth National Team: Australia au Club: Den Bosch",Australia 
301,301,"27,090",0,0,0,0,1,13,0,0,2,11,0,0,1,0,0,2,"Mathew Ryan Mathew David Ryan Position: GK ▪  Footed: 86% Right* 184cm, 73kg (6-0, 161lb) Born: April 8, 1992 (Age: 30-135d) in Plumpton, Australia au National Team: Australia au Club: Real Sociedad Wages: € 10k Weekly ❌ Expires June 2023. Via Capology.",Australia 
178,156,"13,788",10,4,9,1,1,39,2,0,161,55,5,4,158,67,0,0,"Trent Sainsbury Trent Lucas Sainsbury Position: DF (CB) ▪  Footed: 93% Right* 178cm, 60kg (5-10, 132lb) Born: January 5, 1992 (Age: 30-228d) in Perth, Australia au National Team: Australia au Club: Al Wakrah",Australia 
17,9,672,1,0,1,0,0,1,0,0,5,16,5,4,4,5,0,0,"Sofia Sakalis Position: FW Born: July 11, 2002 (Age: 20-041d) Youth National Team: Australia au Club: Perth Glory",Australia 
19,19,"1,590",3,0,3,0,0,3,0,0,5,,,,,,,,"Cheryl Salisbury Cheryl Ann Salisbury Position: DF (CB) 180cm (5-10½) Born: March 8, 1974 in Newcastle, Australia au National Team: Australia au",Australia 
191,181,"15,957",4,3,4,0,0,47,4,,204,,,,,,,,"Jonas Salley Gyawe Jonas Salley Position: MF (CM) 183cm, 76kg (6-0, 168lb) Born: March 16, 1982 in Côte d'Ivoire ci Citizenship: Australia au",Australia 
184,85,"8,430",57,11,51,6,7,43,2,0,139,49,24,0,9,9,0,0,"Brendon Šantalab Brendon James Šantalab Position: FW 173cm, 72kg (5-8, 159lb) Born: September 9, 1982 in Wollongong, Australia au Citizenship: Australia au",Australia 
8,6,453,0,0,0,0,0,0,0,0,2,2,0,6,14,7,0,1,"Julia Sardo Position: MF Born: June 24, 1995 Citizenship: Australia au",Australia 
10,4,352,1,0,1,0,0,2,0,,4,,,,,,,,"Mimi Saric Mislav Saric Position: MF (AM) 177cm (5-9½) Born: September 3, 1983 in Požega, Croatia hr Youth National Team: Australia au",Australia 
76,55,"4,862",6,10,6,0,0,3,0,,61,,,,,,,,"Kristian Sarkies Kristian Ronald Sarkies Position: MF (AM) 180cm (5-10½) Born: October 25, 1986 in Melbourne, Australia au National Team: Australia au",Australia 
86,63,"5,546",0,4,0,0,0,5,1,,76,,,,,,,,"Adam Sarota Adam Tomek Sarota Position: MF (AM-CM) ▪  Footed: Right 180cm, 72kg (5-10½, 159lb) Born: December 28, 1988 Youth National Team: Australia au",Australia 
1,0,1,0,0,0,0,0,0,0,,0,,,,,,,,"Adam Sawyer Position: MF Born: January 7, 1999 Citizenship: Australia au",Australia 
5,1,132,0,0,0,0,0,1,0,0,2,2,1,3,0,3,0,0,"Harry Sawyer Position: FW 195cm, 92kg (6-4½, 203lb) Born: December 31, 1996 in Brisbane, Australia au Citizenship: Australia au",Australia 
9,4,440,1,0,1,0,0,1,0,0,5,4,0,5,2,8,0,0,"Amy Sayer Amy Joan Irene Sayer Position: MF Born: November 30, 2001 (Age: 20-264d) National Team: Australia au",Australia 
3,3,270,0,,0,0,,0,0,0,,,,,,,,,"Manfred Schaefer Манфред Шефер Position: DF Born: February 12, 1943 in Baltiysk, Russia ru Citizenship: Australia au",Australia 
520,520,"46,722",0,1,0,0,0,9,1,0,0,,,,,,,,"Mark Schwarzer Position: GK ▪  Footed: Right 194cm, 84kg (6-4, 185lb) Born: October 6, 1972 in Sydney, Australia au National Team: Australia au",Australia 
20,9,772,1,1,1,0,0,2,0,0,21,10,10,3,4,2,0,0,"Lachlan Scott Position: FW Born: April 15, 1997 (Age: 25-128d) in Wollongong, Australia au Youth National Team: Australia au Club: South Coast Wolves FC",Australia 
20,18,"1,755",0,0,0,0,0,2,0,0,0,4,0,0,1,1,,,"Ryan Scott Position: GK Born: December 18, 1995 (Age: 26-246d) Citizenship: Australia au Club: Western United FC",Australia 
6,3,346,0,1,0,0,0,0,0,0,5,2,0,6,2,3,0,0,"Walter Scott Position: DF 176cm, 73kg (5-9, 161lb) Born: October 2, 1999 (Age: 22-323d) Youth National Team: Australia au Club: APIA Leichhardt Tigers FC",Australia 
4,0,49,0,0,0,0,0,0,0,0,0,2,0,3,0,0,,,"Adrian Segecic Adrian Segecic Position: MF Born: June 1, 2004 (Age: 18-081d) Youth National Team: Australia au Club: Sydney FC",Australia 
107,97,"7,790",6,6,6,0,0,12,2,,110,,,,,,,,"Naum Sekulovski Position: DF-MF (FB, left) 181cm (5-11) Born: May 14, 1982 in Melbourne, Australia au Citizenship: Australia au",Australia 
26,13,"1,239",3,2,1,2,2,3,0,,2,,,,,,,,"Daniel Severino Position: MF (CM) 183cm (6-0) Born: February 11, 1982 in Sydney, Australia au Citizenship: Australia au",Australia 
20,3,496,1,0,1,0,0,3,0,0,11,12,1,4,4,11,0,0,"Mario Shabow Position: FW 167cm, 68kg (5-5½, 150lb) Born: May 5, 1998 in Baghdad, Iraq iq Youth National Team: Australia au  Other: Iraq",Australia 
66,19,"2,108",6,5,6,0,0,2,0,0,40,14,3,11,7,6,0,1,"Kaine Sheppard Position: FW Born: November 26, 1993 in England, England, United Kingdom eng Citizenship: Australia au  Other: England",Australia 
8,2,221,0,0,0,0,0,1,0,,3,,,,,,,,"Nathan Sherlock Position: DF (CB) 181cm (5-11) Born: February 2, 1990 in Orange, Australia au Youth National Team: Australia au",Australia 
452,433,"38,735",25,11,25,0,0,72,6,,355,,,,,,,,"Shane Sherriff Shane Lewis Cansdell-Sherriff Position: DF (CB-FB, left) 182cm, 76kg (5-11½, 168lb) Born: November 10, 1982 in Sydney, Australia au Youth National Team: Australia au",Australia 
10,8,696,0,0,0,0,0,0,0,0,3,,,,,,,,"Sally Shipard Sally Jean Shipard Position: MF (CM) 176cm (5-9) Born: October 20, 1987 in Tumut, Australia au National Team: Australia au",Australia 
5,4,383,0,0,0,0,0,0,0,0,0,0,0,0,0,0,,,"Isabella Shuttleworth Isabella Shuttleworth Position: GK Born: June 24, 2003 (Age: 19-058d) Citizenship: Australia au Club: Brisbane Roar",Australia 
57,47,"3,839",19,8,19,0,0,4,0,0,34,28,35,14,10,13,0,0,"Remy Siemsen Remy Dianne Siemsen Position: FW 162cm, 62kg (5-3½, 137lb) Born: November 10, 1999 (Age: 22-284d) in Saint Leonards, Australia au National Team: Australia au Club: AIK Fotboll Dam",Australia 
40,16,"1,682",2,2,2,0,0,2,0,0,18,62,5,55,9,10,1,0,"Samuel Silvera Position: FW Born: October 25, 2000 (Age: 21-300d) Citizenship: Australia au Club: Newcastle Jets",Australia 
38,17,"1,752",3,0,3,0,0,2,0,0,10,,,,,,,,"Matt Sim Matthew Sim Position: DF-MF (FB-WM, left) 177cm, 79kg (5-9½, 174lb) Born: April 18, 1988 in Sydney, Australia au Citizenship: Australia au",Australia 
8,3,352,0,0,0,0,0,2,0,,9,,,,,,,,"Mario Šimić Position: DF (FB, left) 174cm (5-8½) Born: December 28, 1989 in Jajce, Bosnia and Herzegovina ba Citizenship: Australia au",Australia 
1,0,21,0,0,0,0,0,0,0,0,1,1,0,1,0,0,0,0,"Jack Simmons Jack Paul Simmons Position: MF Born: April 4, 2002 Citizenship: Australia au",Australia 
50,48,"4,100",3,2,3,0,0,3,0,0,19,23,0,130,60,37,0,0,"Gema Simon Position: DF-MF (FB-WM, left) 160cm (5-2½) Born: July 19, 1990 (Age: 32-033d) in Armidale, Australia au National Team: Australia au Club: Newcastle Jets",Australia 
102,77,"6,678",21,12,18,3,3,8,0,0,58,27,23,35,21,11,0,0,"Kyah Simon Kyah Pam Simon Position: FW-MF ▪  Footed: 81% Right* 164cm, 63kg (5-4½, 139lb) Born: June 25, 1991 (Age: 31-057d) in Blacktown, Australia au National Team: Australia au Club: Tottenham Hotspur LFC",Australia 
281,172,"16,130",66,29,57,9,12,58,2,1,366,133,59,52,27,34,4,0,"Matt Simon Matthew Blake Simon Position: FW 188cm, 78kg (6-2, 172lb) Born: January 22, 1986 in Sydney, Australia au National Team: Australia au",Australia 
7,7,630,0,0,0,0,0,0,0,0,0,1,0,0,0,0,0,0,"Nicole Simonsen Position: GK Born: January 22, 1997 Citizenship: Australia au",Australia 
16,1,361,0,0,0,0,0,3,0,,5,,,,,,,,"Ioannis Simosis Giannis Simosis Position: FW 184cm (6-0) Born: March 13, 1991 in Euboea Island, Greece gr Citizenship: Australia au",Australia 
25,11,"1,063",4,2,4,0,0,0,0,,31,,,,,,,,"Jordan Simpson Position: MF (CM) 194cm (6-4) Born: August 28, 1985 in Sydney, Australia au Citizenship: Australia au",Australia 
19,13,"1,142",0,0,0,0,0,4,0,,31,,,,,,,,"Tyler Simpson Tyler John Simpson Position: DF (FB, right) 198cm (6-5½) Born: August 28, 1985 in Sydney, Australia au Citizenship: Australia au",Australia 
5,1,218,0,0,0,0,0,0,0,,3,,,,,,,,"Lorenzo Sipi Lorenzo Alexa Sipi Position: DF Born: May 13, 1991 in Townsville, Australia au Citizenship: Australia au",Australia 
19,11,917,1,0,1,0,0,3,0,,15,,,,,,,,"Peter Skapetis Position: FW Born: January 13, 1995 Citizenship: Australia au",Australia 
6,1,182,0,,0,0,0,2,0,0,,,,,,,,,"Jack Skinner Jack Skinner Position: MF Born: June 18, 2000 Citizenship: Australia au",Australia 
186,166,"14,324",7,17,6,1,3,37,1,,107,,,,,,,,"Josip Skoko Position: MF (CM) 180cm, 77kg (5-10½, 170lb) Born: December 10, 1975 in Mount Gambier, Australia au National Team: Australia au",Australia 
17,4,436,1,0,1,0,0,0,0,,9,,,,,,,,"Anthony Skorich Position: FW 185cm (6-½) Born: March 19, 1990 in Perth, Australia au Citizenship: Australia au",Australia 
39,16,"1,811",0,1,0,0,0,9,0,0,38,16,0,8,33,26,0,0,"Jerry Skotadis Jerry John Skotadis Position: MF Born: March 7, 2000 (Age: 22-167d) Citizenship: Australia au Club: Western United FC",Australia 
84,55,"5,246",4,10,4,0,0,11,1,,,,,,,,,,"Robbie Slater Robert Slater Position: MF 172cm (5-7½) Born: November 22, 1964 in Ormskirk, England, United Kingdom eng Citizenship: Australia au",Australia 
1,0,5,0,0,0,0,0,0,0,,,,,,,,,,"Tom Slater Position: MF (WM, left) 175cm (5-8½) Born: August 26, 1996 in Lens, France fr Citizenship: Australia au",Australia 
5,4,319,0,0,0,0,0,0,0,0,0,,,,,,,,"Thea Slatyer Thea Kay Slatyer Position: DF Born: February 2, 1983 in Sydney, Australia au National Team: Australia au",Australia 
8,8,583,0,0,0,0,0,0,0,0,3,,,,,,,,"Danielle Small Position: FW-MF 167cm (5-5½) Born: February 7, 1979 in Sydney, Australia au National Team: Australia au",Australia 
99,76,"6,577",3,12,3,0,0,7,1,0,70,36,8,196,73,59,0,2,"Brad Smith Bradley Shaun Smith Position: DF-MF (FB-WM, left) ▪  Footed: 82% Left* 178cm, 69kg (5-10, 152lb) Born: April 9, 1994 (Age: 28-134d) in Penrith, Australia au National Team: Australia au  Other: England Club: D.C. United Wages: $550k Annual ✅ Expires December 2022. Via Capology. Twitter: @bradsmith_94 Instagram: @bradsmith_94",Australia 
2,1,112,0,0,0,0,0,0,0,,3,,,,,,,,"Brady Smith Brady Patrick Smith Position: FW 180cm (5-10½) Born: August 10, 1989 in Gosford, Australia au Citizenship: Australia au",Australia 
1,0,14,0,0,0,0,0,0,0,,0,,,,,,,,"Dylan Smith Position: MF Born:  1996 in Adelaide, Australia au Citizenship: Australia au",Australia 
116,115,"10,122",6,2,6,0,0,20,0,,88,,,,,,,,"Matt Smith Matthew Terence Smith Position: DF (CB) 180cm, 73kg (5-10½, 161lb) Born: October 15, 1982 (Age: 39-310d) in Chichester, England, United Kingdom eng Citizenship: Australia au  Other: England",Australia 
20,15,"1,268",1,2,1,0,0,3,0,0,10,10,2,52,30,21,,,"Noah Smith Position: DF 185cm, 92kg (6-½, 203lb) Born: December 15, 2000 (Age: 21-249d) in Adelaide, Australia au Citizenship: Australia au Club: Central Coast Mariners",Australia 
14,5,369,0,1,0,0,0,0,0,,12,,,,,,,,"Tim Smits Timothy Smits Position: FW 182cm (5-11½) Born: April 11, 1986 in Brisbane, Australia au Youth National Team: Australia au",Australia 
13,0,206,1,0,1,0,0,0,0,0,1,2,2,5,2,2,,,"Jordan Smylie Position: FW Born: February 28, 2000 Citizenship: Australia au",Australia 
4,1,130,2,,2,0,0,0,0,0,,,,,,,,,"Sorato Jânio Sorato Ferreira do Nascimento Position: MF ▪  Footed: Right 178cm, 73kg (5-10, 161lb) Born: January 22, 1990 in Natal, Brazil br National Team: Australia au  Other: Brazil",Australia 
143,75,"7,048",25,7,24,1,1,13,0,0,155,124,45,121,50,69,2,1,"Jaushua Sotirio Position: FW-MF (WM, left & right) 175cm, 71kg (5-8½, 157lb) Born: October 11, 1995 (Age: 26-314d) in Sydney, Australia au Youth National Team: Australia au Club: Wellington Phoenix",Australia 
3,3,255,0,0,0,0,0,0,0,0,0,3,0,1,2,5,0,0,"Rachael Soutar Position: DF 179cm, 62kg (5-10, 137lb) Born: April 8, 1994 in Wahroonga, Australia au Youth National Team: Australia au",Australia 
114,110,"10,037",6,5,6,0,0,10,2,0,70,28,3,2,112,76,0,0,"Harry Souttar Position: DF (CB) ▪  Footed: Right 198cm, 78kg (6-5½, 172lb) Born: October 22, 1998 (Age: 23-303d) in Aberdeen, Scotland, United Kingdom sco National Team: Australia au  Other: Scotland Club: Stoke City",Australia 
1,1,22,0,0,0,0,0,0,0,0,0,0,0,0,0,0,,,"Yaren Sözer Yaren Izzet Sözer Position: GK Born: April 19, 1997 (Age: 25-124d) Citizenship: Australia au Club: Central Coast Mariners",Australia 
78,39,"3,576",1,6,1,0,0,11,0,,55,,,,,,,,"Jason Spagnuolo Jason Felice Spagnuolo Position: MF (AM-WM, right) 173cm (5-8) Born: August 2, 1984 in Adelaide, Australia au Citizenship: Australia au",Australia 
57,44,"4,152",6,3,6,0,0,7,0,,73,,,,,,,,"Noel Spencer Position: MF (CM) 183cm (6-0) Born: July 26, 1977 in Wollongong, Australia au Citizenship: Australia au",Australia 
148,138,"12,107",2,2,2,0,0,25,1,0,85,20,1,0,71,16,0,1,"Matthew Spiranovic Matthew Thomas Spiranovic Position: DF-MF (CB-DM) ▪  Footed: Right 193cm, 87kg (6-3½, 192lb) Born: June 27, 1988 (Age: 34-055d) in Geelong, Australia au National Team: Australia au Club: Melbourne Victory",Australia 
8,5,445,1,1,1,0,0,2,0,,10,,,,,,,,"Joe Spiteri Position: FW 184cm (6-0) Born: May 6, 1973 Citizenship: Australia au",Australia 
104,88,"7,585",5,7,5,0,0,33,1,,168,,,,,,,,"Wayne Srhoj John Wayne Srhoj Position: MF 188cm (6-2) Born: March 23, 1982 in Mareeba, Australia au Youth National Team: Australia au",Australia 
36,18,"1,736",7,1,7,0,0,4,1,0,36,39,5,11,11,11,0,0,"Apostolos Stamatelopoulos Apostolos Vasilios Stamatelopoulos Position: FW 184cm, 83kg (6-0, 183lb) Born: April 9, 1999 in North Adelaide, Australia au Youth National Team: Australia au",Australia 
4,1,79,0,0,0,0,0,0,0,0,3,0,0,1,0,1,,,"Nia Stamatopoulos Nia Constance Stamatopoulos Position: MF Born: July 24, 2003 (Age: 19-028d) Youth National Team: Australia au Club: Brisbane Roar",Australia 
25,3,805,1,0,1,0,0,4,0,,16,,,,,,,,"Robert Stambolziev Robert Alexander Petar Stambolziev Position: MF (WM) 181cm (5-11) Born: October 26, 1990 in Melbourne, Australia au Youth National Team: Australia au",Australia 
19,7,809,0,0,0,0,0,4,0,0,20,15,0,14,22,19,0,0,"Emma Stanbury Position: MF 172cm, 59kg (5-7½, 130lb) Born: September 13, 1991 (Age: 30-342d) Citizenship: Australia au Club: Adelaide United",Australia 
4,4,357,0,0,0,0,0,0,0,0,,,,,,,,,"Bridgette Starr Born: December 10, 1975 National Team: Australia au",Australia 
22,8,838,0,0,0,0,0,3,0,0,13,5,0,3,11,13,,,"Harrison Steele Harrison Steele Position: MF Born: October 12, 2002 (Age: 19-313d) Citizenship: Australia au Club: Central Coast Mariners",Australia 
240,227,"20,149",1,8,1,0,0,32,0,,70,,,,,,,,"Shane Stefanutto Shane Peter Stefanutto Position: DF (FB, left) 177cm, 78kg (5-9½, 172lb) Born: January 12, 1980 in Cairns, Australia au National Team: Australia au",Australia 
15,5,468,0,0,0,0,0,0,0,,7,,,,,,,,"Francesco Stella Position: MF (AM-WM) ▪  Footed: Right 182cm (5-11½) Born: July 25, 1991 in Melbourne, Australia au Citizenship: Australia au",Australia 
