MP,games_starts,minutes,goals,assists,goals_pens,pens_made,pens_att,cards_yellow,cards_red,cards_yellow_red,fouls,fouled,offsides,crosses,interceptions,tackles_won,pens_won,pens_conceded,main_info,country
102,75,"6,563",21,8,21,0,0,13,0,0,111,98,10,141,16,35,1,0,"Chris Ikonomidis Position: FW-MF (AM) ▪  Footed: Right 178cm, 74kg (5-10, 163lb) Born: May 4, 1995 (Age: 27-109d) National Team: Australia au Club: Melbourne Victory",Australia 
21,21,"1,862",0,0,0,0,0,1,0,0,4,16,1,27,18,16,,,"Emma Ilijoski Emma Jessica Ilijoski Position: DF Born: January 8, 2003 (Age: 19-225d) in Canberra, Australia au Youth National Team: Australia au Club: Canberra United",Australia 
19,8,780,0,0,0,0,0,1,0,,10,,,,,,,,"Naoki Imaya 今矢直城 Position: FW-MF 179cm (5-10) Born: June 18, 1980 in Japan jp Citizenship: Australia au",Australia 
251,217,"18,928",39,19,39,0,0,12,0,,198,,,,,,,,"Danny Invincibile Daniele Anthony Invincibile Position: FW-MF (AM-WM, right) 180cm, 79kg (5-10½, 174lb) Born: March 31, 1979 in Brisbane, Australia au Youth National Team: Australia au",Australia 
4,1,132,0,0,0,0,0,0,0,0,2,1,0,0,3,1,,,"Thiel Iradukunda Position: MF Born: July 12, 1999 in Kigoma, Tanzania tz Citizenship: Australia au  Other: Tanzania",Australia 
11,0,194,3,0,3,0,0,1,0,0,7,3,1,6,1,1,,,"Nestory Irankunda Nestory Irankunda Position: FW Born: February 9, 2006 (Age: 16-193d) Citizenship: Australia au Club: Adelaide United",Australia 
15,7,606,4,0,4,0,0,0,0,0,,,,,,,,,"John Iredale John Warwick Iredale Position: FW Born: August 1, 1999 (Age: 23-020d) Youth National Team: Australia au Club: Wehen Wiesbaden",Australia 
12,11,"1,034",0,0,0,0,0,0,0,,0,,,,,,,,"Danny Ireland Daniel Anthony Ireland Position: GK 193cm (6-3½) Born: September 30, 1990 in Sydney, Australia au Youth National Team: Australia au",Australia 
291,268,"24,013",29,23,29,0,0,57,3,1,286,125,17,85,197,156,0,0,"Jackson Irvine Jackson Alexander Irvine Position: DF-MF (AM-CB-CM-DM) ▪  Footed: Right 179cm, 69kg (5-10, 152lb) Born: March 7, 1993 (Age: 29-167d) in Melbourne, Australia au National Team: Australia au Club: St. Pauli",Australia 
18,13,"1,087",0,0,0,0,0,1,0,0,11,19,3,12,10,21,1,0,"Jacob Italiano Position: FW 177cm, 71kg (5-9½, 157lb) Born: July 30, 2001 (Age: 21-022d) Youth National Team: Australia au Club: Mönchengladbach Wages: € k Weekly ❌ Expires June 2024. Via Capology.",Australia 
49,47,"4,294",0,0,0,0,0,1,0,0,0,5,0,0,1,4,0,0,"Lewis Italiano Position: GK 191cm, 83kg (6-3, 183lb) Born: December 10, 1990 in Perth, Australia au Citizenship: Australia au",Australia 
57,13,"1,607",6,1,6,0,0,3,0,0,27,30,6,18,2,12,0,0,"Luke Ivanovic Position: FW Born: June 6, 2000 (Age: 22-076d) Citizenship: Australia au Club: Brisbane Roar",Australia 
123,123,"10,862",0,0,0,0,0,6,2,0,1,15,0,0,8,0,0,4,"Paul Izzo Paul David Izzo Position: GK 184cm, 79kg (6-0, 174lb) Born: January 6, 1995 (Age: 27-227d) in Adelaide, Australia au Youth National Team: Australia au Club: Xanthi",Australia 
17,12,"1,131",1,0,1,0,0,5,1,1,14,17,1,11,22,20,,,"Tiana Jaber Position: MF Born: May 9, 2000 (Age: 22-104d) Citizenship: Australia au Club: Newcastle Jets",Australia 
20,5,661,0,0,0,0,0,2,0,,0,,,,,,,,"Neil Jablonski Position: MF 175cm (5-8½) Born: March 9, 1983 in Glenrothes, Scotland, United Kingdom sco Citizenship: Australia au",Australia 
39,30,"2,669",4,4,4,0,0,7,1,0,38,23,1,58,73,43,0,0,"Amy Jackson Amy Elise Jackson Position: MF 168cm (5-6) Born: September 8, 1987 (Age: 34-347d) in Altona, Australia au Youth National Team: Australia au Club: Melbourne Victory",Australia 
125,103,"9,240",5,4,5,0,0,16,0,0,66,11,2,19,88,50,0,0,"Lachlan Jackson Position: DF 196cm, 89kg (6-5, 196lb) Born: March 12, 1995 (Age: 27-162d) in Townsville, Australia au Youth National Team: Australia au Club: Suwon Bluewings",Australia 
1,0,1,0,0,0,0,0,0,0,,0,,,,,,,,"Liam Jacob Position: GK 191cm (6-3) Born: August 18, 1994 in Sydney, Australia au Youth National Team: Australia au",Australia 
1,1,90,0,0,0,0,0,0,0,0,0,0,0,0,0,0,,,"Noah James Noah Paul James Position: GK Born: February 14, 2001 (Age: 21-188d) Youth National Team: Australia au Club: Newcastle Jets",Australia 
5,3,288,0,0,0,0,0,0,0,0,0,0,0,0,0,0,,,"Sally James Position: GK Born: October 18, 2002 (Age: 19-307d) Citizenship: Australia au Club: Melbourne City",Australia 
296,281,"25,056",4,27,4,0,0,65,1,1,363,153,5,335,124,139,1,1,"Scott Jamieson Scott Alexander Jamieson Position: DF-MF (FB-WM, left) ▪  Footed: Left 178cm, 69kg (5-10, 152lb) Born: October 13, 1988 (Age: 33-312d) in Sydney, Australia au National Team: Australia au Club: Melbourne City",Australia 
7,3,333,2,0,1,1,1,2,0,0,13,4,0,5,5,10,,,"Alana Jancevski Position: FW Born: March 13, 2003 (Age: 19-161d) Youth National Team: Australia au Club: Perth Glory",Australia 
159,159,"14,245",0,0,0,0,0,7,1,0,2,9,0,0,6,1,0,2,"Vedran Janjetović Position: GK 186cm, 83kg (6-1, 183lb) Born: August 20, 1987 in Croatia hr Citizenship: Australia au  Other: Croatia",Australia 
7,1,160,0,0,0,0,0,1,1,0,6,2,0,1,0,5,0,1,"Caitlyn Jarvie Position: MF Born: November 3, 1990 Citizenship: Australia au",Australia 
9,2,285,0,0,0,0,0,0,0,0,0,0,0,0,0,0,,,"Jordan Jasnos Jordan Jasnos Position: FW Born: March 12, 2003 (Age: 19-162d) Youth National Team: Australia au Club: Wellington Phoenix FC",Australia 
345,314,"28,015",28,23,22,6,6,68,5,0,466,25,0,8,61,44,0,1,"Mile Jedinak Michael John Jedinak Position: MF (DM) ▪  Footed: Both 191cm, 78kg (6-3, 172lb) Born: August 3, 1984 in Sydney, Australia au National Team: Australia au Instagram: @milejedinak15",Australia 
232,190,"17,199",6,9,6,0,0,63,1,1,307,165,2,24,296,290,0,0,"James Jeggo James Alexander Jeggo Position: MF (CM-DM) ▪  Footed: Right 179cm, 66kg (5-10, 146lb) Born: February 12, 1992 (Age: 30-190d) in Austria at National Team: Australia au  Other: Austria Club: Eupen",Australia 
46,40,"3,378",6,6,6,0,0,4,0,,29,,,,,,,,"Marko Ješić Marko Danny Ješić Position: FW-MF (WM) 178cm (5-10) Born: August 7, 1989 in Fairfield, Australia au Youth National Team: Australia au",Australia 
24,22,"2,051",0,0,0,0,0,2,0,0,16,25,3,69,34,25,0,0,"Laura Johns Position: DF Born: August 31, 1994 Citizenship: Australia au",Australia 
5,0,86,0,0,0,0,0,0,0,0,2,1,0,5,0,3,,,"Kahli Johnson Kahli Mary Johnson Position: FW Born: February 18, 2004 (Age: 18-184d) Youth National Team: Australia au Club: Sydney FC",Australia 
13,12,861,0,0,0,0,0,2,0,0,8,9,0,1,9,2,,,"Lucy Johnson Lucy Johnson Position: FW Born: April 1, 1999 (Age: 23-142d) Citizenship: Australia au Club: Newcastle Jets",Australia 
121,100,"8,814",6,6,4,2,2,23,1,,171,,,,,,,,"Richard Johnson Richard Mark Johnson Position: MF (CM) 180cm (5-10½) Born: April 27, 1974 in Kurri Kurri, Australia au Citizenship: Australia au",Australia 
10,2,282,1,0,1,0,0,1,0,0,7,2,5,1,2,5,0,0,Adriana Jones Position: FW Citizenship: Australia au,Australia 
276,274,"24,545",0,0,0,0,0,6,3,0,1,10,0,0,1,2,0,0,"Brad Jones Bradley Scott Jones Position: GK ▪  Footed: Left 191cm, 76kg (6-3, 168lb) Born: March 19, 1982 (Age: 40-155d) in Perth, Australia au National Team: Australia au Club: Perth Glory",Australia 
9,4,439,0,0,0,0,0,2,0,0,3,4,0,0,4,1,,,"Hannah Jones Hannah Elizabeth Jones Position: MF Born: September 5, 2002 (Age: 19-350d) Youth National Team: Australia au Club: Wellington Phoenix FC",Australia 
1,0,11,0,0,0,0,0,0,0,0,1,0,0,1,0,1,,,"Rory Jordan Rory Jordan Position: FW Born: February 9, 2000 (Age: 22-193d) Citizenship: Australia au Club: Macarthur FC",Australia 
167,153,"12,980",6,2,6,0,0,15,1,0,38,27,7,0,104,38,0,0,"Aleksandar Jovanović Position: DF (CB) 196cm, 84kg (6-5, 185lb) Born: August 4, 1989 (Age: 33-017d) in Melbourne, Australia au Citizenship: Australia au Club: Macarthur FC",Australia 
23,4,567,1,1,1,0,0,2,0,,12,,,,,,,,"Andrija Jukic Position: MF (CM) 181cm (5-11) Born: January 3, 1987 in Perth, Australia au Citizenship: Australia au",Australia 
19,11,959,1,1,1,0,0,3,0,0,19,7,7,2,2,12,0,0,"Katarina Jukic Position: FW-MF 163cm (5-4) Born: November 23, 1989 in Perth, Australia au Citizenship: Australia au",Australia 
3,1,59,0,0,0,0,0,0,0,,,,,,,,,,"Ante Juric Position: DF 193cm (6-3½) Born: November 11, 1973 in Canberra, Australia au Youth National Team: Australia au",Australia 
50,41,"3,419",12,,11,1,1,9,0,0,,,,,,,,,"Deni Jurić Position: FW Born: September 3, 1997 (Age: 24-352d) Youth National Team: Australia au Club: HNK Gorica",Australia 
16,16,"1,440",0,0,0,0,0,0,0,,0,,,,,,,,"Frank Juric Position: GK 196cm, 94kg (6-5, 207lb) Born: October 28, 1973 in Melbourne, Australia au Youth National Team: Australia au",Australia 
179,113,"10,408",46,11,35,11,13,25,4,1,50,32,9,7,3,8,0,0,"Tomi Juric Tomislav Juric Position: FW ▪  Footed: Both 189cm, 79kg (6-2, 174lb) Born: July 22, 1991 (Age: 31-030d) in Sydney, Australia au National Team: Australia au Club: Macarthur FC",Australia 
212,185,"16,620",4,3,4,0,0,43,1,0,143,35,3,11,134,54,0,0,"Matthew Jurman Matthew John Jurman Position: DF (CB) ▪  Footed: Left 190cm, 83kg (6-2½, 183lb) Born: December 8, 1989 (Age: 32-256d) in Wollongong, Australia au National Team: Australia au Club: Newcastle Jets",Australia 
179,178,"15,740",0,0,0,0,0,11,0,,0,,,,,,,,"Zeljko Kalac Position: GK 202cm, 94kg (6-7½, 207lb) Born: December 16, 1972 in Sydney, Australia au National Team: Australia au",Australia 
122,86,"7,642",11,3,9,2,2,39,0,0,6,3,0,4,3,1,0,0,"Anthony Kalik Position: MF 175cm, 72kg (5-8½, 159lb) Born: November 5, 1997 (Age: 24-289d) Youth National Team: Australia au Club: HNK Gorica",Australia 
78,42,"3,985",8,4,8,0,0,4,0,,40,,,,,,,,"Nick Kalmar Nicholas Andrew Kalmar Position: MF (CM) 190cm, 78kg (6-2½, 172lb) Born: October 15, 1987 in Melbourne, Australia au Citizenship: Australia au",Australia 
1,0,29,0,0,0,0,0,0,0,,1,,,,,,,,"Teeboy Kamara Position: FW-MF (AM) 175cm (5-8½) Born: May 18, 1996 in Monrovia, Liberia lr Youth National Team: Australia au",Australia 
150,88,"8,293",17,15,17,0,0,16,0,0,96,148,22,147,94,89,5,0,"Bruce Kamau Position: FW-MF (WM, right) 175cm, 67kg (5-8½, 148lb) Born: March 28, 1995 (Age: 27-146d) in Kenya ke Youth National Team: Australia au  Other: Kenya Club: OFI Crete",Australia 
195,162,"14,429",9,4,9,0,0,47,3,0,259,39,1,4,86,64,0,2,"Ben Kantarovski Benjamin Kantarovski Position: DF-MF (CM) 183cm, 73kg (6-0, 161lb) Born: January 20, 1992 in Newcastle, Australia au Youth National Team: Australia au",Australia 
1,0,5,0,0,0,0,0,0,0,,0,,,,,,,,"Michael Kantarovski Position: MF Born: May 22, 1995 Citizenship: Australia au",Australia 
162,144,"12,945",8,9,7,1,1,26,2,1,23,6,3,142,33,13,0,0,"Fran Karačić Position: DF 185cm, 74kg (6-½, 163lb) Born: May 12, 1996 (Age: 26-101d) in Croatia hr National Team: Australia au  Other: Croatia Club: Brescia",Australia 
7,2,202,0,0,0,0,0,1,0,0,8,2,0,1,2,1,,,"Caitlin Karic Caitlin Karic Position: FW Born: June 20, 2005 (Age: 17-062d) Citizenship: Australia au Club: Melbourne City",Australia 
6,2,262,0,0,0,0,0,2,0,,3,,,,,,,,"Mario Karlović Position: MF (CM) 182cm, 73kg (5-11½, 161lb) Born: May 29, 1984 in Whyalla, Australia au Youth National Team: Australia au",Australia 
3,3,213,0,0,0,0,0,0,0,0,,,,,,,,,"Tal Karp Position: MF Born: December 30, 1981 in Perth, Australia au National Team: Australia au",Australia 
7,1,217,0,1,0,0,0,0,0,,4,,,,,,,,"Boima Karpeh Boima Jerry Karpeh Position: FW Born: June 16, 1984 in Monrovia, Liberia lr Citizenship: Australia au",Australia 
4,0,33,0,0,0,0,0,0,0,0,0,1,0,1,0,0,,,"Alexia Karrys-Stahl Alexia Karrys-Stahl Position: DF Born: October 13, 1999 (Age: 22-312d) Citizenship: Australia au Club: Canberra United",Australia 
2,0,22,0,0,0,0,0,0,0,0,0,1,0,0,0,0,,,"Asad Kasumovic Asad Kasumovic Position: FW Born: August 28, 2001 (Age: 20-358d) Citizenship: Australia au Club: Adelaide United",Australia 
5,0,33,0,0,0,0,0,0,0,0,1,1,0,0,1,1,0,0,"Joey Katebian Position: FW ▪  Footed: Right 177cm, 72kg (5-9½, 159lb) Born: November 9, 1995 (Age: 26-285d) in Melbourne, Australia au Citizenship: Australia au Club: Avondale FC",Australia 
1,0,24,0,0,0,0,0,0,0,,0,,,,,,,,"Ersin Kaya Position: DF-MF (FB-WM, left & right) Born: July 5, 1993 in Melbourne, Australia au Youth National Team: Australia au",Australia 
12,1,249,1,,1,0,0,0,0,0,,,,,,,,,"Callum Kealy Position: FW Born: September 26, 1998 Citizenship: Australia au",Australia 
10,1,206,2,0,2,0,0,2,0,0,10,5,0,2,3,6,,,"Aideen Keane Aideen Hogan Keane Position: MF Born: February 9, 2002 (Age: 20-193d) Youth National Team: Australia au Club: Perth Glory",Australia 
6,3,403,0,0,0,0,0,0,0,,,,,,,,,,"Jason Kearton Jason Brett Kearton Position: GK 180cm (5-10½) Born: July 9, 1969 in Ipswich, Australia au Citizenship: Australia au",Australia 
33,27,"2,474",1,2,1,0,0,3,0,0,19,14,1,43,60,15,0,0,"Lauren Keir Position: DF 167cm, 67kg (5-5½, 148lb) Born: October 24, 1996 (Age: 25-301d) in Canberra, Australia au Citizenship: Australia au Club: Canberra United",Australia 
6,0,37,0,0,0,0,0,0,0,0,0,0,0,4,0,1,0,0,"Peter Kekeris Position: MF (AM) ▪  Footed: Both Born: May 7, 1999 Citizenship: Australia au",Australia 
4,4,360,0,,0,0,,0,0,0,0,,,,,,,,"Cassandra Kell Position: GK Born: January 20, 1980 Citizenship: Australia au",Australia 
79,64,"5,595",5,2,3,2,3,11,0,0,14,11,0,71,18,19,0,0,"Elise Kellond-Knight Position: DF-MF 165cm (5-4½) Born: August 10, 1990 (Age: 32-011d) in Gold Coast, Australia au National Team: Australia au Club: Hammarby",Australia 
105,91,"7,718",3,5,3,0,0,13,1,,141,,,,,,,,"Matthew Kemp Matthew Allan Kemp Position: DF-MF (FB) 175cm, 71kg (5-8½, 157lb) Born: August 8, 1980 in Canberra, Australia au National Team: Australia au",Australia 
125,121,"10,846",12,3,12,0,0,15,1,0,55,36,1,7,84,41,0,2,"Alanna Kennedy Alanna Stephanie Kennedy Position: DF-MF (CB) ▪  Footed: 78% Right* 176cm, 63kg (5-9, 139lb) Born: January 21, 1995 (Age: 27-212d) in Campbelltown, Australia au National Team: Australia au Club: Manchester City Twitter: @AlannaKennedy Instagram: @alannakennedy",Australia 
157,154,"13,785",0,0,0,0,0,5,0,0,0,7,0,0,1,0,0,0,"Ben Kennedy Benjamin Kennedy Position: GK 189cm, 83kg (6-2, 183lb) Born: February 14, 1987 in Newcastle, Australia au Citizenship: Australia au",Australia 
260,230,"20,712",90,38,75,15,15,22,0,0,79,,,,,,,,"Joshua Kennedy Joshua Blake Kennedy Position: FW 194cm, 83kg (6-4, 183lb) Born: August 20, 1982 in Wodonga, Australia au National Team: Australia au",Australia 
176,163,"14,318",132,36,130,2,4,10,0,0,53,35,74,120,23,27,3,0,"Sam Kerr Samantha Kerr Position: FW-MF (WM) ▪  Footed: 83% Right* 167cm, 66kg (5-5½, 146lb) Born: September 10, 1993 (Age: 28-345d) in Fremantle, Australia au National Team: Australia au Club: Chelsea More Player Info",Australia 
378,337,"29,624",89,56,81,8,11,40,1,0,301,,,,,,,,"Harry Kewell Harold Kewell Position: FW-MF (WM, left) 180cm, 73kg (5-10½, 161lb) Born: September 22, 1978 in Sydney, Australia au National Team: Australia au",Australia 
39,28,"2,501",7,4,7,0,0,6,0,0,49,31,12,12,2,22,0,0,"Leena Khamis Position: FW-MF 168cm, 62kg (5-6, 137lb) Born: June 19, 1986 (Age: 36-063d) in Camden, Australia au National Team: Australia au Club: Perth Glory",Australia 
25,25,"2,250",0,0,0,0,0,4,0,0,5,8,0,0,0,0,0,0,"Sham Khamis Position: GK 173cm, 63kg (5-8, 139lb) Born: February 13, 1995 (Age: 27-189d) in Sydney, Australia au Citizenship: Australia au Club: Western Sydney Wanderers",Australia 
1,0,1,0,0,0,0,0,0,0,0,0,0,0,0,0,0,,,"Louis Khoury Position: FW Born: October 8, 2000 Citizenship: Australia au",Australia 
463,373,"33,203",30,52,21,9,9,68,3,0,265,153,1,552,163,86,0,1,"Neil Kilkenny Neil Martin Kilkenny Position: MF (CM-DM) ▪  Footed: Right 173cm, 67kg (5-8, 148lb) Born: December 19, 1985 (Age: 36-245d) in Enfield, England, United Kingdom eng National Team: Australia au  Other: England Club: Western United FC",Australia 
7,3,311,0,0,0,0,0,0,0,0,2,1,0,3,5,1,,,"Danny Kim Position: MF 180cm (5-10½) Born: May 28, 1998 (Age: 24-085d) Citizenship: Australia au Club: Bentleigh Greens SC",Australia 
74,65,"5,861",0,4,0,0,0,4,0,0,46,16,3,237,101,61,0,0,"Joel King Joel Bruce King Position: DF (FB, left) 175cm, 69kg (5-8½, 152lb) Born: October 30, 2000 (Age: 21-295d) in Figtree, Australia au National Team: Australia au Club: Odense",Australia 
34,32,"2,803",0,0,0,0,0,6,0,0,30,9,0,2,40,34,0,0,"Taren King Position: DF Born: December 24, 1996 (Age: 25-240d) Citizenship: Australia au Club: Newcastle Jets",Australia 
24,23,"1,877",1,1,1,0,0,0,0,0,3,10,14,17,6,9,1,0,"Jenna Kingsley Position: FW 160cm, 60kg (5-2½, 132lb) Born: March 24, 1992 in Penrith, Australia au Youth National Team: Australia au",Australia 
12,3,391,0,0,0,0,0,0,0,0,1,2,0,1,6,3,0,0,"Paige Kingston-Hogg Position: MF Born: December 2, 2000 Citizenship: Australia au",Australia 
30,13,"1,225",0,1,0,0,0,4,0,0,16,32,0,16,8,16,,,"Birkan Kirdar Position: MF 176cm (5-9) Born: February 7, 2002 (Age: 20-195d) Youth National Team: Australia au Club: Melbourne Victory",Australia 
12,0,130,0,0,0,0,0,0,0,0,1,4,0,1,1,3,0,0,"Lara Kirkby Position: MF Born: October 14, 2002 Citizenship: Australia au",Australia 
298,286,"25,230",17,7,17,0,0,48,6,,306,,,,,,,,"Patrick Kisnorbo Patrick Fabio Maxime Kisnorbo Position: DF (CB) 188cm, 76kg (6-2, 168lb) Born: March 24, 1981 in Melbourne, Australia au National Team: Australia au",Australia 
142,87,"7,891",11,13,11,0,0,11,0,0,124,97,12,380,74,98,1,0,"Ryan Kitto Position: DF-FW-MF (WM, left) ▪  Footed: Right 182cm, 74kg (5-11½, 163lb) Born: August 9, 1994 (Age: 28-012d) in Adelaide, Australia au Citizenship: Australia au Club: Adelaide United",Australia 
15,5,494,1,0,1,0,0,1,0,,11,,,,,,,,"Joe Knowles Position: FW 182cm, 78kg (5-11½, 172lb) Born: July 10, 1996 (Age: 26-042d) in England, United Kingdom eng Citizenship: Australia au",Australia 
66,47,"4,327",0,7,0,0,0,6,1,,59,,,,,,,,"Paul Kohler Position: DF-MF (CB-CM) 175cm (5-8½) Born: August 5, 1979 in Sydney, Australia au Citizenship: Australia au",Australia 
64,26,"2,570",5,2,5,0,0,4,0,0,26,17,1,39,22,40,0,1,"Nathan Konstandopoulos Position: MF (CM) 178cm, 76kg (5-10, 168lb) Born: June 26, 1996 (Age: 26-056d) in Adelaide, Australia au Citizenship: Australia au Club: Adelaide United",Australia 
4,1,129,0,0,0,0,0,0,0,0,1,0,0,0,0,0,0,0,"Billy Konstantinidis Vasilis Konstantinidis Position: FW 191cm (6-3) Born: April 21, 1986 in Melbourne, Australia au Citizenship: Australia au",Australia 
21,15,"1,282",2,0,2,0,0,2,0,,25,,,,,,,,"Evan Kostopoulos Position: FW 185cm (6-½) Born: May 7, 1990 in Adelaide, Australia au Citizenship: Australia au",Australia 
17,6,640,0,1,0,0,0,1,0,0,12,9,1,6,6,6,,,"Demi Koulizakis Demi Koulizakis Position: FW 170cm (5-6½) Born: March 13, 1998 (Age: 24-161d) in Sydney, Australia au Citizenship: Australia au Club: Perth Glory",Australia 
105,82,"7,389",4,2,4,0,0,11,0,0,55,84,1,47,169,123,0,1,"John Koutroumbis Johnny Koutroumbis Position: DF 183cm, 73kg (6-0, 161lb) Born: March 6, 1998 (Age: 24-168d) in Adelaide, Australia au Youth National Team: Australia au Club: Western Sydney Wanderers",Australia 
32,29,"2,604",0,0,0,0,0,8,0,,30,,,,,,,,"Ante Kovacevic Position: DF (CB) 186cm (6-1) Born: June 13, 1974 in Melbourne, Australia au Citizenship: Australia au",Australia 
11,9,712,0,0,0,0,0,3,0,,13,,,,,,,,"Sime Kovacevic Position: DF Born: July 21, 1987 Citizenship: Australia au",Australia 
13,5,555,1,0,1,0,0,2,0,,2,,,,,,,,"Antun Kovacic Antun Matthew Kovacic Position: DF (CB) 194cm (6-4) Born: July 10, 1981 in Melbourne, Australia au Citizenship: Australia au",Australia 
22,15,"1,364",0,0,0,0,0,8,0,0,17,14,0,15,17,14,0,1,"Talitha Kramer Position: DF Born: September 13, 1991 (Age: 30-342d) Citizenship: Australia au Club: Wellington Phoenix FC",Australia 
219,157,"14,360",36,25,36,0,1,39,0,0,175,178,69,253,20,49,2,0,"Robbie Kruse Robbie Thomas Kruse Position: FW-MF (AM) ▪  Footed: Right 179cm, 72kg (5-10, 159lb) Born: October 5, 1988 (Age: 33-320d) in Brisbane, Australia au National Team: Australia au Club: Melbourne Victory",Australia 
30,8,"1,051",7,2,7,0,0,5,1,0,31,19,1,4,2,12,,,"Alou Kuol Position: FW ▪  Footed: Right 175cm, 79kg (5-8½, 174lb) Born: September 27, 2000 (Age: 21-328d) in Shendi, Sudan sd Youth National Team: Australia au Club: Stuttgart Wages: € k Weekly ❌ Expires June 2025. Via Capology.",Australia 
6,3,83,0,,0,0,,0,0,0,1,,,,,,,,"Selin Kuralay Position: MF 165cm (5-4½) Born: January 25, 1985 in Melbourne, Australia au National Team: Australia au",Australia 
14,6,512,0,0,0,0,0,1,0,,15,,,,,,,,"Steve Kuzmanovski Position: FW Born: January 4, 1997 in Sydney, Australia au Youth National Team: Australia au",Australia 
148,91,"8,427",34,6,30,4,5,19,2,,102,,,,,,,,"Adam Kwasnik Adam John Kwasnik Position: FW 179cm, 76kg (5-10, 168lb) Born: May 31, 1983 in Sydney, Australia au Youth National Team: Australia au",Australia 
19,14,"1,016",0,1,0,0,0,5,1,,,,,,,,,,"Frankie Lagana Frank Lagana Position: MF (AM) 177cm (5-9½) Born: February 22, 1985 Citizenship: Australia au",Australia 
9,2,311,1,0,1,0,0,0,0,,3,,,,,,,,"George Lambadaridis Position: MF 186cm, 74kg (6-1, 163lb) Born: April 23, 1992 (Age: 30-120d) in Melbourne, Australia au Youth National Team: Australia au Club: Green Gully SC",Australia 
240,239,"21,375",0,0,0,0,0,6,0,0,3,31,0,1,2,5,0,1,"Mitchell Langerak Mitchell James Langerak Position: GK ▪  Footed: Right 192cm, 81kg (6-3½, 179lb) Born: August 22, 1988 (Age: 33-364d) in Emerald, Australia au National Team: Australia au Club: Nagoya Grampus",Australia 
7,3,327,0,0,0,0,0,1,0,0,3,3,0,1,10,8,0,0,"Patrick Langlois Patrick Luis Langlois Position: MF 179cm, 78kg (5-10, 172lb) Born: October 28, 1999 in Coronado, California, United States us Citizenship: Australia au  Other: United States",Australia 
24,8,984,0,0,0,0,0,1,0,0,13,8,2,13,8,14,0,0,"Brandon Lauton Brandon David Lauton Position: MF Born: March 3, 2000 (Age: 22-171d) Citizenship: Australia au  Other: South Africa Club: Hume City FC",Australia 
10,7,672,0,0,0,0,0,2,0,0,6,4,0,2,13,14,,,"Sadie Lawrence Sadie Lawrence Position: MF Born: June 3, 1993 (Age: 29-079d) Citizenship: Australia au Club: Perth Glory",Australia 
24,13,"1,180",2,4,2,0,0,6,0,0,19,15,5,6,7,4,,,"Luis Lawrie-Lattanzio Luis Marcus Nicola Lawrie-Lattanzio Position: FW 172cm, 68kg (5-7½, 150lb) Born: February 20, 2002 (Age: 20-182d) in Adelaide, Australia au Youth National Team: Australia au Club: York United",Australia 
29,27,"2,364",0,0,0,0,0,6,0,0,17,9,1,1,25,20,,,"Joshua Laws Joshua James Laws Position: DF 185cm, 78kg (6-½, 172lb) Born: February 26, 1998 (Age: 24-176d) in Glasgow, Scotland, United Kingdom sco Youth National Team: Australia au  Other: Scotland Club: Wellington Phoenix",Australia 
1,1,63,0,0,0,0,0,0,0,0,1,1,1,2,0,0,0,0,Janna Lawson Position: FW Citizenship: Australia au,Australia 
119,112,"9,761",2,1,2,0,0,28,2,,13,,,,,,,,"Stephen Laybutt Stephen John Laybutt Position: DF 189cm (6-2) Born: September 3, 1977 in Lithgow, Australia au Citizenship: Australia au",Australia 
211,156,"14,336",7,23,7,0,0,11,0,,95,,,,,,,,"Stan Lazaridis Stanley Lazaridis Position: DF-MF (WM, left) 175cm, 76kg (5-8½, 168lb) Born: August 16, 1972 in Perth, Australia au National Team: Australia au",Australia 
37,35,"3,069",2,0,2,0,0,7,1,,43,,,,,,,,"Daniel Leach Daniel James Leach Position: DF 188cm (6-2) Born: January 5, 1986 in Redcliffe, Australia au Youth National Team: Australia au",Australia 
8,6,586,0,0,0,0,0,0,0,0,9,1,0,16,8,16,0,0,"Daniel Leck Daniel James Leck Position: FW Born: February 16, 1999 Citizenship: Australia au",Australia 
283,208,"18,776",47,26,46,1,2,32,3,1,356,150,22,111,97,106,2,0,"Mathew Leckie Mathew Allan Leckie Position: FW-MF (AM-WM, right) ▪  Footed: 79% Right* 180cm, 78kg (5-10½, 172lb) Born: February 4, 1991 (Age: 31-198d) in Melbourne, Australia au National Team: Australia au Club: Melbourne City Instagram: @lecks.7",Australia 
12,10,893,3,0,2,1,1,3,0,0,14,6,0,20,11,19,0,0,"Kylie Ledbrook Position: MF 159cm (5-2½) Born: March 20, 1986 in Sydney, Australia au National Team: Australia au",Australia 
223,218,"19,297",7,4,7,0,0,65,4,0,238,0,0,0,0,0,0,0,"Adrian Leijer Position: DF (CB-FB) 186cm, 83kg (6-1, 183lb) Born: March 25, 1986 in Dubbo, Australia au Youth National Team: Australia au",Australia 
3,3,270,0,0,0,0,0,1,0,0,0,0,0,0,0,0,0,0,"Aaron Lennox Position: GK ▪  Footed: Right 191cm, 82kg (6-3, 181lb) Born: February 19, 1993 (Age: 29-183d) Youth National Team: Australia au Club: Montrose FC",Australia 
26,11,"1,138",0,1,0,0,0,3,0,0,19,8,0,14,28,28,0,0,"Anthony Lesiotis Position: DF Born: April 24, 2000 (Age: 22-119d) Citizenship: Australia au Club: Melbourne City",Australia 
14,4,405,1,0,1,0,0,1,0,,6,,,,,,,,"Matthew Lewis Matthew John Lewis Position: MF (WM, left) 173cm (5-8) Born: June 6, 1990 in Sydney, Australia au Citizenship: Australia au",Australia 
249,200,"17,912",7,5,7,0,0,62,1,0,386,73,1,23,132,64,0,1,"Vince Lia Vincent Lia Position: MF (DM) 177cm, 73kg (5-9½, 161lb) Born: March 18, 1985 in Shepparton, Australia au Youth National Team: Australia au",Australia 
7,6,556,0,1,0,0,0,0,0,0,0,0,0,0,0,1,,,"Chloe Lincoln Chloe Lincoln Position: GK Born: January 4, 2005 (Age: 17-229d) Citizenship: Australia au Club: Canberra United",Australia 
2,0,13,0,0,0,0,0,0,0,,0,,,,,,,,"Ben Litfin Position: FW-MF Born: March 25, 1995 in Gold Coast, Australia au Citizenship: Australia au  Other: Austria",Australia 
9,2,290,0,0,0,0,0,0,0,0,2,2,1,5,2,2,0,0,"Abbey Lloyd Position: MF Born: June 13, 1996 Citizenship: Australia au",Australia 
12,1,206,0,0,0,0,0,0,0,0,5,4,2,1,4,6,,,"Jez Lofthouse Jez Lofthouse Position: FW Born: October 16, 1999 (Age: 22-309d) Citizenship: Australia au Club: Brisbane Roar",Australia 
64,50,"4,388",6,3,5,1,2,7,0,0,33,61,3,45,41,27,1,0,"Chloe Logarzo Position: MF ▪  Footed: 86% Right* 165cm, 50kg (5-4½, 110lb) Born: December 22, 1994 (Age: 27-242d) in Sydney, Australia au National Team: Australia au Club: Kansas City Current Twitter: @CLogarzo Instagram: @chloelogarzo",Australia 
1,1,90,0,0,0,0,0,0,0,,,,,,,,,,"Alison Logue Position: GK Born: June 3, 1987 Citizenship: Australia au",Australia 
