MP,games_starts,minutes,goals,assists,goals_pens,pens_made,pens_att,cards_yellow,cards_red,cards_yellow_red,fouls,fouled,offsides,crosses,interceptions,tackles_won,pens_won,pens_conceded,main_info,country
1,1,90,0,0,0,0,0,0,0,0,,,,,,,,,"Waris Aboky Gbètognon Waris Aboky Position: MF Born: July 20, 1997 in Cotonou, Benin bj National Team: Benin bj",Benin 
190,182,"16,347",3,1,3,0,0,53,6,1,142,59,3,1,72,51,0,1,"Khaled Adénon Abdoul Khaled Akiola Adenon Position: DF-MF (CB-DM) ▪  Footed: 80% Right* 181cm, 69kg (5-11, 152lb) Born: July 28, 1985 (Age: 37-024d) in Allahé, Benin bj National Team: Benin bj  Other: Côte d'Ivoire",Benin 
224,167,"15,321",9,8,9,0,0,45,0,0,156,34,0,16,59,49,0,2,"Jordan Adéoti Position: DF-MF (CB-DM) ▪  Footed: Right 183cm, 73kg (6-0, 161lb) Born: March 12, 1989 (Age: 33-162d) in Toulouse, France fr National Team: Benin bj  Other: France Club: Laval",Benin 
13,2,329,0,1,0,0,0,2,0,0,,,,,,,,,"Ryan-Segon Adigo Position: FW 181cm (5-11) Born: April 15, 2001 (Age: 21-128d) in Lübeck, Germany de National Team: Benin bj  Other: Germany",Benin 
86,68,"6,046",3,0,3,0,0,10,0,0,29,7,1,1,32,14,0,0,"Moise Adilehou Position: DF (CB) ▪  Footed: Right 190cm, 83kg (6-2½, 183lb) Born: November 1, 1995 (Age: 26-293d) in Colombes, France fr National Team: Benin bj  Other: France",Benin 
4,4,360,0,,0,0,0,2,0,0,,,,,,,,,"Anicet Adjamossi Anicet Kayodé Adjamossi Position: DF 176cm, 66kg (5-9, 146lb) Born: March 15, 1984 in Porto-Novo, Benin bj National Team: Benin bj",Benin 
60,53,"4,589",0,,0,0,,7,1,0,,,,,,,,,"Jean-Marc Adjovi-Bocco Position: DF 184cm, 81kg (6-0, 179lb) Born: December 22, 1963 in Cotonou, Benin bj National Team: Benin bj",Benin 
133,96,"8,732",22,20,19,3,4,16,3,1,44,5,0,25,5,3,0,0,"Yannick Aguemon Position: FW-MF ▪  Footed: Right 180cm, 73kg (5-10½, 161lb) Born: February 11, 1992 (Age: 30-191d) in Cotonou, Benin bj National Team: Benin bj  Other: France Club: OH Leuven",Benin 
10,2,338,2,0,2,0,0,1,0,0,4,10,0,11,5,10,,,"Joris Ahlinvi Joris Rudolph Elavagnon Ahlinvi Position: FW Born: July 13, 1995 in Benin, Benin bj Citizenship: Benin bj Draft: FC Cincinnati, 3rd round (53rd overall), 2020 MLS Draft (from Indiana)",Benin 
45,17,"1,691",2,0,2,0,0,2,0,0,44,33,3,16,10,32,0,1,"Matteo Ahlinvi Position: MF ▪  Footed: 82% Left* 183cm, 68kg (6-0, 150lb) Born: July 2, 1999 (Age: 23-050d) in Arcachon, France fr National Team: Benin bj  Other: France Club: Dijon",Benin 
55,35,"3,146",1,1,1,0,0,5,1,,,,,,,,,,"Jocelyn Ahouéya Position: MF (CM-DM) 175cm, 67kg (5-8½, 148lb) Born: December 19, 1985 in Abomey, Benin bj National Team: Benin bj",Benin 
1,1,90,0,0,0,0,0,0,0,0,,,,,,,,,"Christophe Aïfimi Christophe Aïfimi Adelhbola Position: GK ▪  Footed: Right 184cm, 76kg (6-0, 168lb) Born: August 21, 1989 Citizenship: Benin bj  Other: Côte d'Ivoire",Benin 
68,52,"4,398",19,5,19,0,0,12,1,1,65,69,20,96,27,29,,,"Tosin Aiyegun Position: FW-MF 179cm, 74kg (5-10, 163lb) Born: June 26, 1998 (Age: 24-056d) in Lagos, Nigeria ng National Team: Benin bj  Other: Nigeria Club: FC Zurich",Benin 
9,6,415,1,0,1,0,0,2,0,,,,,,,,,,"Christian Akande Kotchoni Position: FW ▪  Footed: Right 195cm (6-4½) Born: July 20, 1988 in Parakou, Benin bj Citizenship: Benin bj",Benin 
44,42,"3,788",17,,17,0,0,12,0,0,,,,,,,,,"Samson Akinyoola Samson Olanrewaju Akinyoola Position: FW Born: March 3, 2000 (Age: 22-171d) in Benin, Benin bj Citizenship: Benin bj Club: Caracas",Benin 
136,136,"12,216",0,0,0,0,0,8,0,0,2,3,0,0,0,2,0,1,"Saturnin Allagbé Position: GK ▪  Footed: 92% Right* 187cm, 79kg (6-1½, 174lb) Born: November 22, 1993 (Age: 28-272d) in Mauritania mr National Team: Benin bj Club: Dijon Wages: € 6k Weekly ❌ Expires June 2024. Via Capology.",Benin 
21,18,"1,589",0,0,0,0,0,3,0,,,,,,,,,,"Moudachirou Amadou Position: DF (CB) 184cm (6-0) Born: December 11, 1971 in Cotonou, Benin bj National Team: Benin bj",Benin 
6,3,270,0,0,0,0,0,1,0,0,,,,,,,,,"Pascal Angan Jean Louis Pascal Angan Position: MF (AM) 178cm, 78kg (5-10, 172lb) Born: April 19, 1986 in Odienné, Côte d'Ivoire ci National Team: Benin bj  Other: Côte d'Ivoire",Benin 
7,2,277,0,0,0,0,0,0,0,0,,,,,,,,,"Mohamed Aoudou Mohamed Aoudou Golanne Position: FW 190cm, 87kg (6-2½, 192lb) Born: February 19, 1990 in Aplahoué, Benin bj National Team: Benin bj",Benin 
21,14,"1,313",1,1,1,0,0,5,0,0,10,3,0,22,9,7,,,"Youssouf Assogba Youssouf Amouda Assogba Position: DF ▪  Footed: Right 173cm, 69kg (5-8, 152lb) Born: August 21, 2001 (Age: 21-000d, Happy Birthday!) in Benin, Benin bj National Team: Benin bj Club: Jönköpings Södra",Benin 
28,22,"1,911",1,0,1,0,0,5,1,,11,,,,,,,,"Yosif Ayuba Position: DF-MF 173cm (5-8) Born: November 30, 1990 in Benin bj Citizenship: Benin bj",Benin 
1,1,90,0,0,0,0,0,0,0,0,,,,,,,,,"Mama Bah-Yéré Sanni Mama Bah-Yéré Position: DF Born: July 22, 1992 in Benin, Benin bj National Team: Benin bj",Benin 
,,,,,,,,,,,,,,,,,,,"Richard Bakary Position: DF ▪  Footed: Right Born: October 17, 1997 in Porto-Novo, Benin bj National Team: Benin bj",Benin 
2,1,117,0,0,0,0,0,1,0,0,,,,,,,,,"Salim Bawa Salim Fadil Bawa Position: MF ▪  Footed: Both 184cm, 76kg (6-0, 168lb) Born: June 26, 1998 (Age: 24-056d) in Benin, Benin bj National Team: Benin bj",Benin 
1,0,1,0,0,0,0,0,0,0,0,,,,,,,,,"Roland Béakou Roland Junior Béakou Position: FW Born: August 28, 2001 (Age: 20-358d) in Benin, Benin bj National Team: Benin bj Club: ESAE FC",Benin 
1,1,90,0,,0,0,0,0,0,0,,,,,,,,,"Guillaume Bemenou Position: GK 192cm, 83kg (6-3½, 183lb) Born: August 5, 1984 in La Tronche, France fr National Team: Benin bj  Other: France",Benin 
6,0,96,1,0,1,0,0,0,0,0,,,,,,,,,"Jacques Bessan Position: FW ▪  Footed: Both 183cm (6-0) Born: September 15, 1993 in Abomey, Benin bj National Team: Benin bj",Benin 
194,137,"12,272",25,14,24,1,1,10,0,0,78,0,0,0,0,0,0,0,"Romuald Boco Position: MF ▪  Footed: Right 178cm, 68kg (5-10, 150lb) Born: July 8, 1985 in Bernay, France fr National Team: Benin bj  Other: France",Benin 
4,2,215,0,0,0,0,0,0,0,0,,,,,,,,,"Jérôme Bonou Jérôme Agossa Bonou Position: MF Born: January 27, 1994 in Benin, Benin bj National Team: Benin bj",Benin 
2,1,97,0,0,0,0,0,1,0,0,,,,,,,,,"Chamouss-Deen Chaona Mouhamed Chamouss-Deen Chaona Position: MF ▪  Footed: Right 185cm, 83kg (6-½, 183lb) Born: October 24, 1996 National Team: Benin bj",Benin 
4,1,159,0,0,0,0,0,0,0,0,0,4,1,2,0,0,,,"Ange Chibozo Ange Josué Chibozo Position: FW Born: July 1, 2003 (Age: 19-051d) in Benin, Benin bj National Team: Benin bj Club: Amiens",Benin 
1,1,72,0,0,0,0,0,0,0,0,,,,,,,,,"Rachad Chitou Position: GK Born: September 18, 1976 National Team: Benin bj",Benin 
26,26,"2,254",1,0,1,0,0,8,1,,,,,,,,,,"Damien Chrysostome Koffi Damien Anderson Chrysostome Position: DF 181cm, 78kg (5-11, 172lb) Born: May 24, 1982 in Cotonou, Benin bj National Team: Benin bj",Benin 
130,98,"8,038",2,0,2,0,0,39,2,1,136,87,1,20,65,67,0,0,"Sessi D'Almeida Position: MF (CM) ▪  Footed: Right 178cm, 79kg (5-10, 174lb) Born: November 20, 1995 (Age: 26-274d) in Bordeaux, France fr National Team: Benin bj  Other: France Club: Pau FC",Benin 
58,43,"3,591",9,4,7,2,2,4,0,,30,,,,,,,,"Laurent D'Jaffo Laurent Mayaba D'Jaffo Position: FW 183cm (6-0) Born: November 5, 1970 in Bazas, France fr National Team: Benin bj",Benin 
2,0,54,0,0,0,0,0,0,0,0,,,,,,,,,"Marcel Dandjinou Souke Marcel Dandjinou Position: GK ▪  Footed: Right 182cm, 78kg (5-11½, 172lb) Born: June 25, 1998 (Age: 24-057d) in Ganvié, Benin bj National Team: Benin bj Club: JDR Stars FC",Benin 
129,72,"6,748",8,9,8,0,0,14,0,0,77,16,3,34,5,5,0,0,"David Djigla Position: FW-MF ▪  Footed: Right 180cm, 78kg (5-10½, 172lb) Born: August 23, 1995 in Avakpa, Benin bj National Team: Benin bj",Benin 
1,0,56,0,,0,0,0,0,0,0,,,,,,,,,"Koffi Dognon Koffi Nicolas Dognon Born: June 16, 1989 in Niamèy, Niger ne National Team: Benin bj  Other: Belgium",Benin 
102,68,"5,981",21,7,21,0,0,7,0,0,90,106,48,151,40,49,1,0,"Jodel Dossou Position: FW-MF (AM, right) ▪  Footed: 94% Right* 180cm, 69kg (5-10½, 152lb) Born: March 17, 1992 (Age: 30-157d) in Cotonou, Benin bj National Team: Benin bj Club: Clermont Foot Wages: € 8k Weekly ❌ Expires June 2023. Via Capology.",Benin 
1,1,90,0,0,0,0,0,0,0,0,,,,,,,,,"Jules Elegbede Position: FW Born: October 12, 1993 in Benin, Benin bj National Team: Benin bj",Benin 
1,1,120,0,,0,0,0,0,0,0,,,,,,,,,"Emmanuel Fabiyi Emmanuel Olaniyi Fabiyi Position: GK 170cm, 71kg (5-6½, 157lb) Born: October 9, 1986 National Team: Benin bj",Benin 
9,2,331,0,0,0,0,0,1,0,0,,,,,,,,,"Abdel Fadel Suanon Position: FW 182cm, 69kg (5-11½, 152lb) Born: June 24, 1995 (Age: 27-058d) in Parakou, Benin bj National Team: Benin bj Club: Al Kharitiyat",Benin 
247,246,"21,943",0,0,0,0,0,16,1,0,7,12,0,0,2,2,0,1,"Fabien Farnolle Fabien Ceddy Farnolle Position: GK ▪  Footed: Right 196cm, 107kg (6-5, 236lb) Born: September 21, 1984 in Bordeaux, France fr National Team: Benin bj  Other: France",Benin 
5,4,365,0,0,0,0,0,1,0,0,,,,,,,,,"Rodrigue Fassinou Rodrigue Yves Fassinou Position: DF ▪  Footed: Right 178cm, 69kg (5-10, 152lb) Born: December 16, 1995 (Age: 26-248d) in Adjohoun, Benin bj National Team: Benin bj Club: ESAE FC",Benin 
4,4,360,0,0,0,0,0,1,0,0,,,,,,,,,"Lazadi Fousséni Position: DF-MF 166cm, 58kg (5-5, 128lb) Born: June 30, 1993 in Parakou, Benin bj National Team: Benin bj",Benin 
56,49,"4,301",0,3,0,0,0,15,2,,,,,,,,,,"Alain Gaspoz Position: DF-MF 172cm (5-7½) Born: May 16, 1970 in Fribourg, Switzerland ch National Team: Benin bj",Benin 
296,151,"14,993",67,21,64,3,3,25,1,0,212,31,20,7,11,18,0,0,"Rudy Gestede Rudolphe Gestede Position: FW ▪  Footed: Right 193cm, 87kg (6-3½, 192lb) Born: October 10, 1988 in Essey-lès-Nancy, France fr National Team: Benin bj  Other: France",Benin 
1,1,90,0,0,0,0,0,0,0,0,,,,,,,,,"Steve Glodjinon Steve Sitiophe Glodjinon Position: GK ▪  Footed: Right 180cm, 59kg (5-10½, 130lb) Born: December 18, 1993 in Hozin, Benin bj National Team: Benin bj",Benin 
10,0,172,0,1,0,0,0,0,0,0,6,0,0,7,1,4,,,"Charbel Gomez Position: FW 182cm, 64kg (5-11½, 141lb) Born: January 27, 2001 (Age: 21-206d) in Pobé, Benin bj National Team: Benin bj Club: Amiens",Benin 
59,40,"3,680",22,6,14,8,8,9,0,0,60,1,0,1,0,0,0,0,"Frédéric Gounongbe Frédéric Vinami Henri Gounongbe Position: FW ▪  Footed: Left 190cm, 84kg (6-2½, 185lb) Born: May 1, 1988 in Brussels, Belgium be National Team: Benin bj  Other: Belgium",Benin 
54,15,"1,626",2,1,2,0,0,2,0,0,27,18,7,14,21,20,0,1,"Femi Hollinger-Janzen Oluwafemi Hollinger-Janzen Position: MF 188cm (6-2) Born: December 14, 1993 in Cotonou, Benin bj Citizenship: Benin bj Draft: New England Revolution, 3rd round (51st overall), 2016 MLS Draft (from Indiana)",Benin 
1,1,83,0,0,0,0,0,1,1,1,,,,,,,,,"Gaston Houngbédji Position: MF Born: February 5, 1988 in Benin, Benin bj National Team: Benin bj",Benin 
35,6,962,2,0,2,0,0,1,0,0,16,7,5,22,6,2,,,"Andreas Hountondji Position: FW ▪  Footed: Right 175cm, 63kg (5-8½, 139lb) Born: July 11, 2002 (Age: 20-041d) Citizenship: Benin bj  Other: France Club: US Quevilly",Benin 
204,195,"17,586",5,2,5,0,0,24,2,0,173,31,2,3,169,74,0,0,"Cédric Hountondji Position: DF (CB, right) ▪  Footed: 82% Right* 194cm, 84kg (6-4, 185lb) Born: January 19, 1994 (Age: 28-214d) in Toulouse, France fr National Team: Benin bj  Other: France Club: Angers Wages: € 12k Weekly ✅ Expires June 2023. Via Capology.",Benin 
3,0,38,0,0,0,0,0,0,0,0,,,,,,,,,"Aaron Ibilola Position: FW Born: December 10, 1997 (Age: 24-254d) in Benin, Benin bj Citizenship: Benin bj Club: Icasa",Benin 
176,155,"13,587",2,6,2,0,0,26,3,0,85,18,1,42,45,25,0,0,"Emmanuel Imorou Position: DF (FB, left) ▪  Footed: 96% Left* 181cm, 79kg (5-11, 174lb) Born: September 16, 1988 in Bourges, France fr National Team: Benin bj  Other: France",Benin 
7,1,119,0,0,0,0,0,0,1,0,4,0,0,2,2,0,,,"Zeidane Inoussa Position: FW ▪  Footed: Right 179cm, 67kg (5-10, 148lb) Born: May 13, 2002 (Age: 20-100d) in Hässelby, Sweden se Citizenship: Benin bj  Other: Sweden Club: Caen",Benin 
230,219,"18,962",35,5,35,0,0,58,3,0,264,0,0,0,0,0,0,0,"Réda Johnson Position: DF 191cm, 78kg (6-3, 172lb) Born: March 21, 1988 (Age: 34-153d) in Marseille, France fr National Team: Benin bj  Other: France Club: Dover Athletic",Benin 
128,122,"10,735",3,3,3,0,0,22,2,1,62,0,0,0,0,0,0,0,"David Kiki Position: DF ▪  Footed: Left 180cm, 76kg (5-10½, 168lb) Born: November 25, 1993 (Age: 28-269d) in Pobé, Benin bj National Team: Benin bj Club: Farul Constanța",Benin 
3,1,96,0,0,0,0,0,0,0,0,,,,,,,,,"Nouhoum Kobéna Nouihoum Kobenan Position: MF 184cm, 62kg (6-0, 137lb) Born: January 5, 1985 in Parakou, Benin bj National Team: Benin bj",Benin 
9,4,416,1,0,1,0,0,2,0,0,,,,,,,,,"Rodrigue Kossi Rodrigue Kossi Fiogbé Position: MF ▪  Footed: Right 178cm, 72kg (5-10, 159lb) Born: December 31, 1999 (Age: 22-233d) in Benin, Benin bj National Team: Benin bj Club: Club Africain",Benin 
86,47,"4,354",14,6,14,0,0,12,4,1,28,0,0,0,0,0,0,0,"Omar Kossoko Position: FW-MF (WM) ▪  Footed: Left 186cm, 72kg (6-1, 159lb) Born: March 10, 1988 in Mantes-la-Jolie, France fr Citizenship: Benin bj  Other: France",Benin 
158,138,"12,318",4,4,4,0,0,21,0,0,92,0,0,0,0,0,0,0,"Djiman Koukou Djiman Waidi Koukou Position: MF ▪  Footed: Right 185cm, 82kg (6-½, 181lb) Born: November 14, 1990 (Age: 31-280d) in Porto-Novo, Benin bj National Team: Benin bj Club: Les Herbiers VF",Benin 
1,1,90,0,0,0,0,0,0,0,0,,,,,,,,,"Dine Koukpéré Kamarou-Dine Koukpéré Position: DF Born: February 21, 1993 in Benin, Benin bj National Team: Benin bj",Benin 
9,1,191,0,0,0,0,0,0,0,0,,,,,,,,,"Marcellin Koukpo Marcellin Dègnon Koukpo Position: FW ▪  Footed: Right 176cm, 68kg (5-9, 150lb) Born: April 6, 1995 (Age: 27-137d) in Cotonou, Benin bj National Team: Benin bj Club: CS Constantine",Benin 
83,61,"5,476",5,2,5,0,0,12,2,,,,,,,,,,"Moussa Latoundji Position: MF 182cm (5-11½) Born: August 13, 1978 in Porto-Novo, Benin bj National Team: Benin bj",Benin 
1,0,22,0,0,0,0,0,0,0,0,,,,,,,,,"Friday Martin's Position: FW Born: February 3, 1990 in Benin, Benin bj National Team: Benin bj",Benin 
22,21,"1,730",1,0,1,0,0,6,1,1,,,,,,,,,"Arsène Menessou Position: DF (FB, right) 180cm, 73kg (5-10½, 161lb) Born: December 15, 1987 in Abidjan, Côte d'Ivoire ci National Team: Benin bj  Other: Côte d'Ivoire",Benin 
1,1,90,0,0,0,0,0,0,0,0,,,,,,,,,Henry Monsang Tesong Position: FW Citizenship: Benin bj,Benin 
228,169,"15,558",60,17,56,4,5,19,3,1,350,171,112,53,53,63,1,0,"Steve Mounié Position: FW ▪  Footed: 85% Right* 190cm, 83kg (6-2½, 183lb) Born: September 29, 1994 (Age: 27-326d) in Parakou, Benin bj National Team: Benin bj Club: Brest Wages: € 16k Weekly ✅ Expires June 2024. Via Capology.",Benin 
8,8,665,0,1,0,0,0,3,3,2,,,,,,,,,"Nana Nafihou Nana Nafiou Badarou Position: DF 180cm, 78kg (5-10½, 172lb) Born: July 18, 1991 in Cotonou, Benin bj National Team: Benin bj",Benin 
4,4,353,0,,0,0,0,0,0,0,,,,,,,,,"Jean Ogouchi Ayike Jean Ogouchi Position: DF 187cm, 71kg (6-1½, 157lb) Born: November 23, 1995 in Benin, Benin bj National Team: Benin bj",Benin 
1,1,90,0,0,0,0,0,0,0,0,,,,,,,,,"Ibrahim Ogoulola Position: MF 176cm, 64kg (5-9, 141lb) Born: February 3, 2000 (Age: 22-199d) in Cotonou, Benin bj National Team: Benin bj",Benin 
89,64,"5,608",11,11,11,0,0,4,0,,,,,,,,,,"Mouritala Ogunbiyi Mouritala Ola Ogounbiyi Position: FW-MF (AM) ▪  Footed: Right 174cm, 63kg (5-8½, 139lb) Born: October 10, 1982 in Bohicon, Benin bj National Team: Benin bj  Other: Nigeria",Benin 
10,2,289,0,0,0,0,0,0,0,0,11,6,3,3,5,2,,,"Junior Olaitan Junior Olaitan Ishola Position: MF ▪  Footed: Right 174cm, 77kg (5-8½, 170lb) Born: May 9, 2002 (Age: 20-104d) National Team: Benin bj Club: Niort",Benin 
2,0,12,0,,0,0,0,0,0,0,,,,,,,,,"Oscar Olou Position: MF 176cm, 67kg (5-9, 148lb) Born: November 16, 1987 in Ouidah, Benin bj National Team: Benin bj",Benin 
77,52,"4,684",21,6,21,0,0,6,1,,66,,,,,,,,"Razak Omotoyossi Position: FW 177cm, 82kg (5-9½, 181lb) Born: October 8, 1985 in Lagos, Nigeria ng National Team: Benin bj  Other: Nigeria",Benin 
5,4,420,0,0,0,0,0,2,0,0,,,,,,,,,"Fortuné Oré Fortuné Wills Oré Position: DF ▪  Footed: Left 183cm (6-0) Born: October 26, 1997 in Benin, Benin bj National Team: Benin bj",Benin 
1,1,90,0,0,0,0,0,0,0,0,,,,,,,,,"Djalilou Ouorou Abdoul Djalilou Tchagnirou Ouorou Position: DF ▪  Footed: Both Born: July 18, 1997 in Benin, Benin bj National Team: Benin bj",Benin 
4,2,168,1,0,1,0,0,2,0,,,,,,,,,,"Sidoine Oussou Position: FW 176cm, 72kg (5-9, 159lb) Born: November 14, 1992 National Team: Benin bj",Benin 
123,90,"8,263",26,13,26,0,0,22,1,,84,,,,,,,,"Mickaël Poté Position: FW ▪  Footed: Right 179cm, 83kg (5-10, 183lb) Born: September 24, 1984 (Age: 37-331d) in Lyon, France fr National Team: Benin bj  Other: France",Benin 
1,1,90,0,0,0,0,0,0,0,0,,,,,,,,,"Kola Raïmi Kowiyou Kola Raïmi Position: MF Born: July 15, 1995 in Benin, Benin bj National Team: Benin bj",Benin 
38,36,"3,137",0,1,0,0,0,12,0,0,40,26,0,13,36,35,,,"Yohan Roche Position: DF ▪  Footed: Right 182cm, 78kg (5-11½, 172lb) Born: July 7, 1997 (Age: 25-045d) in Lyon, France fr National Team: Benin bj  Other: France Club: Adanaspor",Benin 
15,14,"1,304",0,0,0,0,0,3,0,0,,,,,,,,,"Junior Salomon Salomon Junior Position: DF (CB) ▪  Footed: Right 184cm, 74kg (6-0, 163lb) Born: April 8, 1986 in Abomey, Benin bj National Team: Benin bj",Benin 
47,32,"2,903",6,1,6,0,0,4,0,0,80,18,30,57,7,19,0,0,"Désiré Segbé Azankpo Position: FW 180cm, 69kg (5-10½, 152lb) Born: May 6, 1993 (Age: 29-107d) in Allahé, Benin bj National Team: Benin bj Club: USL Dunkerque",Benin 
2,1,77,0,0,0,0,0,1,0,0,,,,,,,,,"Arnaud Séka Sylvestre Arnaud Seka Position: FW-MF 155cm, 78kg (5-1, 172lb) Born: October 30, 1985 in Abomey, Benin bj National Team: Benin bj",Benin 
393,351,"30,693",48,49,44,4,4,44,7,1,400,159,3,161,43,44,0,0,"Stéphane Sessègnon Position: FW-MF (AM-WM) ▪  Footed: 96% Right* 168cm, 72kg (5-6, 159lb) Born: June 1, 1984 in Allahé, Benin bj National Team: Benin bj",Benin 
12,12,935,0,0,0,0,0,1,1,,,,,,,,,,"Félicien Singbo Félicien Houenou Singbo Position: DF 186cm (6-1) Born: October 25, 1980 in Abomey, Benin bj National Team: Benin bj",Benin 
2,0,55,0,,0,0,0,0,0,0,,,,,,,,,"Didier Sossa Position: MF 179cm, 78kg (5-10, 172lb) Born: November 13, 1993 in Porto-Novo, Benin bj National Team: Benin bj",Benin 
165,102,"9,351",28,23,24,4,5,22,0,0,147,104,16,71,20,47,0,1,"Cebio Soukou Position: FW-MF (AM) 184cm, 83kg (6-0, 183lb) Born: October 2, 1992 (Age: 29-323d) in Bochum, Germany de National Team: Benin bj  Other: Germany Club: Sandhausen",Benin 
27,15,"1,413",1,0,1,0,0,1,0,,,,,,,,,,"Oumar Tchomogo Position: FW 179cm (5-10) Born: January 7, 1978 in Bohicon, Benin bj National Team: Benin bj",Benin 
5,5,447,0,0,0,0,0,0,0,0,,,,,,,,,"Séïdath Tchomogo Séïdath Konabe Tchomogo Position: MF 179cm, 74kg (5-10, 163lb) Born: August 13, 1985 in Porto-Novo, Benin bj National Team: Benin bj",Benin 
10,2,190,0,1,0,0,0,1,0,0,0,0,0,0,0,0,,,"Anaane Tidjani Position: MF ▪  Footed: Right 170cm, 76kg (5-6½, 168lb) Born: March 29, 1997 (Age: 25-145d) National Team: Benin bj",Benin 
25,25,"2,250",1,0,1,0,0,8,0,0,,,,,,,,,"Mohamed Tijani Position: DF Born: July 10, 1997 (Age: 25-042d) National Team: Benin bj  Other: Côte d'Ivoire Club: Viktoria Plzeň",Benin 
125,57,"5,628",14,8,13,1,1,8,0,0,57,22,8,33,11,11,0,0,"Jonathan Tinhan Position: FW-MF ▪  Footed: Right 178cm, 68kg (5-10, 150lb) Born: June 1, 1989 in Échirolles, France fr Citizenship: Benin bj  Other: France",Benin 
2,1,130,0,0,0,0,0,0,0,0,,,,,,,,,"Eric Tossavi Position: DF 183cm, 68kg (6-0, 150lb) Born: May 24, 1992 in Cotonou, Benin bj National Team: Benin bj",Benin 
97,93,"8,294",5,1,5,0,0,19,3,0,0,0,0,0,0,0,0,0,"Olivier Verdon Position: DF (CB) ▪  Footed: 84% Right* 191cm, 55kg (6-3, 121lb) Born: October 5, 1995 (Age: 26-320d) in Clamart, France fr National Team: Benin bj  Other: France Club: Ludogorets Razgrad",Benin 
4,3,226,0,0,0,0,0,0,0,0,,,,,,,,,"Nabil Yarou Abdel Nabil Yarou Position: DF 183cm, 74kg (6-0, 163lb) Born: June 16, 1993 (Age: 29-066d) in Parakou, Benin bj National Team: Benin bj Club: Enyimba International FC",Benin 
