MP,games_starts,minutes,goals,assists,goals_pens,pens_made,pens_att,cards_yellow,cards_red,cards_yellow_red,fouls,fouled,offsides,crosses,interceptions,tackles_won,pens_won,pens_conceded,main_info,country
8,8,682,0,0,0,0,0,0,0,0,2,3,0,1,7,9,,,"Lai Wei-ju Wei-ju Lai Position: DF Born: July 31, 1994 (Age: 28-023d) National Team: Chinese Taipei tw",Chinese Taipei 
9,5,506,0,,0,0,0,2,0,0,,,,,,,,,"Chuang Wei-lun Chuang Wei-lun (莊偉倫) 莊偉倫 Position: FW-MF 174cm, 68kg (5-8½, 150lb) Born: March 17, 1982 in Chinese Taipei tw National Team: Chinese Taipei tw",Chinese Taipei 
3,3,270,1,0,1,0,0,0,0,0,,,,,,,,,"Huang Wei-min Wei-min Huang Position: DF 176cm, 74kg (5-9, 163lb) Born: August 16, 1988 National Team: Chinese Taipei tw",Chinese Taipei 
6,1,151,0,0,0,0,0,1,0,0,,,,,,,,,"Weng Wei-Pin 翁偉賓 Position: DF 175cm, 66kg (5-8½, 146lb) Born: November 23, 1991 in Chinese Taipei tw National Team: Chinese Taipei tw",Chinese Taipei 
8,8,693,3,,3,0,0,0,0,0,,,,,,,,,"Huang Wei-yi Huang Wei-yi (黃瑋儀) 黃瑋儀 Position: FW 168cm (5-6) Born: September 11, 1985 in Yilan, Chinese Taipei tw National Team: Chinese Taipei tw",Chinese Taipei 
3,2,182,0,,0,0,0,0,0,0,,,,,,,,,"Ju Wen-bin Ju Wen-bin (朱文彬) Position: DF Born: July 5, 1969 in Chinese Taipei tw National Team: Chinese Taipei tw",Chinese Taipei 
5,5,410,0,0,0,0,0,0,0,0,,,,,,,,,"Liao Wen-chi Wen-chi Liao Position: GK Born: August 8, 1997 (Age: 25-015d) National Team: Chinese Taipei tw",Chinese Taipei 
21,21,"1,890",0,0,0,0,0,1,0,0,,,,,,,,,"Pan Wen-chieh 潘文傑 (足球運動員) Position: GK 183cm, 74kg (6-0, 163lb) Born: June 29, 1992 (Age: 30-055d) in Chinese Taipei tw National Team: Chinese Taipei tw Club: Tainan City FC",Chinese Taipei 
1,1,90,0,0,0,0,0,0,0,0,,,,,,,,,"Liu Wen-lin Wen-lin Liu Position: DF Born: February 9, 2000 National Team: Chinese Taipei tw",Chinese Taipei 
8,8,659,2,,2,0,0,3,0,0,,,,,,,,,"Chang Wu-yeh Chang Wu-yeh (張武業) 張武業 Position: DF-MF 176cm (5-9) Born: December 19, 1978 in T’ai-chung Hsien, Chinese Taipei tw National Team: Chinese Taipei tw",Chinese Taipei 
1,0,11,0,0,0,0,0,0,0,0,,,,,,,,,"Yang Ya-han Position: FW Born: March 1, 1991 National Team: Chinese Taipei tw",Chinese Taipei 
1,1,58,0,0,0,0,0,0,0,0,,,,,,,,,"Lin Ya-hui Ya-hui Lin Position: MF Born: November 27, 1991 National Team: Chinese Taipei tw",Chinese Taipei 
3,3,270,1,,1,0,0,0,0,0,,,,,,,,,"Chuang Yao-tsung Yao-tsung Chuang Position: FW Born: March 18, 1977 National Team: Chinese Taipei tw",Chinese Taipei 
40,31,"2,484",0,2,0,0,0,7,1,1,40,18,1,11,40,33,0,1,"Yaki Yen Position: DF (CB) 175cm, 68kg (5-8½, 150lb) Born: April 21, 1989 (Age: 33-124d) in Puerto del Rosario, Spain es National Team: Chinese Taipei tw  Other: Spain Club: Wuhan Three Towns FC",Chinese Taipei 
9,8,710,0,0,0,0,0,0,0,0,2,3,0,6,5,9,,,"Pan Yen-hsin Yen-hsin Pan Position: DF Born: February 18, 1996 (Age: 26-186d) National Team: Chinese Taipei tw",Chinese Taipei 
11,10,835,5,0,5,0,0,0,0,0,5,4,1,4,3,7,,,"Chen Yen-ping Yen-ping Chen Position: FW Born: August 20, 1991 (Age: 31-003d) National Team: Chinese Taipei tw",Chinese Taipei 
4,2,186,0,0,0,0,0,1,0,0,,,,,,,,,"Wu Yen-shu Yen-shu Wu Position: MF Born: October 21, 1999 (Age: 22-306d) National Team: Chinese Taipei tw",Chinese Taipei 
4,0,30,0,0,0,0,0,0,0,0,,,,,,,,,"Hsu Yi Yi Hsu Position: MF 169cm, 64kg (5-6½, 141lb) Born: October 21, 1989 (Age: 32-306d) National Team: Chinese Taipei tw Club: Air Source Development FC",Chinese Taipei 
2,0,37,0,0,0,0,0,0,0,0,,,,,,,,,"Li Yi-wen Yi-wen Li Position: FW Born: September 20, 2005 (Age: 16-337d) National Team: Chinese Taipei tw",Chinese Taipei 
6,4,365,0,0,0,0,0,0,0,0,3,1,0,11,2,2,,,"Hsu Yi-yun Yi-yun Hsu Position: MF Born: April 29, 1997 (Age: 25-116d) National Team: Chinese Taipei tw",Chinese Taipei 
1,0,4,0,0,0,0,0,0,0,0,,,,,,,,,"Kuo Yin-hung Yin-hung Kuo Position: MF 176cm, 73kg (5-9, 161lb) Born: February 27, 1983 National Team: Chinese Taipei tw",Chinese Taipei 
4,1,136,1,0,1,0,0,0,0,0,0,2,0,2,1,4,,,"Chen Ying-hui Ying-hui Chen Position: MF Born: October 5, 1998 (Age: 23-322d) National Team: Chinese Taipei tw",Chinese Taipei 
3,2,138,0,0,0,0,0,1,0,0,,,,,,,,,"Komori Yoshitaka Komori Yoshitaka Position: MF Born: March 27, 1987 (Age: 35-149d) in Japan jp National Team: Chinese Taipei tw  Other: Japan",Chinese Taipei 
2,2,180,0,0,0,0,0,0,0,0,,,,,,,,,"Lan Yu-chieh Yu-chieh Lan Position: MF Born: November 16, 2000 (Age: 21-280d) National Team: Chinese Taipei tw",Chinese Taipei 
10,10,836,4,0,4,0,0,0,0,0,6,7,5,7,1,5,,,"Su Yu-hsuan Yu-hsuan Su Position: FW Born: February 21, 2001 (Age: 21-183d) National Team: Chinese Taipei tw",Chinese Taipei 
11,10,945,0,0,0,0,0,1,0,0,,,,,,,,,"Chiu Yu-hung 邱育宏 Position: GK 185cm, 76kg (6-½, 168lb) Born: August 31, 1994 (Age: 27-357d) in Chinese Taipei tw National Team: Chinese Taipei tw Club: Taiwan Power Company FC",Chinese Taipei 
1,1,54,0,0,0,0,0,0,0,0,,,,,,,,,"Wei Yu-jen Position: MF 160cm, 59kg (5-2½, 130lb) Born: January 14, 1994 National Team: Chinese Taipei tw",Chinese Taipei 
1,0,6,0,,0,0,0,0,0,0,,,,,,,,,"Lee Yu-shan Yu-shan Lee Position: FW Born: August 19, 1988 National Team: Chinese Taipei tw",Chinese Taipei 
13,3,440,0,1,0,0,0,0,0,0,,,,,,,,,"Ko Yu-ting Position: FW 165cm, 59kg (5-4½, 130lb) Born: January 18, 1994 (Age: 28-217d) National Team: Chinese Taipei tw Club: Taiwan Power Company FC",Chinese Taipei 
6,2,229,0,0,0,0,0,0,0,0,,,,,,,,,"Lin Yueh-han Position: DF 179cm, 67kg (5-10, 148lb) Born: February 16, 1993 National Team: Chinese Taipei tw",Chinese Taipei 
6,6,540,0,0,0,0,0,3,0,0,,,,,,,,,"Chen Yulin Position: DF (FB) 167cm, 64kg (5-5½, 141lb) Born: October 21, 1985 National Team: Chinese Taipei tw",Chinese Taipei 
2,2,180,0,,0,0,0,0,0,0,,,,,,,,,"Chang Yung-hsien Yung-hsien Chang Position: DF 175cm, 72kg (5-8½, 159lb) Born: November 10, 1982 National Team: Chinese Taipei tw",Chinese Taipei 
12,12,"1,065",0,,0,0,0,3,0,0,,,,,,,,,"Cheng Yung-jen Cheng Yung-jen (鄭勇仁) Position: DF-MF (DM) Born: January 24, 1977 in Chinese Taipei tw National Team: Chinese Taipei tw",Chinese Taipei 
