MP,games_starts,minutes,goals,assists,goals_pens,pens_made,pens_att,cards_yellow,cards_red,cards_yellow_red,fouls,fouled,offsides,crosses,interceptions,tackles_won,pens_won,pens_conceded,main_info,country
2,2,132,0,,0,0,0,1,0,0,,,,,,,,,"Chen Bing-shin Bing-shin Chen Position: MF Born: April 3, 1982 National Team: Chinese Taipei tw",Chinese Taipei 
1,1,45,0,0,0,0,0,0,0,0,,,,,,,,,"Kuo Chan-yu Chan-yu Kuo Position: DF Born: August 11, 1982 National Team: Chinese Taipei tw",Chinese Taipei 
21,7,857,0,0,0,0,0,0,0,0,,,,,,,,,"Lin Chang-Lun 林昌倫 Position: FW 172cm, 60kg (5-7½, 132lb) Born: June 28, 1991 (Age: 31-056d) in Chinese Taipei tw National Team: Chinese Taipei tw Club: Taiwan Power Company FC",Chinese Taipei 
2,1,164,0,,0,0,0,0,0,0,,,,,,,,,"Chen Chang-min Chang-min Chen Position: DF Born: October 9, 1983 National Team: Chinese Taipei tw",Chinese Taipei 
21,8,866,2,1,2,0,0,2,0,0,,,,,,,,,"Chen Chao-An 陳昭安 Position: FW 175cm, 68kg (5-8½, 150lb) Born: June 22, 1995 (Age: 27-062d) in Chinese Taipei tw National Team: Chinese Taipei tw Club: Taiwan Power Company FC",Chinese Taipei 
3,3,252,0,,0,0,0,1,0,0,,,,,,,,,"Lin Che-min Che-min Lin Position: DF Born: December 16, 1985 National Team: Chinese Taipei tw",Chinese Taipei 
3,3,270,0,,0,0,0,0,0,0,,,,,,,,,"Huang Che-ming Huang Che-ming (黃哲明) 黃哲明 Position: FW 182cm (5-11½) Born: June 12, 1972 in Chinese Taipei tw National Team: Chinese Taipei tw",Chinese Taipei 
5,3,256,0,0,0,0,0,0,0,0,,,,,,,,,"Lin Che-Yu 林哲宇 Position: MF 169cm, 68kg (5-6½, 150lb) Born: February 11, 1993 in Chinese Taipei tw National Team: Chinese Taipei tw",Chinese Taipei 
7,5,362,0,0,0,0,0,0,0,0,,,,,,,,,"Chan Che-Yuan 詹哲淵 Position: MF 174cm, 67kg (5-8½, 148lb) Born: October 23, 1989 National Team: Chinese Taipei tw",Chinese Taipei 
206,198,"17,346",1,11,1,0,0,41,0,0,4,,,,,,,,"Xavier Chen Position: DF (FB, right) ▪  Footed: Right 174cm, 68kg (5-8½, 150lb) Born: October 5, 1983 in Berchem-Sainte-Agathe, Belgium be National Team: Chinese Taipei tw  Other: Belgium",Chinese Taipei 
1,0,21,0,0,0,0,0,0,0,0,,,,,,,,,"Jhou Cheng Cheng Jhou Position: FW Born: November 12, 1996 National Team: Chinese Taipei tw",Chinese Taipei 
6,6,540,0,,0,0,0,0,0,0,,,,,,,,,"Yang Cheng-hsing Yang Cheng-hsing (楊振興) 楊振興 Position: GK Born: August 19, 1973 in Chinese Taipei tw National Team: Chinese Taipei tw",Chinese Taipei 
6,3,247,0,,0,0,0,1,0,0,,,,,,,,,"Huang Cheng-tsung Cheng-tsung Huang Position: MF Born: October 11, 1985 National Team: Chinese Taipei tw",Chinese Taipei 
4,4,360,0,0,0,0,0,0,0,0,,,,,,,,,"Lin Cheng-yi Position: DF 187cm, 82kg (6-1½, 181lb) Born: September 30, 1987 (Age: 34-327d) National Team: Chinese Taipei tw Club: Taiwan Power Company FC",Chinese Taipei 
11,5,535,0,0,0,0,0,0,0,0,2,2,2,2,2,5,,,"Ting Chi Chi Ting Position: MF Born: June 2, 1995 (Age: 27-082d) National Team: Chinese Taipei tw",Chinese Taipei 
2,1,57,0,0,0,0,0,0,0,0,3,0,0,1,1,2,,,"Chang Chi-lan Chi-lan Chang Position: MF Born: September 18, 1996 (Age: 25-339d) National Team: Chinese Taipei tw",Chinese Taipei 
1,0,55,0,,0,0,0,0,0,0,,,,,,,,,"Wang Chia-cheng Chia-cheng Wang Position: FW Born: August 14, 1983 National Team: Chinese Taipei tw",Chinese Taipei 
5,2,265,0,0,0,0,0,1,0,0,,,,,,,,,"Chen Chia-chun Chia-chun Chen Position: DF 175cm, 68kg (5-8½, 150lb) Born: October 13, 1991 National Team: Chinese Taipei tw",Chinese Taipei 
7,3,296,0,2,0,0,0,0,0,0,,,,,,,,,"Yu Chia-huang Chia-huang Yu Position: FW 170cm, 64kg (5-6½, 141lb) Born: April 23, 1998 (Age: 24-122d) National Team: Chinese Taipei tw Club: Tainan City FC",Chinese Taipei 
2,0,72,0,,0,0,0,0,0,0,,,,,,,,,"Tu Chia-po Chia-po Tu Position: MF Born: July 11, 1980 National Team: Chinese Taipei tw",Chinese Taipei 
1,0,13,0,,0,0,0,0,0,0,,,,,,,,,"Lin Chia-sheng Lin Chia-sheng (林家聖) 林家聖 Position: MF 182cm (5-11½) Born: July 12, 1980 in Tainan, Chinese Taipei tw National Team: Chinese Taipei tw",Chinese Taipei 
1,0,9,0,0,0,0,0,0,0,0,0,0,0,1,0,0,,,"Ting Chia-ying Chia-ying Ting Position: MF Born: January 25, 2002 (Age: 20-210d) National Team: Chinese Taipei tw",Chinese Taipei 
4,4,315,0,,0,0,0,0,0,0,,,,,,,,,"Wang Chien-hsiang Chien-hsiang Wang Position: DF Born: November 20, 1977 National Team: Chinese Taipei tw",Chinese Taipei 
7,6,537,0,0,0,0,0,0,0,0,,,,,,,,,"Lin Chien-Hsun 林建勛 Position: MF 170cm, 71kg (5-6½, 157lb) Born: January 10, 1993 in Chinese Taipei tw National Team: Chinese Taipei tw",Chinese Taipei 
5,5,378,0,0,0,0,0,0,0,0,,,,,,,,,"Wang Chien-ming Chien-ming Wang Position: DF ▪  Footed: Right 181cm (5-11) Born: July 4, 1993 in Seogwipo-si, Korea Republic kr National Team: Chinese Taipei tw  Other: Korea Republic",Chinese Taipei 
8,7,625,0,,0,0,0,1,0,0,,,,,,,,,"Liang Chien-wei Chien-wei Liang Position: DF Born: June 24, 1983 National Team: Chinese Taipei tw",Chinese Taipei 
4,3,282,0,,0,0,0,0,0,0,,,,,,,,,"Lo Chih-an 羅志安 Position: FW-MF 165cm, 69kg (5-4½, 152lb) Born: December 28, 1988 in Yilan, Chinese Taipei tw National Team: Chinese Taipei tw",Chinese Taipei 
9,6,574,0,0,0,0,0,0,0,0,,,,,,,,,"Lo Chih-en 羅志恩 Position: FW 165cm, 64kg (5-4½, 141lb) Born: December 28, 1988 in Yilan, Chinese Taipei tw National Team: Chinese Taipei tw",Chinese Taipei 
31,31,"2,746",5,2,5,0,0,2,0,0,,,,,,,,,"Wen Chih-hao 溫智豪 Position: FW 171cm, 63kg (5-7, 139lb) Born: March 25, 1993 (Age: 29-151d) National Team: Chinese Taipei tw Club: Beijing Enterprises Group FC",Chinese Taipei 
2,0,47,0,1,0,0,0,0,0,0,,,,,,,,,"Lai Chih-hsuan Chih-hsuan Lai Position: FW Born: July 29, 1995 National Team: Chinese Taipei tw",Chinese Taipei 
4,3,206,0,0,0,0,0,0,0,0,,,,,,,,,"Tseng Chih-Wei 曾志偉 Position: FW ▪  Footed: Right 169cm, 63kg (5-6½, 139lb) Born: November 2, 1991 in Chinese Taipei tw National Team: Chinese Taipei tw",Chinese Taipei 
1,0,25,0,0,0,0,0,0,0,0,,,,,,,,,"Chen Ching-hsuan Ching-hsuan Chen Position: FW 184cm, 79kg (6-0, 174lb) Born: September 12, 1990 National Team: Chinese Taipei tw",Chinese Taipei 
1,1,66,0,,0,0,0,1,0,0,,,,,,,,,"Wu Ching-wen Ching-wen Wu Position: DF Born: February 18, 1967 National Team: Chinese Taipei tw",Chinese Taipei 
2,1,111,0,0,0,0,0,0,0,0,,,,,,,,,"Nien Ching-yun Ching-yun Nien Position: MF Born: February 18, 2002 (Age: 20-186d) National Team: Chinese Taipei tw",Chinese Taipei 
4,3,250,0,0,0,0,0,0,0,0,,,,,,,,,"Victor Chou Víctor Zi-hsuan Chou Hsieh Position: DF-MF (CM) 178cm, 68kg (5-10, 150lb) Born: February 5, 1992 in Madrid, Spain es National Team: Chinese Taipei tw  Other: Spain",Chinese Taipei 
127,106,"9,542",6,6,6,0,0,38,3,1,189,61,2,139,82,89,0,0,"Tim Chow Position: MF (CM) ▪  Footed: Right 180cm, 66kg (5-10½, 146lb) Born: January 18, 1994 (Age: 28-217d) in Wigan, England, United Kingdom eng National Team: Chinese Taipei tw  Other: England Club: Chengdu Better City FC",Chinese Taipei 
4,4,360,0,,0,0,0,0,0,0,,,,,,,,,"Tu Chu-hsien Tu Chu-hsien (涂居賢) Position: DF-MF 178cm (5-10) Born: August 10, 1979 in Kaohsiung, Chinese Taipei tw National Team: Chinese Taipei tw",Chinese Taipei 
1,1,90,0,0,0,0,0,1,0,0,,,,,,,,,"Lee Chun-chia Chun-chia Lee Position: DF 173cm, 68kg (5-8, 150lb) Born: May 11, 1993 National Team: Chinese Taipei tw",Chinese Taipei 
33,21,"2,000",8,1,8,0,0,1,0,0,,,,,,,,,"Wu Chun-ching 吳俊青 Position: MF 180cm, 76kg (5-10½, 168lb) Born: December 18, 1988 (Age: 33-248d) in Chinese Taipei tw National Team: Chinese Taipei tw Club: Tainan City FC",Chinese Taipei 
9,9,754,0,,0,0,0,1,0,0,,,,,,,,,"Wu Chun-i Chun-i Wu Position: MF 174cm, 73kg (5-8½, 161lb) Born: October 10, 1970 National Team: Chinese Taipei tw",Chinese Taipei 
11,9,834,0,,0,0,0,0,0,0,,,,,,,,,"Kuo Chun-yi Chun-yi Kuo Position: MF Born: May 9, 1982 National Team: Chinese Taipei tw",Chinese Taipei 
1,1,90,0,0,0,0,0,0,0,0,,,,,,,,,"Lin Ci-hui Ci-hui Lin Position: MF Born: October 11, 1999 National Team: Chinese Taipei tw",Chinese Taipei 
6,5,403,0,1,0,0,0,2,0,0,,,,,,,,,"Su De-cai De-cai Su Position: MF 175cm, 74kg (5-8½, 163lb) Born: June 21, 1990 (Age: 32-063d) National Team: Chinese Taipei tw Club: Tainan City FC",Chinese Taipei 
18,16,"1,328",4,1,4,0,0,2,0,0,,,,,,,,,"Onur Dogan Position: FW 183cm, 69kg (6-0, 152lb) Born: September 8, 1987 (Age: 34-349d) in Çanakkale, Turkey tr National Team: Chinese Taipei tw  Other: Turkey Club: Tatung FC",Chinese Taipei 
13,4,641,0,1,0,0,0,0,0,0,,,,,,,,,"Will Donkin William Rupert James Donkin Position: MF Born: December 26, 2000 (Age: 21-240d) in Oxford, England, United Kingdom eng National Team: Chinese Taipei tw  Other: England Club: Mosta FC",Chinese Taipei 
18,5,637,1,1,1,0,0,2,0,0,,,,,,,,,"Emilio Estevez Emilio Lin-ching Estevez Tsai Position: MF 170cm (5-6½) Born: October 8, 1998 (Age: 23-319d) National Team: Chinese Taipei tw  Other: Canada Club: Ourense CF",Chinese Taipei 
3,2,181,0,,0,0,0,0,0,0,,,,,,,,,"Chu Fong-yi Position: GK Born: August 30, 1989 (Age: 32-358d) National Team: Chinese Taipei tw",Chinese Taipei 
3,3,217,0,,0,0,0,0,0,0,,,,,,,,,"Chang Fu-hsiang Fu-hsiang Chang Position: MF 172cm, 64kg (5-7½, 141lb) Born: February 15, 1982 National Team: Chinese Taipei tw",Chinese Taipei 
2,2,179,1,,1,0,0,0,0,0,,,,,,,,,"Chang Han Chang Han (張涵) 張涵 Position: FW 170cm, 77kg (5-6½, 170lb) Born: December 25, 1985 in Hualian, Chinese Taipei tw National Team: Chinese Taipei tw",Chinese Taipei 
1,1,90,0,0,0,0,0,1,0,0,,,,,,,,,"Chen Han-wei Han-wei Chen Position: MF ▪  Footed: Right 174cm, 68kg (5-8½, 150lb) Born: November 3, 1980 National Team: Chinese Taipei tw",Chinese Taipei 
6,5,452,0,0,0,0,0,2,0,0,,,,,,,,,"Cheng Hao Hao Cheng Position: DF Born: January 13, 1997 (Age: 25-222d) National Team: Chinese Taipei tw Club: Tainan City FC",Chinese Taipei 
7,7,495,0,,0,0,0,3,1,1,,,,,,,,,"Kao Hao-chieh Kao Hao-chieh (高豪傑) 高豪傑 Position: DF 187cm, 73kg (6-1½, 161lb) Born: July 24, 1980 in Chinese Taipei tw National Team: Chinese Taipei tw",Chinese Taipei 
1,1,59,0,0,0,0,0,0,0,0,,,,,,,,,"Chang Hao-wei Hao-wei Chang Position: MF 168cm, 64kg (5-6, 141lb) Born: February 24, 1992 (Age: 30-180d) National Team: Chinese Taipei tw Club: Tainan City FC",Chinese Taipei 
28,26,"2,212",5,1,5,0,0,6,1,1,,,,,,,,,"Chen Hao-wei 陳浩瑋 Position: MF 170cm, 59kg (5-6½, 130lb) Born: April 30, 1992 (Age: 30-115d) in Hualien, Chinese Taipei tw National Team: Chinese Taipei tw",Chinese Taipei 
3,0,17,1,0,1,0,0,0,0,0,,,,,,,,,"Hsu Heng-pin Heng-pin Hsu Position: MF 182cm, 77kg (5-11½, 170lb) Born: April 17, 1993 (Age: 29-128d) National Team: Chinese Taipei tw",Chinese Taipei 
10,6,553,0,0,0,0,0,0,0,0,,,,,,,,,"Yen Ho-shen 嚴和生 Position: MF 179cm, 74kg (5-10, 163lb) Born: December 31, 1990 (Age: 31-235d) in Chinese Taipei tw National Team: Chinese Taipei tw Club: Taiwan Power Company FC",Chinese Taipei 
9,6,612,1,0,1,0,0,0,0,0,1,0,0,0,4,0,,,"Wang Hsiang-huei Position: MF Born: September 28, 1987 (Age: 34-329d) National Team: Chinese Taipei tw",Chinese Taipei 
7,3,278,0,0,0,0,0,1,0,0,,,,,,,,,"Lee Hsiang-wei Hsiang-wei Lee Position: FW Born: April 15, 1996 (Age: 26-130d) National Team: Chinese Taipei tw Club: Taiwan Power Company FC",Chinese Taipei 
3,2,225,0,,0,0,0,0,0,0,,,,,,,,,"Chen Hsiao-wei Hsiao-wei Chen Position: FW Born: January 20, 1984 National Team: Chinese Taipei tw",Chinese Taipei 
1,1,90,0,,0,0,0,0,0,0,,,,,,,,,"Yeh Hsien-chung Yeh Hsien-chung (葉獻中) 葉獻中 Position: GK 178cm (5-10) Born: July 1, 1979 in Chinese Taipei tw National Team: Chinese Taipei tw",Chinese Taipei 
3,3,270,0,,0,0,0,0,0,0,,,,,,,,,"Tsai Hsien-tang Tsai Hsien-tang (蔡憲棠) 蔡憲棠 Position: DF-MF (DM) 186cm, 83kg (6-1, 183lb) Born: April 29, 1977 in Chinese Taipei tw National Team: Chinese Taipei tw",Chinese Taipei 
8,0,149,0,0,0,0,0,0,0,0,2,0,0,1,1,0,,,"Lin Hsin-hui Hsin-hui Lin Position: FW Born: February 6, 2002 (Age: 20-198d) National Team: Chinese Taipei tw",Chinese Taipei 
1,0,10,0,,0,0,0,0,0,0,,,,,,,,,"Tsou Hsin-ni Position: MF Born: January 11, 1995 National Team: Chinese Taipei tw",Chinese Taipei 
10,8,659,0,0,0,0,0,1,0,0,1,1,2,1,0,4,,,"Lee Hsiu-chin Position: FW Born: August 18, 1992 (Age: 30-005d) National Team: Chinese Taipei tw",Chinese Taipei 
2,2,180,3,,3,0,0,0,0,0,,,,,,,,,"Yu Hsiu-chin Yu Hsiu Chin Position: MF Born: June 1, 1990 in Chinese Taipei tw National Team: Chinese Taipei tw",Chinese Taipei 
3,1,46,0,0,0,0,0,0,0,0,,,,,,,,,"Liu Hsiu-mei Born: November 28, 1972 National Team: Chinese Taipei tw",Chinese Taipei 
2,0,35,0,,0,0,0,0,0,0,,,,,,,,,"Ho Hsuan-yi Hsuan-yi Ho Position: MF Born: November 14, 1995 National Team: Chinese Taipei tw",Chinese Taipei 
8,8,712,0,,0,0,0,1,0,0,,,,,,,,,"Tsai Hui-kai Hui-kai Tsai Position: DF Born: April 29, 1977 National Team: Chinese Taipei tw",Chinese Taipei 
3,1,128,0,,0,0,0,0,0,0,,,,,,,,,"Tai Hung-hsu Tai Hung-hsu (戴宏旭) 戴宏旭 Position: FW 182cm, 94kg (5-11½, 207lb) Born: October 4, 1987 in Chinese Taipei tw National Team: Chinese Taipei tw",Chinese Taipei 
1,0,39,0,0,0,0,0,0,0,0,,,,,,,,,"Chiu I-Huan 邱奕寰 Position: FW 175cm, 66kg (5-8½, 146lb) Born: March 15, 1990 in Chinese Taipei tw National Team: Chinese Taipei tw",Chinese Taipei 
1,0,1,0,,0,0,0,0,0,0,,,,,,,,,"Hsu Jen-feng Hsu Jen-feng (許人丰) 許人丰 Position: GK 178cm, 73kg (5-10, 161lb) Born: April 28, 1979 in Chinese Taipei tw National Team: Chinese Taipei tw",Chinese Taipei 
8,8,720,0,,0,0,0,0,0,0,,,,,,,,,"Chen Jeng-i Chen Jeng-i (陳正一) Position: DF 168cm (5-6) Born: January 23, 1974 in Kaohsiung, Chinese Taipei tw National Team: Chinese Taipei tw",Chinese Taipei 
4,4,286,0,0,0,0,0,0,0,0,,,,,,,,,"Lee Jian-liang Jian-liang Lee Position: DF 168cm, 68kg (5-6, 150lb) Born: August 10, 1991 in Huaihua, China PR cn National Team: Chinese Taipei tw  Other: China PR",Chinese Taipei 
3,3,222,0,,0,0,0,0,0,0,,,,,,,,,"Chen Jiunn-ming Chen Jiunn-ming (陳俊明) Position: MF Born: June 30, 1970 in Changhua, Chinese Taipei tw National Team: Chinese Taipei tw",Chinese Taipei 
1,0,24,0,,0,0,0,1,0,0,,,,,,,,,"Hsu Jui-chen Jui-chen Hsu Position: MF Born: October 19, 1970 National Team: Chinese Taipei tw",Chinese Taipei 
11,7,598,0,0,0,0,0,0,0,0,,,,,,,,,"Chen Jui-chieh Jui-chieh Chen Position: FW 176cm, 74kg (5-9, 163lb) Born: July 15, 1995 (Age: 27-039d) National Team: Chinese Taipei tw Club: Tainan City FC",Chinese Taipei 
4,4,331,3,,3,0,0,0,0,0,,,,,,,,,"Chen Jui-te Jui-te Chen Position: FW Born: November 6, 1973 National Team: Chinese Taipei tw",Chinese Taipei 
5,3,275,0,3,0,0,0,0,0,0,2,2,0,6,3,4,,,"Wu Kai-ching Kai-ching Wu Position: MF Born: November 14, 1999 (Age: 22-282d) National Team: Chinese Taipei tw",Chinese Taipei 
7,6,399,1,0,1,0,0,1,0,0,,,,,,,,,"Hung Kai-chun 黃楷俊 Position: FW 166cm, 58kg (5-5, 128lb) Born: March 4, 1987 National Team: Chinese Taipei tw",Chinese Taipei 
4,3,263,0,0,0,0,0,0,0,0,,,,,,,,,"Li Kai-jie Position: FW Born: July 22, 1996 National Team: Chinese Taipei tw",Chinese Taipei 
2,2,170,0,,0,0,0,0,0,0,,,,,,,,,"Lin Kai-ling Position: DF Born: September 21, 1991 National Team: Chinese Taipei tw",Chinese Taipei 
2,0,60,0,,0,0,0,0,0,0,,,,,,,,,"Pan Kuao-kai Kuao-kai Pan Position: MF 168cm, 73kg (5-6, 161lb) Born: November 13, 1979 National Team: Chinese Taipei tw",Chinese Taipei 
9,9,804,0,,0,0,0,0,0,0,,,,,,,,,"Lin Kuei-pin Kuei-pin Lin Position: MF Born: October 21, 1978 National Team: Chinese Taipei tw",Chinese Taipei 
14,14,"1,169",0,0,0,0,0,2,0,0,,,,,,,,,"Lu Kun-chi 呂昆錡 Position: GK 185cm, 79kg (6-½, 174lb) Born: February 6, 1985 in Tainan, Chinese Taipei tw National Team: Chinese Taipei tw",Chinese Taipei 
1,0,45,0,,0,0,0,1,0,0,,,,,,,,,"Kung Kun-liang Kun-liang Kung Position: MF Born: February 24, 1980 National Team: Chinese Taipei tw",Chinese Taipei 
1,1,90,0,,0,0,0,0,0,0,,,,,,,,,"Chen Kun-shan Kun-shan Chen Position: FW Born: January 15, 1972 National Team: Chinese Taipei tw",Chinese Taipei 
7,6,504,6,0,5,1,1,0,0,0,2,1,0,12,2,4,,,"Lai Li-chin Position: FW Born: August 15, 1988 (Age: 34-008d) National Team: Chinese Taipei tw",Chinese Taipei 
11,9,838,1,0,1,0,0,1,0,0,4,11,0,8,7,3,,,"Zhuo Li-ping Li-ping Zhuo Position: MF Born: September 29, 1999 (Age: 22-328d) National Team: Chinese Taipei tw",Chinese Taipei 
5,5,405,0,0,0,0,0,0,0,0,,,,,,,,,"Jhuo Li-shan Li-shan Jhuo Position: MF Born: October 20, 1996 National Team: Chinese Taipei tw",Chinese Taipei 
1,0,1,0,0,0,0,0,0,0,0,,,,,,,,,"Pan Li-wei Li-wei Pan Position: MF Born: November 1, 1995 National Team: Chinese Taipei tw",Chinese Taipei 
22,16,"1,227",4,1,4,0,0,2,1,1,,,,,,,,,"Li Mao Mao Li Position: FW Born: November 2, 1992 (Age: 29-294d) National Team: Chinese Taipei tw",Chinese Taipei 
1,1,90,0,0,0,0,0,0,0,0,,,,,,,,,"Yang Mei-chuan Mei-chuan Yang Position: FW Born: April 19, 1997 National Team: Chinese Taipei tw",Chinese Taipei 
4,2,214,1,0,1,0,0,0,0,0,,,,,,,,,"Lin Mei-chun Position: FW Born: January 11, 1974 National Team: Chinese Taipei tw",Chinese Taipei 
3,2,202,0,0,0,0,0,1,0,0,,,,,,,,,"Lee Meng-chian Position: DF 176cm, 78kg (5-9, 172lb) Born: December 5, 1981 National Team: Chinese Taipei tw",Chinese Taipei 
4,2,196,0,0,0,0,0,1,0,0,,,,,,,,,"Liang Meng-hsin Meng-hsin Liang Position: MF Born: April 3, 2003 (Age: 19-142d) National Team: Chinese Taipei tw",Chinese Taipei 
4,2,205,0,,0,0,0,0,0,0,,,,,,,,,"Hsieh Meng-hsuan Meng-hsuan Hsieh Position: MF 172cm, 64kg (5-7½, 141lb) Born: May 12, 1986 National Team: Chinese Taipei tw",Chinese Taipei 
6,5,468,0,,0,0,0,2,0,0,,,,,,,,,"Tu Ming-feng Ming-feng Tu Position: DF Born: February 13, 1982 National Team: Chinese Taipei tw",Chinese Taipei 
4,4,333,0,0,0,0,0,0,0,0,,,,,,,,,"Chiang Ming-han 蔣明翰 Position: DF 178cm, 78kg (5-10, 172lb) Born: October 6, 1986 in Chinese Taipei tw National Team: Chinese Taipei tw",Chinese Taipei 
1,1,86,0,0,0,0,0,0,0,0,,,,,,,,,"Chao Ming-hsiu Ming-hsiu Chao Position: MF Born: July 9, 1997 National Team: Chinese Taipei tw",Chinese Taipei 
2,2,180,0,0,0,0,0,1,0,0,1,0,0,0,0,0,,,"Tsai Ming-jung Position: GK Born: January 23, 1989 (Age: 33-212d) National Team: Chinese Taipei tw",Chinese Taipei 
5,2,189,0,0,0,0,0,0,0,0,,,,,,,,,"Lin Ming-wei Ming-wei Lin Position: FW Born: May 20, 2001 (Age: 21-095d) National Team: Chinese Taipei tw Club: Tainan City FC",Chinese Taipei 
4,1,102,0,,0,0,0,0,0,0,,,,,,,,,"Wu Pai-ho Wu Pai-ho (吳百和) 吳百和 Position: MF 172cm, 68kg (5-7½, 150lb) Born: November 29, 1987 in Chinese Taipei tw National Team: Chinese Taipei tw",Chinese Taipei 
3,2,212,2,0,2,0,0,0,0,0,,,,,,,,,"Michelle Pao Position: MF Born: September 1, 1992 in Chinese Taipei tw National Team: Chinese Taipei tw Draft: Sky Blue FC, 3rd round (24th overall), 2014 NWSL Draft (from Pepperdine)",Chinese Taipei 
8,8,720,0,,0,0,0,2,0,0,,,,,,,,,"Feng Pao-hsing Feng Pao-hsing (馮保興) Position: MF 172cm (5-7½) Born: August 18, 1982 in Chinese Taipei tw National Team: Chinese Taipei tw",Chinese Taipei 
1,1,90,0,,0,0,0,0,0,0,,,,,,,,,"Kao Pei-ling Pei-ling Kao Position: MF Born: December 23, 1996 National Team: Chinese Taipei tw",Chinese Taipei 
3,3,221,0,0,0,0,0,0,0,0,,,,,,,,,"Wei Pei-lun Pei-lun Wei Position: DF 176cm, 69kg (5-9, 152lb) Born: February 28, 1990 National Team: Chinese Taipei tw",Chinese Taipei 
3,3,268,0,0,0,0,0,0,0,0,,,,,,,,,"Hsieh Peng-long Peng-long Hsieh Position: DF Born: November 13, 1998 (Age: 23-283d) National Team: Chinese Taipei tw",Chinese Taipei 
1,1,90,0,,0,0,0,0,0,0,,,,,,,,,"Chan Pi-han Position: MF Born: April 27, 1992 (Age: 30-118d) National Team: Chinese Taipei tw",Chinese Taipei 
2,2,180,1,0,1,0,0,1,0,0,,,,,,,,,"Lee Pin-hsien Pin-hsien Lee Position: DF 178cm, 72kg (5-10, 159lb) Born: June 14, 1989 National Team: Chinese Taipei tw",Chinese Taipei 
5,3,275,0,0,0,0,0,0,0,0,,,,,,,,,"Hsieh Po-an Po-an Hsieh Position: DF Born: November 3, 1994 (Age: 27-293d) National Team: Chinese Taipei tw Club: Taiwan Power Company FC",Chinese Taipei 
2,2,135,0,,0,0,0,1,0,0,,,,,,,,,"Lin Po-cheng Position: GK Born: October 18, 1985 National Team: Chinese Taipei tw",Chinese Taipei 
1,0,1,0,,0,0,0,0,0,0,,,,,,,,,"Chen Po-hao Po-hao Chen Position: FW 174cm, 71kg (5-8½, 157lb) Born: February 10, 1989 National Team: Chinese Taipei tw",Chinese Taipei 
57,47,"3,950",2,5,2,0,0,12,0,0,30,41,3,20,21,16,2,0,"Chen Po-liang Position: MF ▪  Footed: Right 180cm, 64kg (5-10½, 141lb) Born: August 11, 1988 (Age: 34-012d) National Team: Chinese Taipei tw Club: Changchun Yatai",Chinese Taipei 
4,3,186,0,,0,0,0,0,0,0,,,,,,,,,"Lin Po-yuan Po-yuan Lin Position: FW Born: November 8, 1982 National Team: Chinese Taipei tw",Chinese Taipei 
6,0,51,0,0,0,0,0,0,0,0,,,,,,,,,"Philip Ponder Philip John Ponder Position: DF 183cm, 77kg (6-0, 170lb) Born: February 23, 1997 in Arlington, Texas, United States us Youth National Team: Chinese Taipei tw  Other: United States",Chinese Taipei 
17,15,"1,332",1,0,1,0,0,2,0,0,,,,,,,,,"Wang Ruei Wang Rui Position: DF (CB) 181cm (5-11) Born: August 10, 1993 (Age: 29-013d) National Team: Chinese Taipei tw",Chinese Taipei 
1,0,4,0,0,0,0,0,0,0,0,,,,,,,,,"José Salazar José Eduardo Salazar Menéndez Position: DF 169cm, 58kg (5-6½, 128lb) Born: February 22, 1991 (Age: 31-182d) National Team: Chinese Taipei tw",Chinese Taipei 
9,3,280,0,0,0,0,0,1,0,0,,,,,,,,,"Miguel Sandberg Miguel Filip Sandberg Position: MF Born: August 5, 2002 (Age: 20-018d) in Sweden se Youth National Team: Chinese Taipei tw  Other: Sweden Club: Västerås",Chinese Taipei 
3,1,140,0,1,0,0,0,0,0,0,,,,,,,,,"Tu Shao-chieh Shao-chieh Tu Position: MF Born: January 2, 1999 (Age: 23-233d) National Team: Chinese Taipei tw",Chinese Taipei 
3,3,270,0,0,0,0,0,0,0,0,,,,,,,,,"Pai Shao-yu Shao-yu Pai Position: DF 177cm, 68kg (5-9½, 150lb) Born: January 20, 1998 (Age: 24-215d) National Team: Chinese Taipei tw Club: Tainan City FC",Chinese Taipei 
2,2,180,0,,0,0,0,0,0,0,,,,,,,,,"Tsai Sheng-an Sheng-an Tsai Position: DF 170cm, 64kg (5-6½, 141lb) Born: January 18, 1985 National Team: Chinese Taipei tw",Chinese Taipei 
1,0,45,0,,0,0,0,0,0,0,,,,,,,,,"Wei Sheng-hsin Sheng-hsin Wei Position: GK 170cm, 66kg (5-6½, 146lb) Born: April 21, 1989 National Team: Chinese Taipei tw",Chinese Taipei 
1,1,64,0,,0,0,0,0,0,0,,,,,,,,,"Cheng Sheng-jen Sheng-jen Cheng Position: DF Born: March 29, 1982 National Team: Chinese Taipei tw",Chinese Taipei 
2,1,103,0,0,0,0,0,0,0,0,,,,,,,,,"Liu Sheng-yi Position: MF 179cm, 69kg (5-10, 152lb) Born: November 21, 1995 National Team: Chinese Taipei tw",Chinese Taipei 
1,0,32,0,0,0,0,0,0,0,0,,,,,,,,,"Lin Shih-kai Shih-kai Lin Position: MF 186cm, 69kg (6-1, 152lb) Born: November 17, 1994 National Team: Chinese Taipei tw",Chinese Taipei 
7,2,274,1,,1,0,0,1,0,0,,,,,,,,,"Chiang Shih-lu Chiang Shih-lu (江世祿) 江世祿 Position: FW 180cm (5-10½) Born: December 16, 1982 in Chinese Taipei tw National Team: Chinese Taipei tw",Chinese Taipei 
1,1,90,0,0,0,0,0,0,0,0,,,,,,,,,"Wu Shih-ping Position: FW Born: July 13, 1992 National Team: Chinese Taipei tw",Chinese Taipei 
5,5,450,0,0,0,0,0,0,0,0,,,,,,,,,"Shih Shin-an Shin-an Shih Position: GK 184cm, 79kg (6-0, 174lb) Born: October 10, 1992 (Age: 29-317d) National Team: Chinese Taipei tw Club: Tatung FC",Chinese Taipei 
8,8,750,0,0,0,0,0,0,0,0,1,1,0,1,4,11,,,"Pan Shin-yu Shin-yu Pan Position: DF Born: May 3, 1997 (Age: 25-112d) National Team: Chinese Taipei tw",Chinese Taipei 
2,0,69,0,0,0,0,0,0,0,0,,,,,,,,,"Tseng Shu-o Tseng Shu-o (曾淑娥) 曾淑娥 Position: MF Born: September 6, 1984 in Kao-hsiung Hsien, Chinese Taipei tw National Team: Chinese Taipei tw",Chinese Taipei 
4,0,52,1,0,1,0,0,1,0,0,,,,,,,,,"Jiang Sin-long Sin-long Jiang Position: MF Born: February 4, 1997 National Team: Chinese Taipei tw",Chinese Taipei 
10,8,788,0,0,0,0,0,0,0,0,2,5,0,1,8,3,,,"Su Sin-yun Sin-yun Su Position: DF Born: November 20, 1996 (Age: 25-276d) National Team: Chinese Taipei tw",Chinese Taipei 
1,0,7,0,0,0,0,0,0,0,0,,,,,,,,,"Cheng Ssu-yu Ssu-yu Cheng Position: GK Born: September 25, 1989 (Age: 32-332d) National Team: Chinese Taipei tw Club: JEF United Chiba",Chinese Taipei 
8,7,648,0,0,0,0,0,0,0,0,2,2,0,0,6,2,,,"Chang Su-hsin Su-hsin Chang Position: DF Born: October 4, 1990 (Age: 31-323d) National Team: Chinese Taipei tw",Chinese Taipei 
1,1,45,0,0,0,0,0,0,0,0,,,,,,,,,"Yang Szu-wei Szu-wei Yang Position: FW Born: November 9, 1996 National Team: Chinese Taipei tw",Chinese Taipei 
1,0,28,0,,0,0,0,0,0,0,,,,,,,,,"Tseng Tai-lin Tseng Tai-lin (曾台霖) 曾台霖 Position: MF 173cm, 67kg (5-8, 148lb) Born: May 14, 1982 in Taipei, Chinese Taipei tw National Team: Chinese Taipei tw",Chinese Taipei 
4,4,360,1,0,1,0,0,0,0,0,,,,,,,,,"Chou Tai-ying Chou Tai-ying (周台英) 周台英 Position: FW-MF Born: August 16, 1963 in Chinese Taipei tw National Team: Chinese Taipei tw",Chinese Taipei 
35,33,"2,984",2,2,2,0,0,2,0,0,,,,,,,,,"Chen Ting-yang 陳庭揚 Position: DF-MF 180cm, 68kg (5-10½, 150lb) Born: September 28, 1992 (Age: 29-329d) in Chinese Taipei tw National Team: Chinese Taipei tw",Chinese Taipei 
3,3,270,0,,0,0,0,1,0,0,,,,,,,,,"Lin Tsung-jen Tsung-jen Lin Position: MF Born: January 3, 1983 National Team: Chinese Taipei tw",Chinese Taipei 
18,13,"1,230",0,0,0,0,0,1,0,0,,,,,,,,,"Hung Tzu-kuei Tzu-kuei Hung Position: DF Born: June 1, 1993 (Age: 29-083d) National Team: Chinese Taipei tw",Chinese Taipei 
3,2,189,0,0,0,0,0,0,0,0,2,0,0,2,0,1,,,"Chang Tzu-nuo Tzu-nuo Chang Position: DF Born: June 23, 1999 (Age: 23-061d) National Team: Chinese Taipei tw",Chinese Taipei 
2,1,135,0,0,0,0,0,0,0,0,,,,,,,,,"Pan Wei-chih Pan Wei-chih (潘威誌) 潘威誌 Position: GK 177cm, 69kg (5-9½, 152lb) Born: July 13, 1982 in Chinese Taipei tw National Team: Chinese Taipei tw",Chinese Taipei 
24,20,"1,904",1,0,1,0,0,4,0,0,,,,,,,,,"Chen Wei-Chuan 陳威全 Position: DF 183cm, 79kg (6-0, 174lb) Born: August 29, 1992 (Age: 29-359d) in Chinese Taipei tw National Team: Chinese Taipei tw Club: Tainan City FC",Chinese Taipei 
3,1,107,1,0,1,0,0,0,0,0,,,,,,,,,"Gao Wei-jie Wei-jie Gao Position: FW Born: June 24, 1997 (Age: 25-060d) National Team: Chinese Taipei tw Club: Taiwan Power Company FC",Chinese Taipei 
