MP,games_starts,minutes,goals,assists,goals_pens,pens_made,pens_att,cards_yellow,cards_red,cards_yellow_red,fouls,fouled,offsides,crosses,interceptions,tackles_won,pens_won,pens_conceded,main_info,country
2,0,21,0,0,0,0,0,1,0,0,1,,,,,,,,"Jessica Aby Position: MF 162cm (5-3½) Born: June 16, 1998 (Age: 24-069d) National Team: Côte d'Ivoire ci",Côte d'Ivoire 
119,111,"9,784",1,0,1,0,0,11,0,0,2,1,0,0,7,8,0,1,"Stephane Acka Position: DF ▪  Footed: Right 184cm, 78kg (6-0, 172lb) Born: October 11, 1990 (Age: 31-317d) in Abidjan, Côte d'Ivoire ci Citizenship: Côte d'Ivoire ci Club: Hapoel Kiriat Shmona",Côte d'Ivoire 
27,12,"1,327",3,3,3,0,0,1,0,0,24,23,5,23,13,14,,,"Bénie Adama Traore Bénie Adama Traore Position: FW 175cm, 64kg (5-8½, 141lb) Born: November 30, 2002 (Age: 19-267d) Citizenship: Côte d'Ivoire ci Club: Häcken",Côte d'Ivoire 
41,22,"2,153",12,3,12,0,0,6,0,0,36,25,18,67,11,28,,,"Simon Adingra Simon Adingra Position: FW 175cm (5-8½) Born: January 1, 2002 (Age: 20-235d) Citizenship: Côte d'Ivoire ci Club: Union SG Wages: £ Weekly Expires June 2026. Via Capology.",Côte d'Ivoire 
19,11,"1,089",1,0,1,0,0,0,0,0,0,2,0,5,0,2,,,"Yannick Adjoumani Yannick Adjoumani Position: DF ▪  Footed: Left 168cm, 68kg (5-6, 150lb) Born: December 29, 2002 (Age: 19-238d) Citizenship: Côte d'Ivoire ci Club: Östersund",Côte d'Ivoire 
87,60,"5,063",8,0,8,0,0,12,0,,,,,,,,,,"Roméo Affessi Roméo Affessi Seka Position: MF (AM) 173cm (5-8) Born: February 19, 1984 in Côte d'Ivoire ci Citizenship: Côte d'Ivoire ci",Côte d'Ivoire 
58,57,"5,005",6,0,6,0,0,13,3,1,75,25,3,10,123,81,0,0,"Emmanuel Agbadou Emmanuel Elysee Djedje Agbadou Badobre Position: DF ▪  Footed: Right 192cm, 84kg (6-3½, 185lb) Born: June 17, 1997 (Age: 25-068d) National Team: Côte d'Ivoire ci Club: Reims Wages: € Weekly Expires June 2027. Via Capology.",Côte d'Ivoire 
1,1,90,0,0,0,0,0,0,0,0,,,,,,,,,"Esperance Agbo Cousso Esperance Agbo Position: FW Born: May 14, 1995 (Age: 27-102d) National Team: Côte d'Ivoire ci",Côte d'Ivoire 
3,0,33,0,0,0,0,0,1,0,0,4,0,0,0,0,0,,,"Mel Agnero Mel Yannick Joel Agnero Position: FW Born: February 20, 2003 (Age: 19-185d) Citizenship: Côte d'Ivoire ci Club: Nordsjælland",Côte d'Ivoire 
1,1,90,0,0,0,0,0,1,0,0,3,,,,,,,,"Sophie Aguie Position: DF 167cm (5-5½) Born: December 31, 1996 National Team: Côte d'Ivoire ci",Côte d'Ivoire 
9,4,319,0,0,0,0,0,0,0,,,,,,,,,,"William Aho Abou Position: MF 177cm (5-9½) Born: December 30, 1992 in Anyama, Côte d'Ivoire ci Citizenship: Côte d'Ivoire ci",Côte d'Ivoire 
155,127,"11,056",12,6,12,0,0,25,3,1,191,140,2,14,173,127,0,0,"Jean-Eudes Aholou Position: MF (DM) ▪  Footed: 81% Left* 187cm, 71kg (6-1½, 157lb) Born: March 20, 1994 (Age: 28-157d) in Yopougon, Côte d'Ivoire ci National Team: Côte d'Ivoire ci Club: Strasbourg Wages: € 17,885 Weekly Expires June 2024. Via Capology.",Côte d'Ivoire 
18,14,"1,350",1,0,1,0,0,1,0,0,18,7,0,2,24,8,,,"Mohamed Aidara Mohamed Aidara Position: DF 186cm, 74kg (6-1, 163lb) Born: November 6, 1996 (Age: 25-291d) Citizenship: Côte d'Ivoire ci Club: FC Vizela",Côte d'Ivoire 
20,14,"1,174",3,0,1,2,2,2,0,0,,,,,,,,,"Brice Aka Position: FW 173cm (5-8) Born: April 8, 1983 in Abidjan, Côte d'Ivoire ci Citizenship: Côte d'Ivoire ci",Côte d'Ivoire 
1,1,90,0,0,0,0,0,0,0,0,,,,,,,,,"Essis Aka Position: MF Born: January 10, 1990 (Age: 32-226d) in Côte d'Ivoire ci National Team: Côte d'Ivoire ci Club: ASEC Mimosas",Côte d'Ivoire 
7,3,310,0,1,0,0,0,0,0,0,6,1,0,1,7,12,,,"Serge Aka Serge Arnaud Aka Position: MF Born: November 16, 1994 (Age: 27-281d) Citizenship: Côte d'Ivoire ci Club: Altay",Côte d'Ivoire 
3,2,136,0,0,0,0,0,1,0,0,4,,,,,,,,"Rita Akaffou Josephine Rita Akaffou Leyo Position: MF 166cm (5-5) Born: December 5, 1986 in Abidjan, Côte d'Ivoire ci National Team: Côte d'Ivoire ci",Côte d'Ivoire 
255,167,"14,926",26,27,26,0,0,14,1,,117,,,,,,,,"Kanga Akalé Akale Gauthier Position: FW-MF (AM-CM) 177cm, 73kg (5-9½, 161lb) Born: March 7, 1981 in Abidjan, Côte d'Ivoire ci National Team: Côte d'Ivoire ci",Côte d'Ivoire 
31,28,"2,462",2,0,2,0,0,7,1,,,,,,,,,,"Ghislain Akassou Position: DF 182cm, 78kg (5-11½, 172lb) Born: February 15, 1975 in Abidjan, Côte d'Ivoire ci National Team: Côte d'Ivoire ci",Côte d'Ivoire 
68,59,"5,150",1,1,0,1,1,19,4,,,,,,,,,,"Jean-Baptiste Akassou Jean-Baptiste Arian Akassou Position: DF-MF (DM) 175cm (5-8½) Born: November 5, 1985 Citizenship: Côte d'Ivoire ci",Côte d'Ivoire 
126,65,"6,121",35,9,28,7,7,6,2,1,81,64,22,13,11,18,0,0,"Arnaud Ake Arnaud Loba Ake Position: FW 180cm, 76kg (5-10½, 168lb) Born: April 1, 1998 (Age: 24-145d) in Divo, Côte d'Ivoire ci National Team: Côte d'Ivoire ci Club: Nashville SC Wages: $1,250,000 Annual Expires December 2023. Via Capology.",Côte d'Ivoire 
148,131,"11,475",0,3,0,0,0,16,1,0,111,92,0,12,52,55,0,0,"Ogou Akichi Position: MF (CM-DM) 178cm, 74kg (5-10, 163lb) Born: April 24, 1990 (Age: 32-122d) National Team: Côte d'Ivoire ci Club: FC Stade Lausanne-Ouchy",Côte d'Ivoire 
20,10,910,0,0,0,0,0,7,2,1,27,6,0,2,19,21,0,0,"Paul Akouokou Position: MF ▪  Footed: 89% Right* 190cm, 83kg (6-2½, 183lb) Born: December 20, 1997 (Age: 24-247d) in Abidjan, Côte d'Ivoire ci National Team: Côte d'Ivoire ci Club: Real Betis Wages: € 9,808 Weekly Expires June 2024. Via Capology.",Côte d'Ivoire 
380,222,"21,746",54,28,53,1,1,26,1,0,346,3,0,0,0,1,0,0,"Jean-Louis Akpa Akpro Position: FW ▪  Footed: Right 180cm, 68kg (5-10½, 150lb) Born: January 4, 1985 (Age: 37-232d) in Toulouse, France fr Citizenship: Côte d'Ivoire ci  Other: France Club: Radcliffe Borough FC",Côte d'Ivoire 
221,151,"14,117",7,15,7,0,0,52,0,0,320,54,2,37,72,113,0,1,"Jean-Daniel Akpa-Akpro Position: DF-MF (CM-FB) ▪  Footed: 82% Right* 180cm, 68kg (5-10½, 150lb) Born: October 11, 1992 (Age: 29-317d) in Toulouse, France fr National Team: Côte d'Ivoire ci  Other: France Club: Lazio Wages: € 17,885 Weekly Expires June 2025. Via Capology.",Côte d'Ivoire 
51,50,"4,510",0,0,0,0,0,4,0,0,,,,,,,,,"Badra Ali Sangaré Position: GK ▪  Footed: Right 181cm, 87kg (5-11, 192lb) Born: May 30, 1986 (Age: 36-086d) in Bingerville, Côte d'Ivoire ci National Team: Côte d'Ivoire ci Club: Sekhukhune United FC",Côte d'Ivoire 
8,4,272,0,0,0,0,0,3,0,0,8,3,0,0,7,2,0,0,"Kódjo Alphonse Kódjo Kassé Alphonse Position: MF 178cm, 69kg (5-10, 152lb) Born: May 28, 1993 in Abidjan, Côte d'Ivoire ci Citizenship: Côte d'Ivoire ci",Côte d'Ivoire 
1,1,90,0,0,0,0,0,1,0,0,,,,,,,,,"Bernadette Amani Kakounan Bernadette Amani Position: MF Born: September 5, 1997 (Age: 24-353d) National Team: Côte d'Ivoire ci",Côte d'Ivoire 
15,2,311,1,1,1,0,0,0,0,0,,,,,,,,,"Franck Amani Franck Amani Anoumou Position: FW Born: December 22, 1999 Citizenship: Côte d'Ivoire ci",Côte d'Ivoire 
14,8,834,6,4,6,0,0,2,0,0,,,,,,,,,"Rosemonde Amenan Kouassi Amenan Joelle Rosemonde Kouassi Position: FW Born: December 26, 2001 (Age: 20-241d) National Team: Côte d'Ivoire ci Club: Fleury",Côte d'Ivoire 
69,34,"3,333",12,6,12,0,1,10,1,0,102,57,38,22,6,10,,,"Achille Anani Position: FW ▪  Footed: Right 179cm, 68kg (5-10, 150lb) Born: December 27, 1994 (Age: 27-240d) Citizenship: Côte d'Ivoire ci Club: Grenoble",Côte d'Ivoire 
29,8,"1,127",1,3,1,0,0,4,0,,2,,,,,,,,"Bobley Anderson Bobley Anderson Allegne Position: MF (AM) ▪  Footed: Right 168cm, 79kg (5-6, 174lb) Born: March 3, 1992 Citizenship: Côte d'Ivoire ci",Côte d'Ivoire 
28,25,"2,263",0,0,0,0,0,1,0,,,,,,,,,,"Didier Angan Position: DF 184cm (6-0) Born: December 27, 1974 in Anyama, Côte d'Ivoire ci National Team: Côte d'Ivoire ci",Côte d'Ivoire 
167,124,"10,765",3,4,3,0,0,34,4,0,159,79,2,34,52,78,0,0,"Victorien Angban Position: MF (CM) ▪  Footed: 86% Right* 180cm, 69kg (5-10½, 152lb) Born: September 29, 1996 (Age: 25-329d) in Abidjan, Côte d'Ivoire ci National Team: Côte d'Ivoire ci Club: PFC Sochi",Côte d'Ivoire 
263,244,"21,980",6,0,6,0,0,63,7,0,246,24,0,4,75,29,0,2,"Benjamin Angoua Brou Benjamin Angoua Position: DF (CB) ▪  Footed: Right 178cm, 68kg (5-10, 150lb) Born: November 28, 1986 (Age: 35-269d) in Anyama, Côte d'Ivoire ci National Team: Côte d'Ivoire ci Club: Stade Briochin",Côte d'Ivoire 
24,20,"1,789",0,1,0,0,0,3,0,,,,,,,,,,"Jean-Yves Anis Gohourou Jean-Yves Anis Position: DF 177cm (5-9½) Born: November 30, 1980 in Oumé, Côte d'Ivoire ci Citizenship: Côte d'Ivoire ci",Côte d'Ivoire 
139,93,"8,505",36,19,35,1,2,12,2,0,42,77,19,24,11,20,4,0,"Roger Assalé Roger Claver Djapone Assalé Position: FW-MF ▪  Footed: 85% Right* 167cm, 62kg (5-5½, 137lb) Born: November 13, 1993 (Age: 28-284d) in Abengourou, Côte d'Ivoire ci National Team: Côte d'Ivoire ci Club: Dijon",Côte d'Ivoire 
1,0,18,0,0,0,0,0,0,0,,,,,,,,,,"Anoh Attoukora Anoh Apollinaire Attoukora sfondo Position: MF ▪  Footed: Left 170cm, 66kg (5-6½, 146lb) Born: June 20, 1989 (Age: 33-065d) Citizenship: Côte d'Ivoire ci Club: Aviron Bayonnais FC",Côte d'Ivoire 
273,250,"22,080",15,32,15,0,0,47,6,3,345,90,17,318,152,182,1,6,"Serge Aurier Serge Alain Stephane Aurier Position: DF-MF (FB, right) ▪  Footed: 88% Right* 176cm, 76kg (5-9, 168lb) Born: December 24, 1992 (Age: 29-243d) in Paris, France fr National Team: Côte d'Ivoire ci",Côte d'Ivoire 
46,31,"2,873",1,3,1,0,0,4,0,,,,,,,,,,"Ahyee Aye Elvis Position: DF 178cm, 68kg (5-10, 150lb) Born: December 13, 1983 in Abidjan, Côte d'Ivoire ci Citizenship: Côte d'Ivoire ci",Côte d'Ivoire 
57,19,"1,993",8,2,8,0,0,3,0,,14,,,,,,,,"Georges Ba Georges Ba Depreyba Position: FW 186cm (6-1) Born: January 21, 1979 in Abidjan, Côte d'Ivoire ci National Team: Côte d'Ivoire ci",Côte d'Ivoire 
72,67,"5,792",2,2,1,1,1,9,3,,,,,,,,,,"Seydou Badjan Kanté Position: DF-MF 175cm (5-8½) Born: August 7, 1981 in Côte d'Ivoire ci National Team: Côte d'Ivoire ci",Côte d'Ivoire 
1,0,17,0,0,0,0,0,0,0,0,,,,,,,,,"Salif Bagaté Position: FW Born: April 1, 1990 National Team: Côte d'Ivoire ci",Côte d'Ivoire 
92,77,"7,052",0,7,0,0,0,13,3,0,47,0,0,0,0,0,0,0,"Mamadou Bagayoko Position: DF (FB, right) ▪  Footed: Right 175cm, 64kg (5-8½, 141lb) Born: December 31, 1989 (Age: 32-236d) in Abidjan, Côte d'Ivoire ci National Team: Côte d'Ivoire ci",Côte d'Ivoire 
16,12,"1,091",1,0,1,0,0,0,0,,,,,,,,,,"Lionel Bah Position: MF 185cm (6-½) Born: February 2, 1980 in Oullins, France fr National Team: Côte d'Ivoire ci",Côte d'Ivoire 
110,96,"8,176",1,0,1,0,0,27,2,1,113,77,0,4,210,108,0,3,"Eric Bailly Eric Bertrand Bailly Position: DF (CB, right) ▪  Footed: 86% Right* 187cm, 77kg (6-1½, 170lb) Born: April 12, 1994 (Age: 28-134d) in Abidjan, Côte d'Ivoire ci National Team: Côte d'Ivoire ci Club: Manchester United Wages: £ 80,000 Weekly Expires June 2024. Via Capology. Twitter: @ericbailly24 Instagram: @ericbailly24",Côte d'Ivoire 
113,60,"5,943",20,4,20,0,0,14,1,,,,,,,,,,"Dagui Bakari Dagui Orphie Bakari Position: FW 193cm, 89kg (6-3½, 196lb) Born: September 6, 1974 in Paris, France fr National Team: Côte d'Ivoire ci",Côte d'Ivoire 
273,221,"20,131",7,11,7,0,0,26,5,1,177,0,0,0,0,0,0,0,"Zoumana Bakayogo Position: DF (FB, left) ▪  Footed: Left 183cm, 73kg (6-0, 161lb) Born: August 11, 1986 in Paris, France fr Youth National Team: Côte d'Ivoire ci  Other: France",Côte d'Ivoire 
393,266,"24,445",87,20,80,7,9,40,3,0,150,,,,,,,,"Ibrahima Bakayoko Ibrahima Bakayoko Sela Position: FW 180cm, 74kg (5-10½, 163lb) Born: December 31, 1976 in Séguéla, Côte d'Ivoire ci National Team: Côte d'Ivoire ci",Côte d'Ivoire 
240,215,"19,350",2,11,2,0,0,40,2,0,141,64,5,153,86,72,0,2,"Abdoulaye Bamba Position: DF (FB, right) ▪  Footed: 90% Right* 182cm, 68kg (5-11½, 150lb) Born: April 25, 1990 (Age: 32-121d) in Abidjan, Côte d'Ivoire ci National Team: Côte d'Ivoire ci Club: Angers Wages: € 6,346 Weekly Expires June 2023. Via Capology.",Côte d'Ivoire 
14,5,553,1,0,1,0,0,2,0,,,,,,,,,,"Abudramae Bamba Position: FW 186cm (6-1) Born: October 26, 1986 in Abidjan, Côte d'Ivoire ci Citizenship: Côte d'Ivoire ci",Côte d'Ivoire 
47,40,"3,529",2,1,2,0,0,8,2,0,,,,,,,,,"Ali Bamba Ali Vanomo Bamba Position: DF ▪  Footed: Left 191cm, 79kg (6-3, 174lb) Born: July 2, 1991 (Age: 31-053d) in Bingerville, Côte d'Ivoire ci Youth National Team: Côte d'Ivoire ci Club: US Marignane",Côte d'Ivoire 
148,121,"10,807",48,16,45,3,5,14,0,0,125,70,70,28,18,46,0,0,"Daouda Bamba Position: FW ▪  Footed: Right 184cm, 74kg (6-0, 163lb) Born: March 5, 1995 (Age: 27-172d) in Dabou, Côte d'Ivoire ci Citizenship: Côte d'Ivoire ci Club: CSKA Sofia",Côte d'Ivoire 
10,6,528,0,0,0,0,0,3,0,0,15,16,0,1,11,13,,,"Ibrahima Bamba Ibrahima Kader Ariel Bamba Position: MF ▪  Footed: Right 184cm (6-0) Born: April 22, 2002 (Age: 20-124d) Citizenship: Côte d'Ivoire ci  Other: Italy Club: Vitória Guimarães",Côte d'Ivoire 
25,17,"1,517",2,1,2,0,0,3,1,,22,,,,,,,,"Siaka Bamba Position: MF (DM) 175cm (5-8½) Born: August 24, 1989 in Abidjan, Côte d'Ivoire ci Youth National Team: Côte d'Ivoire ci",Côte d'Ivoire 
382,350,"31,444",22,6,22,0,0,89,5,0,393,71,6,5,275,135,0,3,"Sol Bamba Souleymane Bamba Position: DF (CB, left) ▪  Footed: 83% Right* 190cm, 86kg (6-2½, 190lb) Born: January 13, 1985 (Age: 37-223d) in Ivry-sur-Seine, France fr National Team: Côte d'Ivoire ci  Other: France Club: Middlesbrough",Côte d'Ivoire 
4,2,217,0,0,0,0,0,1,0,0,5,12,0,6,1,7,,,"Fodé Bangaly Diakité Position: DF (CB-FB, left) 184cm (6-0) Born: January 26, 1985 in Dabakala, Côte d'Ivoire ci Citizenship: Côte d'Ivoire ci",Côte d'Ivoire 
42,32,"2,717",1,0,1,0,0,6,0,0,,,,,,,,,"Soumahoro Bangaly Position: DF (CB) ▪  Footed: Right 190cm, 83kg (6-2½, 183lb) Born: July 18, 1991 (Age: 31-037d) in Adzopé, Côte d'Ivoire ci Citizenship: Côte d'Ivoire ci Club: Mamelodi Sundowns",Côte d'Ivoire 
5,4,333,0,0,0,0,0,1,0,,4,,,,,,,,"Charles Bantanga Position: MF 176cm, 77kg (5-9, 170lb) Born: February 10, 1994 Citizenship: Côte d'Ivoire ci",Côte d'Ivoire 
1,0,11,0,0,0,0,0,0,0,,0,,,,,,,,"Anderson Banvo Aka Anderson Banvo Amon Position: FW 190cm, 82kg (6-2½, 181lb) Born: February 4, 1994 (Age: 28-201d) in Romainville, France fr Citizenship: Côte d'Ivoire ci  Other: France Club: Les Herbiers VF",Côte d'Ivoire 
340,340,"30,262",1,0,0,1,1,22,3,,0,,,,,,,,"Boubacar Barry Position: GK ▪  Footed: Right 181cm, 68kg (5-11, 150lb) Born: December 30, 1979 in Abidjan, Côte d'Ivoire ci National Team: Côte d'Ivoire ci",Côte d'Ivoire 
65,59,"5,294",6,2,6,0,0,8,0,0,,,,,,,,,"Armand Bazié Position: MF Born: March 20, 1992 Citizenship: Côte d'Ivoire ci",Côte d'Ivoire 
189,93,"9,238",27,8,22,5,6,19,2,0,199,108,25,8,8,29,0,0,"Chris Bedia Position: FW ▪  Footed: Right 190cm, 73kg (6-2½, 161lb) Born: March 5, 1996 (Age: 26-172d) in Abidjan, Côte d'Ivoire ci Youth National Team: Côte d'Ivoire ci Club: Servette",Côte d'Ivoire 
74,56,"5,183",1,0,1,0,0,11,1,,40,,,,,,,,"Alain Behi Position: DF-MF 182cm, 78kg (5-11½, 172lb) Born: July 1, 1978 in Abidjan, Côte d'Ivoire ci National Team: Côte d'Ivoire ci",Côte d'Ivoire 
93,57,"5,274",15,2,15,0,0,9,1,0,,0,0,0,0,0,0,0,"Ismaël Béko Fofana Position: FW ▪  Footed: Left 180cm, 68kg (5-10½, 150lb) Born: September 8, 1988 (Age: 33-350d) in Abidjan, Côte d'Ivoire ci Youth National Team: Côte d'Ivoire ci Club: Alashkert FC",Côte d'Ivoire 
1,0,12,0,0,0,0,0,0,0,,0,,,,,,,,"Jean-Louis Bessé Valery Jean-Louis Bessé Position: MF 185cm (6-½) Born: July 5, 1980 in Abidjan, Côte d'Ivoire ci Citizenship: Côte d'Ivoire ci",Côte d'Ivoire 
18,9,916,4,0,4,0,0,1,0,,,,,,,,,,"Kevin Beugré Position: FW Born: August 23, 1992 Citizenship: Côte d'Ivoire ci",Côte d'Ivoire 
9,7,599,0,0,0,0,0,2,0,0,9,2,0,2,15,9,,,"Alan Bidi-Lecadouq Alan Régis Bidi-Lecadouq Position: DF Born: October 19, 1995 Citizenship: Côte d'Ivoire ci",Côte d'Ivoire 
1,1,73,0,0,0,0,0,0,0,0,,,,,,,,,"Treika Blé Position: MF 192cm (6-3½) Born: February 26, 1992 in Côte d'Ivoire ci National Team: Côte d'Ivoire ci",Côte d'Ivoire 
198,122,"11,723",24,11,24,0,1,0,0,0,50,228,41,159,47,71,2,2,"Jeremie Boga Position: FW-MF (AM, left) ▪  Footed: 90% Right* 172cm, 74kg (5-7½, 163lb) Born: January 3, 1997 (Age: 25-233d) in Marseille, France fr National Team: Côte d'Ivoire ci  Other: France Club: Atalanta Wages: € 53,462 Weekly Expires June 2023. Via Capology.",Côte d'Ivoire 
284,239,"21,445",6,16,6,0,0,52,4,1,263,17,2,46,23,18,0,0,"Arthur Boka Arthur Étienne Boka Position: DF (FB, left) ▪  Footed: Left 166cm, 67kg (5-5, 148lb) Born: April 2, 1983 in Abidjan, Côte d'Ivoire ci National Team: Côte d'Ivoire ci",Côte d'Ivoire 
231,192,"17,241",77,10,72,5,7,34,0,0,68,12,14,1,3,8,0,0,"Franck Boli Bi Sylvestre Franck Fortune Boli Position: FW ▪  Footed: Right 180cm, 77kg (5-10½, 170lb) Born: December 7, 1993 (Age: 28-260d) in Abidjan, Côte d'Ivoire ci National Team: Côte d'Ivoire ci Club: Ferencváros",Côte d'Ivoire 
149,94,"8,387",39,10,34,5,5,26,1,0,84,22,10,1,1,5,0,0,"Yannick Boli Yannick Toapry Boli Position: FW ▪  Footed: Right 181cm, 74kg (5-11, 163lb) Born: January 13, 1988 (Age: 34-223d) in Saint-Maur-des-Fossés, France fr National Team: Côte d'Ivoire ci  Other: France Club: JL Chiang Mai United FC",Côte d'Ivoire 
115,83,"7,697",39,7,37,2,3,26,1,1,51,0,0,0,0,0,0,0,"Yohan Boli Position: FW ▪  Footed: Right 181cm, 76kg (5-11, 168lb) Born: November 17, 1993 (Age: 28-280d) in Arras, France fr National Team: Côte d'Ivoire ci  Other: France Club: Al Rayyan",Côte d'Ivoire 
181,68,"7,295",21,8,21,0,0,12,1,0,57,10,9,34,8,14,0,0,"Mathis Bolly Mathis Gazoa Kippersund Bolly Position: FW-MF (WM) ▪  Footed: Both 185cm, 77kg (6-½, 170lb) Born: November 14, 1990 (Age: 31-283d) in Oslo, Norway no National Team: Côte d'Ivoire ci  Other: Norway Club: Molde",Côte d'Ivoire 
251,248,"22,097",13,6,13,0,0,31,6,1,213,47,6,1,194,191,0,2,"Willy Boly Position: DF (CB) ▪  Footed: 86% Right* 195cm, 81kg (6-4½, 179lb) Born: February 3, 1991 (Age: 31-202d) in Melun, France fr National Team: Côte d'Ivoire ci  Other: France Club: Wolverhampton Wanderers Wages: £ 50,000 Weekly Expires June 2023. Via Capology.",Côte d'Ivoire 
241,185,"16,662",106,26,91,15,17,29,2,0,258,34,6,2,8,8,0,0,"Wilfried Bony Wilfried Guemiand Bony Position: FW ▪  Footed: Right 183cm, 86kg (6-0, 190lb) Born: December 10, 1988 in Bingerville, Côte d'Ivoire ci National Team: Côte d'Ivoire ci Twitter: @wilfriedbony",Côte d'Ivoire 
7,4,379,1,0,1,0,0,3,0,,,,,,,,,,"Herve Bostan Amani Position: FW 184cm, 73kg (6-0, 161lb) Born: October 11, 1997 Citizenship: Côte d'Ivoire ci",Côte d'Ivoire 
7,2,172,0,0,0,0,0,0,0,0,4,0,0,0,0,0,0,0,"Jean-Jacques Bougouhi Position: FW ▪  Footed: Right 176cm, 71kg (5-9, 157lb) Born: June 12, 1992 in Bingerville, Côte d'Ivoire ci Citizenship: Côte d'Ivoire ci",Côte d'Ivoire 
19,10,961,0,0,0,0,0,1,0,0,7,13,0,49,15,10,,,"Willie Britto Dagou Willie Britto Position: DF 183cm, 67kg (6-0, 148lb) Born: December 15, 1996 National Team: Côte d'Ivoire ci",Côte d'Ivoire 
1,1,90,0,0,0,0,0,0,0,0,2,0,0,0,2,1,,,"Lamine Buhanga Lamine Buhanga Position: DF ▪  Footed: Right 181cm, 73kg (5-11, 161lb) Born: October 3, 2001 Citizenship: Côte d'Ivoire ci  Other: France",Côte d'Ivoire 
7,1,150,0,0,0,0,0,2,0,0,6,5,0,2,1,1,0,0,"Drissa Camara Position: MF ▪  Footed: Right 169cm, 54kg (5-6½, 119lb) Born: February 18, 2002 (Age: 20-187d) Citizenship: Côte d'Ivoire ci Club: Parma",Côte d'Ivoire 
149,78,"7,618",24,11,24,0,0,16,3,0,146,,,,,,,,"Axel Cédric Konan Haouliais Axel Cédric Konan Position: FW 180cm, 74kg (5-10½, 163lb) Born: January 25, 1983 in Abidjan, Côte d'Ivoire ci Citizenship: Côte d'Ivoire ci",Côte d'Ivoire 
4,1,103,0,0,0,0,0,0,0,0,1,2,0,0,1,3,,,"Mohamed Cheik Toure Mohamed Cheick-Ali Toure Position: MF 179cm (5-10) Born: March 30, 1997 Citizenship: Côte d'Ivoire ci",Côte d'Ivoire 
20,16,"1,430",0,0,0,0,0,8,1,1,19,17,1,3,22,24,0,0,"Ibrahim Cissé Position: DF 188cm (6-2) Born: January 11, 1999 (Age: 23-225d) Citizenship: Côte d'Ivoire ci Club: Nice Wages: € Weekly Expires June 2023. Via Capology.",Côte d'Ivoire 
1,0,1,0,0,0,0,0,0,0,,,,,,,,,,"Isaac Cissé Position: FW Born: February 3, 1994 in Côte d'Ivoire ci Citizenship: Côte d'Ivoire ci",Côte d'Ivoire 
1,1,68,0,0,0,0,0,0,0,0,2,,,,,,,,"Nadège Cissé Position: FW 177cm (5-9½) Born: April 4, 1997 (Age: 25-142d) National Team: Côte d'Ivoire ci Club: FK Dynamo-BDU Minsk",Côte d'Ivoire 
298,213,"19,325",59,23,59,0,1,30,4,0,187,0,0,0,0,0,0,0,"Sekou Cissé Position: FW 187cm, 81kg (6-1½, 179lb) Born: May 23, 1985 (Age: 37-093d) in Dabou, Côte d'Ivoire ci National Team: Côte d'Ivoire ci Club: CA Pontarlier",Côte d'Ivoire 
192,157,"14,030",49,20,46,3,4,21,0,0,36,31,16,38,7,10,0,0,"Davy Claude Angan Davy Claude Angan N'Guessan Position: FW 182cm, 74kg (5-11½, 163lb) Born: September 20, 1987 in Abidjan, Côte d'Ivoire ci Citizenship: Côte d'Ivoire ci",Côte d'Ivoire 
226,128,"12,072",40,23,40,0,1,18,2,1,152,155,54,248,97,124,5,0,"Maxwel Cornet Gnaly Maxwell Cornet Position: DF-FW-MF ▪  Footed: 79% Left* 179cm, 68kg (5-10, 150lb) Born: September 27, 1996 (Age: 25-331d) in Brégbo, Côte d'Ivoire ci National Team: Côte d'Ivoire ci  Other: France Club: Burnley",Côte d'Ivoire 
2,2,180,0,0,0,0,0,0,0,0,1,,,,,,,,"Djelika Coulibaly Position: MF 184cm (6-0) Born: February 22, 1984 in Abidjan, Côte d'Ivoire ci National Team: Côte d'Ivoire ci",Côte d'Ivoire 
4,4,360,0,0,0,0,0,3,0,0,5,,,,,,,,"Fatou Coulibaly Fatoumata Coulibaly Position: DF 172cm (5-7½) Born: February 13, 1987 (Age: 35-192d) in Abidjan, Côte d'Ivoire ci National Team: Côte d'Ivoire ci Club: Barcelona FA",Côte d'Ivoire 
2,1,102,0,0,0,0,0,1,0,0,,,,,,,,,"Fousseny Coulibaly Fousseny Coulibaly Position: MF ▪  Footed: Right 193cm (6-3½) Born: February 12, 1992 (Age: 30-193d) National Team: Côte d'Ivoire ci Club: Espérance de Tunis",Côte d'Ivoire 
67,60,"5,463",3,0,3,0,0,13,2,0,25,0,0,0,0,0,0,0,"Hamed Coulibaly Position: DF 187cm, 82kg (6-1½, 181lb) Born: December 16, 1996 Citizenship: Côte d'Ivoire ci",Côte d'Ivoire 
108,92,"8,197",3,6,3,0,0,25,0,,162,,,,,,,,"Kafoumba Coulibaly Position: MF (DM) ▪  Footed: Right 179cm, 73kg (5-10, 161lb) Born: October 26, 1985 in Côte d'Ivoire ci National Team: Côte d'Ivoire ci",Côte d'Ivoire 
45,45,"3,907",0,0,0,0,0,9,0,,,,,,,,,,"Mamadou Coulibaly Position: DF 173cm (5-8) Born: May 26, 1980 in Bouaké, Côte d'Ivoire ci Citizenship: Côte d'Ivoire ci",Côte d'Ivoire 
69,35,"3,603",17,3,16,1,1,4,0,0,36,,,,,,,,"Souleymane Coulibaly Position: FW ▪  Footed: Right 172cm, 76kg (5-7½, 168lb) Born: December 26, 1994 in Abidjan, Côte d'Ivoire ci Youth National Team: Côte d'Ivoire ci",Côte d'Ivoire 
10,8,824,0,0,0,0,0,2,0,0,5,10,0,7,7,13,,,"Wonlo Coulibaly Position: DF 179cm, 69kg (5-10, 152lb) Born: December 22, 1991 (Age: 30-245d) National Team: Côte d'Ivoire ci Club: ASEC Mimosas",Côte d'Ivoire 
196,97,"9,327",45,19,37,8,8,11,0,0,37,15,7,9,3,5,0,0,"Cyriac Gohi Bi Zoro Cyriac Position: FW ▪  Footed: Right 174cm, 73kg (5-8½, 161lb) Born: August 15, 1990 in Daloa, Côte d'Ivoire ci National Team: Côte d'Ivoire ci",Côte d'Ivoire 
64,57,"5,130",1,0,1,0,0,8,1,0,26,8,0,8,36,37,0,1,"Kouadio-Yves Dabila Position: DF ▪  Footed: 92% Right* 183cm, 72kg (6-0, 159lb) Born: January 1, 1997 (Age: 25-235d) in Kouassi-Datékro, Côte d'Ivoire ci Youth National Team: Côte d'Ivoire ci Club: Lille",Côte d'Ivoire 
176,126,"10,061",48,14,41,7,8,33,2,,171,,,,,,,,"Eugène Dadi Eugène Buhame Dadi Position: FW 186cm, 79kg (6-1, 174lb) Born: August 21, 1973 in Abidjan, Côte d'Ivoire ci National Team: Côte d'Ivoire ci",Côte d'Ivoire 
12,4,492,1,0,1,0,0,0,0,0,,,,,,,,,"Lago Dagbo Bei Position: FW ▪  Footed: Right 178cm (5-10) Born: April 25, 1992 Citizenship: Côte d'Ivoire ci",Côte d'Ivoire 
13,7,618,1,1,1,0,0,2,0,0,,,,,,,,,"Nadrey Dago Nadrey Ange Stephane Dago Position: FW Born: May 7, 1997 (Age: 25-109d) Citizenship: Côte d'Ivoire ci Club: Panetolikos",Côte d'Ivoire 
1,1,45,0,0,0,0,0,0,0,0,,,,,,,,,"Guillaume Daho Guillaume Nicaise Horey Daho Position: FW Born: December 20, 1994 National Team: Côte d'Ivoire ci",Côte d'Ivoire 
34,31,"2,655",2,0,2,0,0,12,1,1,,,,,,,,,"Edgard Dakoi Koffi Sebastien Edgard Dakoi Position: MF 163cm, 58kg (5-4, 128lb) Born: August 26, 1999 Youth National Team: Côte d'Ivoire ci",Côte d'Ivoire 
1,0,17,0,0,0,0,0,0,0,0,,,,,,,,,Bradji Dakouri Bradji Armel Dakouri Position: MF National Team: Côte d'Ivoire ci,Côte d'Ivoire 
23,9,793,0,0,0,0,0,5,0,,,,,,,,,,"Joël Damahou Position: DF-MF (DM) 191cm (6-3) Born: January 28, 1987 Citizenship: Côte d'Ivoire ci",Côte d'Ivoire 
2,2,100,0,0,0,0,0,3,1,1,,,,,,,,,"Geo Danny Ekra Geo Danny Ekra Position: MF Born: January 10, 1999 Citizenship: Côte d'Ivoire ci",Côte d'Ivoire 
79,71,"6,479",2,0,2,0,0,20,2,,21,,,,,,,,"Issoumaila Dao Position: DF (CB) 182cm (5-11½) Born: August 9, 1983 in Abidjan, Côte d'Ivoire ci Citizenship: Côte d'Ivoire ci",Côte d'Ivoire 
57,56,"4,940",2,0,2,0,0,13,1,,20,,,,,,,,"Mariko Daouda Position: DF 183cm (6-0) Born: November 13, 1981 in Abidjan, Côte d'Ivoire ci Citizenship: Côte d'Ivoire ci",Côte d'Ivoire 
4,3,251,0,1,0,0,0,0,0,,,,,,,,,,"Amed Davy Sylla Position: FW 185cm (6-½) Born: October 4, 1982 in Lille, France fr Citizenship: Côte d'Ivoire ci",Côte d'Ivoire 
95,65,"5,744",11,10,11,0,0,7,1,0,68,0,0,0,0,0,0,0,"Serges Déblé Serge Déblé Position: MF (WM) ▪  Footed: Both 171cm, 62kg (5-7, 137lb) Born: October 1, 1989 (Age: 32-327d) in Anyama, Côte d'Ivoire ci Youth National Team: Côte d'Ivoire ci Club: FC Tobol",Côte d'Ivoire 
174,163,"14,400",6,5,6,0,1,14,0,0,67,3,0,3,54,22,0,0,"Simon Deli Position: DF (CB, left) ▪  Footed: 65% Left* 192cm, 86kg (6-3½, 190lb) Born: October 27, 1991 (Age: 30-301d) in Côte d'Ivoire ci National Team: Côte d'Ivoire ci Club: Adana Demirspor",Côte d'Ivoire 
