MP,games_starts,minutes,goals,assists,goals_pens,pens_made,pens_att,cards_yellow,cards_red,cards_yellow_red,fouls,fouled,offsides,crosses,interceptions,tackles_won,pens_won,pens_conceded,main_info,country
27,2,665,1,2,1,0,0,0,0,0,13,16,3,6,6,2,0,0,"Moussa Guel Position: FW 172cm, 79kg (5-7½, 174lb) Born: June 23, 1999 (Age: 23-062d) Citizenship: Côte d'Ivoire ci Club: Red Star",Côte d'Ivoire 
95,83,"6,953",9,6,8,1,1,6,2,0,,,,,,,,,"Tchiressoua Guel Position: MF (AM) 166cm, 64kg (5-5, 141lb) Born: December 27, 1975 in Sikensi, Côte d'Ivoire ci National Team: Côte d'Ivoire ci",Côte d'Ivoire 
26,17,"1,451",4,0,3,1,1,6,0,0,2,0,0,0,0,0,0,0,"Ghislain Guessan Position: FW Born: September 15, 1992 in Paris, France fr Citizenship: Côte d'Ivoire ci",Côte d'Ivoire 
19,2,516,0,0,0,0,0,1,0,,0,,,,,,,,"Inters Gui Position: MF (WM) 173cm, 66kg (5-8, 146lb) Born: August 8, 1993 (Age: 29-016d) in Bingerville, Côte d'Ivoire ci Citizenship: Côte d'Ivoire ci Club: Sliema Wanderers FC",Côte d'Ivoire 
1,0,9,0,,0,0,,0,0,0,,,,,,,,,"Hervé Guy Hervé Guy Landry Position: FW-MF 169cm (5-6½) Born: August 5, 1984 in Adzopé, Côte d'Ivoire ci National Team: Côte d'Ivoire ci",Côte d'Ivoire 
290,242,"21,528",113,42,91,22,22,19,1,0,334,245,93,54,36,79,1,0,"Sébastien Haller Position: FW ▪  Footed: 82% Right* 187cm, 86kg (6-1½, 190lb) Born: June 22, 1994 (Age: 28-063d) in Ris-Orangis, France fr National Team: Côte d'Ivoire ci  Other: France Club: Dortmund Wages: € 211,538 Weekly Expires June 2026. Via Capology.",Côte d'Ivoire 
17,8,776,2,1,2,0,0,1,0,,2,,,,,,,,"Levi Houapeu Aquilas Levi Houapeu Position: FW 173cm (5-8) Born: June 22, 1989 in Abidjan, Côte d'Ivoire ci Citizenship: Côte d'Ivoire ci Draft: Philadelphia Union, 3rd round (41st overall), 2011 MLS Draft (from UMBC)",Côte d'Ivoire 
5,1,250,0,0,0,0,0,1,0,0,1,2,0,0,0,1,,,"Cheick Ibrahim Comara Position: DF 180cm (5-10½) Born: October 14, 1993 (Age: 28-314d) National Team: Côte d'Ivoire ci Club: Wydad Casablanca",Côte d'Ivoire 
57,30,"2,844",19,2,18,1,1,4,0,0,69,55,14,11,5,15,,,"Vakoun Issouf Bayo Position: FW 184cm, 72kg (6-0, 159lb) Born: January 10, 1997 (Age: 25-226d) National Team: Côte d'Ivoire ci Club: Watford",Côte d'Ivoire 
2,1,39,0,0,0,0,0,0,0,0,,,,,,,,,"Saeed Jomma Saeed Fahd Désiré Jomma Position: FW 192cm (6-3½) Born: September 13, 1992 National Team: Côte d'Ivoire ci",Côte d'Ivoire 
21,15,"1,213",3,1,3,0,0,1,0,0,,,,,,,,,"Sédé Junior Dion Sédé Junior Dion Position: FW Born: January 1, 1994 (Age: 28-235d) Citizenship: Côte d'Ivoire ci Club: Marumo Gallants FC",Côte d'Ivoire 
270,187,"16,640",41,15,32,9,10,22,0,0,142,90,18,108,23,34,0,3,"Lago Junior Junior Wakalible Lago Position: FW-MF ▪  Footed: 77% Right* 185cm, 74kg (6-½, 163lb) Born: December 31, 1990 (Age: 31-236d) in Abidjan, Côte d'Ivoire ci National Team: Côte d'Ivoire ci Club: Mallorca Wages: € 8,654 Weekly Expires June 2023. Via Capology.",Côte d'Ivoire 
5,1,75,0,0,0,0,0,0,0,0,0,0,1,0,0,1,,,"Bayéré Junior Loué Position: FW 187cm, 78kg (6-1½, 172lb) Born: January 14, 2001 (Age: 21-222d) Citizenship: Côte d'Ivoire ci Club: Hammarby Talang FF",Côte d'Ivoire 
139,90,"7,747",18,7,18,0,0,17,0,0,135,118,20,92,83,98,1,0,"Hamed Junior Traorè Position: FW-MF (AM) ▪  Footed: 84% Right* 177cm, 68kg (5-9½, 150lb) Born: February 16, 2000 (Age: 22-189d) in Abidjan, Côte d'Ivoire ci National Team: Côte d'Ivoire ci Club: Sassuolo Wages: € 17,885 Weekly Expires June 2024. Via Capology.",Côte d'Ivoire 
29,22,"2,083",0,2,0,0,0,8,0,0,37,9,0,28,45,14,,,"Armel Junior Zohouri Armel Junior Zohouri Position: DF Born: April 5, 2001 Citizenship: Côte d'Ivoire ci",Côte d'Ivoire 
1,0,5,0,0,0,0,0,0,0,0,,,,,,,,,"Yao Juslin Yao Olivier Juslin N'Zi Position: DF ▪  Footed: Left 192cm (6-3½) Born: December 20, 2000 (Age: 21-247d) Citizenship: Côte d'Ivoire ci Club: Kapfenberger",Côte d'Ivoire 
18,18,"1,620",0,0,0,0,0,0,0,0,0,0,0,0,0,0,0,0,"Axel Kacou Position: GK ▪  Footed: Right 192cm, 81kg (6-3½, 179lb) Born: August 1, 1995 (Age: 27-023d) in Saint-Denis, France fr Citizenship: Côte d'Ivoire ci  Other: France Club: AS Lyon-Duchère",Côte d'Ivoire 
2,2,180,0,0,0,0,0,0,0,0,0,,,,,,,,"Raymonde Kacou Koffi Kacou Also Played As: Koffi Kacou Position: DF 164cm (5-4½) Born: January 7, 1987 in Yamoussoukro, Côte d'Ivoire ci National Team: Côte d'Ivoire ci",Côte d'Ivoire 
19,15,"1,212",0,0,0,0,0,7,1,,,,,,,,,,"Barry Kader Position: MF 175cm, 78kg (5-8½, 172lb) Born: March 26, 1986 in Abidjan, Côte d'Ivoire ci Citizenship: Côte d'Ivoire ci",Côte d'Ivoire 
144,104,"9,348",25,18,25,0,0,23,1,,142,,,,,,,,"Abdul Kader Keïta Position: FW-MF (AM-WM) 184cm, 78kg (6-0, 172lb) Born: August 6, 1981 in Abidjan, Côte d'Ivoire ci National Team: Côte d'Ivoire ci",Côte d'Ivoire 
67,60,"5,504",6,2,6,0,0,14,1,1,47,0,0,0,0,0,0,0,"Didier Kadio Didier Boris Kadio Position: DF ▪  Footed: Right 180cm, 72kg (5-10½, 159lb) Born: April 5, 1990 (Age: 32-141d) in Man, Côte d'Ivoire ci Youth National Team: Côte d'Ivoire ci Club: Alashkert FC",Côte d'Ivoire 
224,182,"15,680",54,38,53,1,1,30,1,,60,,,,,,,,"Bonaventure Kalou Position: FW-MF (AM) 182cm, 77kg (5-11½, 170lb) Born: January 12, 1978 in Oumé, Côte d'Ivoire ci National Team: Côte d'Ivoire ci",Côte d'Ivoire 
464,357,"31,372",149,64,133,16,19,14,0,0,400,108,49,67,54,44,1,0,"Salomon Kalou Salomon Armand Magloire Kalou Position: FW-MF (AM) ▪  Footed: 87% Right* 183cm, 78kg (6-0, 172lb) Born: August 5, 1985 in Oumé, Côte d'Ivoire ci National Team: Côte d'Ivoire ci Twitter: @salomonkalou Instagram: @salomonkalou",Côte d'Ivoire 
160,117,"10,817",11,2,11,0,0,25,2,1,114,94,9,193,201,120,0,2,"Hassane Kamara Position: DF-MF (DM-FB, left) ▪  Footed: 87% Left* 166cm, 62kg (5-5, 137lb) Born: March 5, 1994 (Age: 28-172d) in Saint-Denis, France fr National Team: Côte d'Ivoire ci  Other: France Club: Watford Wages: £ 26,538 Weekly Expires June 2025. Via Capology.",Côte d'Ivoire 
39,28,"2,206",4,6,4,0,0,5,1,,,,,,,,,,"Youssouf Kamara Position: FW Born: August 10, 1981 Citizenship: Côte d'Ivoire ci",Côte d'Ivoire 
141,124,"10,723",3,1,3,0,0,36,4,1,,,,,,,,,"Hervé Kambou Position: DF-MF (CB-DM) 182cm, 72kg (5-11½, 159lb) Born: May 1, 1985 (Age: 37-115d) in Abidjan, Côte d'Ivoire ci National Team: Côte d'Ivoire ci Club: Asociación Deportiva Tarma",Côte d'Ivoire 
1,0,45,0,0,0,0,0,0,0,0,,,,,,,,,"Simon Kangoh Gouposson Simon Kangoh Position: FW Born: May 7, 1988 National Team: Côte d'Ivoire ci",Côte d'Ivoire 
161,145,"12,399",3,5,3,0,0,23,5,1,79,4,1,0,4,6,0,0,"Wilfried Kanon Serge Wilfried Kanon Position: DF (CB) ▪  Footed: Left 188cm, 84kg (6-2, 185lb) Born: July 6, 1993 (Age: 29-049d) in Abidjan, Côte d'Ivoire ci National Team: Côte d'Ivoire ci Club: Helsinki IFK",Côte d'Ivoire 
281,226,"19,903",22,30,21,1,2,22,1,0,140,0,0,0,0,0,0,0,"Lossémy Karaboué Position: MF (AM-WM) ▪  Footed: Right 172cm, 68kg (5-7½, 150lb) Born: March 18, 1988 (Age: 34-159d) in Paris, France fr National Team: Côte d'Ivoire ci  Other: France Club: Suphanburi FC",Côte d'Ivoire 
3,3,270,0,0,0,0,0,0,0,,1,,,,,,,,"Hamadou Karamoko Position: DF ▪  Footed: Right 194cm, 88kg (6-4, 194lb) Born: October 31, 1995 (Age: 26-297d) in Paris, France fr Citizenship: Côte d'Ivoire ci  Other: France Club: FC Chambly",Côte d'Ivoire 
12,3,350,0,1,0,0,0,1,0,0,,,,,,,,,"Mohamed Karamoko Position: FW Born: January 25, 2002 Citizenship: Côte d'Ivoire ci",Côte d'Ivoire 
4,2,205,0,0,0,0,0,0,0,0,,,,,,,,,"Abdoul Karim Cissé Position: GK ▪  Footed: Right 192cm, 82kg (6-3½, 181lb) Born: October 20, 1985 (Age: 36-308d) in Côte d'Ivoire ci National Team: Côte d'Ivoire ci Club: ASEC Mimosas",Côte d'Ivoire 
144,107,"9,733",28,18,28,0,1,17,1,0,99,27,6,80,27,27,0,0,"Luc Kassi Aketchi Luc Martin Kassi Position: MF ▪  Footed: Right 179cm, 73kg (5-10, 161lb) Born: August 20, 1994 (Age: 28-004d) in Abidjan, Côte d'Ivoire ci Citizenship: Côte d'Ivoire ci Club: Stabæk",Côte d'Ivoire 
86,66,"5,788",4,5,4,0,0,22,2,0,49,13,0,1,30,12,0,0,"Aboubakar Keita Position: MF ▪  Footed: Right 188cm, 69kg (6-2, 152lb) Born: November 5, 1997 (Age: 24-292d) in Côte d'Ivoire ci Youth National Team: Côte d'Ivoire ci Club: RWD Molenbeek",Côte d'Ivoire 
25,23,"2,128",0,0,0,0,0,2,0,,10,,,,,,,,"Ali Keïta Position: DF 178cm, 73kg (5-10, 161lb) Born: October 1, 1988 in Abidjan, Côte d'Ivoire ci Citizenship: Côte d'Ivoire ci",Côte d'Ivoire 
1,0,45,0,0,0,0,0,0,0,,,,,,,,,,"Fadel Keïta Amidou Fadel Keïta Position: FW Born: July 5, 1977 National Team: Côte d'Ivoire ci",Côte d'Ivoire 
112,87,"7,545",0,3,0,0,0,31,2,0,90,,,,,,,,"Idrissa Keita Position: MF 183cm (6-0) Born: April 10, 1977 in Abidjan, Côte d'Ivoire ci National Team: Côte d'Ivoire ci",Côte d'Ivoire 
57,45,"4,123",2,2,2,0,0,13,1,1,9,5,0,1,4,5,,,"Kader Keita Abdul Kader Keita Position: MF Born: November 6, 2000 (Age: 21-291d) Youth National Team: Côte d'Ivoire ci  Other: France Club: Westerlo",Côte d'Ivoire 
242,221,"19,605",46,13,23,23,27,41,3,1,362,218,13,174,192,224,4,5,"Franck Kessié Franck Yannick Kessié Position: DF-MF (CB-CM-DM) ▪  Footed: 81% Right* 183cm, 76kg (6-0, 168lb) Born: December 19, 1996 (Age: 25-248d) in Ouragahio, Côte d'Ivoire ci National Team: Côte d'Ivoire ci Club: Barcelona Wages: € 260,385 Weekly Expires June 2027. Via Capology. Instagram: @franckkessie",Côte d'Ivoire 
1,1,45,0,0,0,0,0,0,0,0,,,,,,,,,"Yao Kévin Konan Yao Kévin Romaric Konan Position: DF Born: December 5, 1994 National Team: Côte d'Ivoire ci",Côte d'Ivoire 
133,127,"11,322",4,3,4,0,0,35,3,1,163,69,2,23,128,102,0,2,"Cédric Kipré Position: DF (CB) ▪  Footed: Right 191cm, 77kg (6-3, 170lb) Born: December 9, 1996 (Age: 25-258d) in Paris, France fr Citizenship: Côte d'Ivoire ci  Other: France Club: Cardiff City",Côte d'Ivoire 
18,16,"1,427",0,0,0,0,0,4,0,,24,,,,,,,,"Jean-Martial Kipré Position: DF 175cm (5-8½) Born: November 10, 1984 in Abidjan, Côte d'Ivoire ci Citizenship: Côte d'Ivoire ci",Côte d'Ivoire 
94,77,"6,381",13,11,13,0,0,20,1,0,132,76,21,99,60,91,0,0,"Laurent Kissiedou Position: MF 173cm, 66kg (5-8, 146lb) Born: December 22, 1998 (Age: 23-245d) Citizenship: Côte d'Ivoire ci Club: Memphis 901",Côte d'Ivoire 
206,155,"13,657",67,13,58,9,9,25,3,0,185,65,28,32,5,13,2,0,"Jonathan Kodjia Position: FW ▪  Footed: Right 189cm, 77kg (6-2, 170lb) Born: October 22, 1989 (Age: 32-306d) in Saint-Denis, France fr National Team: Côte d'Ivoire ci  Other: France Club: Al Gharrafa",Côte d'Ivoire 
117,47,"4,924",15,3,14,1,2,15,0,0,21,11,8,2,2,3,0,0,"Koffi Jean Romaric Kevin Koffi Position: FW ▪  Footed: Right 175cm, 74kg (5-8½, 163lb) Born: June 25, 1986 (Age: 36-060d) in Aboisso, Côte d'Ivoire ci Citizenship: Côte d'Ivoire ci Club: Elversberg",Côte d'Ivoire 
25,17,"1,547",5,0,5,0,0,2,0,0,,,,,,,,,"Abdoulaye Koffi Position: FW 182cm (5-11½) Born: December 30, 1991 in Abidjan, Côte d'Ivoire ci Citizenship: Côte d'Ivoire ci  Other: Burkina Faso",Côte d'Ivoire 
2,1,68,0,0,0,0,0,0,0,0,,,,,,,,,"Christian Koffi Position: MF 188cm (6-2) Born: December 21, 1990 (Age: 31-246d) in Dabou, Côte d'Ivoire ci National Team: Côte d'Ivoire ci Club: TP Mazembe",Côte d'Ivoire 
36,33,"2,716",0,0,0,0,0,12,1,1,65,43,0,1,41,60,0,0,"Jean-Christophe Koffi Position: MF 175cm, 78kg (5-8½, 172lb) Born: January 5, 1998 (Age: 24-231d) in Abidjan, Côte d'Ivoire ci Citizenship: Côte d'Ivoire ci Club: Memphis 901",Côte d'Ivoire 
1,1,90,0,0,0,0,1,0,0,0,,,,,,,,,"Marcelin Koffi Position: DF Born: April 6, 1985 National Team: Côte d'Ivoire ci",Côte d'Ivoire 
10,9,762,4,1,2,2,2,0,0,0,,,,,,,,,"Mechac Koffi Koffi Mechac Position: FW 182cm (5-11½) Born: September 24, 1988 in Bouna, Côte d'Ivoire ci Citizenship: Côte d'Ivoire ci",Côte d'Ivoire 
1,1,90,0,0,0,0,0,0,0,0,,,,,,,,,"Sylviane Kokora Adjoua Sylviane Kokora Adjoua Position: MF Born: July 12, 1995 (Age: 27-043d) National Team: Côte d'Ivoire ci",Côte d'Ivoire 
27,12,"1,467",5,2,5,0,0,3,0,,,,,,,,,,"Oussou Konan Anicet Oussou Konan Anicet Harian Maxmalon Position: FW 181cm (5-11) Born: January 23, 1989 in Anyama, Côte d'Ivoire ci Citizenship: Côte d'Ivoire ci",Côte d'Ivoire 
140,137,"12,176",3,9,3,0,0,11,1,1,136,139,9,267,175,158,0,5,"Ghislain Konan Position: DF (FB, left) ▪  Footed: 91% Left* 176cm, 71kg (5-9, 157lb) Born: December 27, 1995 (Age: 26-240d) in Abidjan, Côte d'Ivoire ci National Team: Côte d'Ivoire ci Club: Al Nasr (KSA)",Côte d'Ivoire 
1,1,89,0,0,0,0,0,1,0,0,,,,,,,,,"Inès Konan Akissi Inès Mikouame Konan Position: DF Born: January 8, 2002 (Age: 20-228d) National Team: Côte d'Ivoire ci",Côte d'Ivoire 
6,3,304,0,0,0,0,0,1,0,0,9,0,0,0,0,0,0,0,"Daouda Konaté Position: DF ▪  Footed: Left 175cm, 63kg (5-8½, 139lb) Born: December 14, 1991 (Age: 30-253d) in Yopougon, Côte d'Ivoire ci Citizenship: Côte d'Ivoire ci Club: AS Muret",Côte d'Ivoire 
30,24,"2,135",1,0,1,0,0,8,2,0,,0,0,0,0,0,0,0,"Dramane Konaté Position: DF Born: April 12, 1994 (Age: 28-134d) Citizenship: Côte d'Ivoire ci Club: Paganese Calcio 1926",Côte d'Ivoire 
11,11,990,0,0,0,0,0,1,0,0,0,2,0,0,0,0,,,"Hillel Konaté Yored Hillel Konaté Position: GK ▪  Footed: Right 182cm, 77kg (5-11½, 170lb) Born: December 28, 1994 (Age: 27-239d) Citizenship: Côte d'Ivoire ci Club: Valenciennes",Côte d'Ivoire 
25,7,954,4,1,4,0,0,5,0,,42,,,,,,,,"Mamadou Konate Position: FW 176cm (5-9) Born: March 10, 1985 in Abidjan, Côte d'Ivoire ci Citizenship: Côte d'Ivoire ci",Côte d'Ivoire 
110,68,"6,468",9,12,9,0,0,16,0,0,49,0,0,0,0,0,0,0,"Tiémoko Konaté Position: MF ▪  Footed: Both 174cm, 74kg (5-8½, 163lb) Born: March 3, 1990 (Age: 32-174d) in Abidjan, Côte d'Ivoire ci National Team: Côte d'Ivoire ci Club: Vendsyssel",Côte d'Ivoire 
399,275,"25,304",113,53,104,9,12,19,2,1,227,54,39,22,14,17,1,0,"Arouna Koné Position: FW ▪  Footed: Right 182cm, 78kg (5-11½, 172lb) Born: November 11, 1983 in Anyama, Côte d'Ivoire ci National Team: Côte d'Ivoire ci Instagram: @arounabill",Côte d'Ivoire 
157,129,"10,958",42,16,39,3,5,12,0,,156,,,,,,,,"Bakari Koné Position: FW 167cm, 62kg (5-5½, 137lb) Born: September 17, 1981 in Abidjan, Côte d'Ivoire ci National Team: Côte d'Ivoire ci",Côte d'Ivoire 
198,178,"15,844",29,8,29,0,0,33,4,0,109,0,0,0,0,0,0,0,"Emmanuel Koné Kouamatien Emmanuel Koné Position: MF (AM-WM, left) 177cm, 64kg (5-9½, 141lb) Born: December 31, 1986 in Abongoua, Côte d'Ivoire ci National Team: Côte d'Ivoire ci",Côte d'Ivoire 
63,49,"4,492",9,8,9,0,0,8,2,0,,,,,,,,,"Hamed Koné Ben Hamed Koné Position: MF 168cm, 74kg (5-6, 163lb) Born: November 2, 1987 in Abidjan, Côte d'Ivoire ci National Team: Côte d'Ivoire ci",Côte d'Ivoire 
121,113,"10,135",0,1,0,0,0,22,1,0,34,0,0,0,0,0,0,0,"Isaac Koné Position: DF-MF (DM) 181cm, 73kg (5-11, 161lb) Born: January 3, 1991 in Paris, France fr Youth National Team: Côte d'Ivoire ci  Other: France",Côte d'Ivoire 
138,80,"7,681",35,9,31,4,4,12,1,0,59,33,18,7,3,11,,,"Koro Koné Koro Issa Ahmed Koné Position: FW-MF (WM) ▪  Footed: Right 178cm, 74kg (5-10, 163lb) Born: July 5, 1989 (Age: 33-050d) in Abidjan, Côte d'Ivoire ci Youth National Team: Côte d'Ivoire ci Club: Yverdon Sport",Côte d'Ivoire 
288,270,"23,967",15,5,15,0,0,49,3,0,212,70,5,12,143,100,0,4,"Lamine Koné Position: DF (CB, right) ▪  Footed: 82% Right* 189cm, 89kg (6-2, 196lb) Born: February 1, 1989 in Paris, France fr National Team: Côte d'Ivoire ci  Other: France",Côte d'Ivoire 
162,102,"9,417",28,18,27,1,2,23,3,2,110,53,12,42,11,24,0,0,"Mamadou Koné Position: FW ▪  Footed: Right 181cm, 73kg (5-11, 161lb) Born: December 25, 1991 (Age: 30-242d) in Bingerville, Côte d'Ivoire ci Citizenship: Côte d'Ivoire ci Club: Eupen",Côte d'Ivoire 
45,41,"3,534",0,1,0,0,0,10,1,0,15,0,0,0,0,0,0,0,"Mory Koné Position: DF (CB) ▪  Footed: Right 190cm, 84kg (6-2½, 185lb) Born: April 21, 1994 (Age: 28-125d) in Paris, France fr Youth National Team: Côte d'Ivoire ci  Other: France Club: FC Shirak",Côte d'Ivoire 
12,6,484,1,,1,0,0,0,0,0,,,,,,,,,"Mory Koné Position: DF Born: July 13, 1995 (Age: 27-042d) Citizenship: Côte d'Ivoire ci Club: Újpest",Côte d'Ivoire 
222,156,"14,308",15,7,15,0,0,52,1,0,19,11,1,3,10,13,0,0,"Moussa Koné Moussa Saib Koné Position: MF 180cm, 73kg (5-10½, 161lb) Born: February 12, 1990 (Age: 32-193d) in Anyama, Côte d'Ivoire ci National Team: Côte d'Ivoire ci Club: FC Kyzylzhar",Côte d'Ivoire 
111,86,"7,719",26,9,24,2,2,13,1,0,74,0,0,0,0,0,0,0,"Seydou Koné Position: FW ▪  Footed: Right 179cm, 78kg (5-10, 172lb) Born: March 28, 1983 in Abidjan, Côte d'Ivoire ci Citizenship: Côte d'Ivoire ci",Côte d'Ivoire 
18,10,926,0,0,0,0,0,4,0,0,,,,,,,,,"Souleymane Koné Position: DF ▪  Footed: Right 189cm, 71kg (6-2, 157lb) Born: May 1, 1996 (Age: 26-115d) Citizenship: Côte d'Ivoire ci Club: St. Pölten",Côte d'Ivoire 
10,2,220,0,0,0,0,0,0,0,0,0,3,2,0,0,0,,,"Zoumana Koné Position: FW 182cm, 78kg (5-11½, 172lb) Born: October 27, 1991 (Age: 30-301d) National Team: Côte d'Ivoire ci Club: Vendée Fontenay Foot",Côte d'Ivoire 
71,52,"4,919",1,3,1,0,0,11,0,0,52,23,0,18,85,53,0,1,"Odilon Kossonou Position: DF (CB, right) ▪  Footed: 85% Right* 188cm, 72kg (6-2, 159lb) Born: January 4, 2001 (Age: 21-232d) National Team: Côte d'Ivoire ci Club: Leverkusen Wages: € 31,346 Weekly Expires June 2026. Via Capology.",Côte d'Ivoire 
6,5,495,0,0,0,0,0,2,0,0,,,,,,,,,"Kouassi Kouadja Position: DF ▪  Footed: Right 183cm, 74kg (6-0, 163lb) Born: June 22, 1995 in Abidjan, Côte d'Ivoire ci Citizenship: Côte d'Ivoire ci",Côte d'Ivoire 
36,29,"2,671",0,1,0,0,0,1,0,0,28,21,3,32,35,17,,,"Loïc Kouagba Position: DF ▪  Footed: Left 183cm, 81kg (6-0, 179lb) Born: June 9, 1994 (Age: 28-076d) in Boulogne-Billancourt, France fr Citizenship: Côte d'Ivoire ci  Other: France Club: Red Star",Côte d'Ivoire 
4,4,311,0,0,0,0,0,0,0,0,1,1,0,1,5,4,0,0,"Aubin Kouakou Position: MF 184cm (6-0) Born: January 27, 1992 in Côte d'Ivoire ci Citizenship: Côte d'Ivoire ci",Côte d'Ivoire 
1,0,13,0,0,0,0,0,0,0,0,1,0,0,0,0,0,,,"Chris Kouakou Banhourin Chris Emmanuel Kouakou Position: MF Born: December 15, 1999 (Age: 22-252d) Citizenship: Côte d'Ivoire ci Club: Midtjylland",Côte d'Ivoire 
148,102,"8,999",36,11,35,1,1,16,1,0,82,23,15,14,7,11,0,0,"Christian Kouakou Christian Kouakou Yao Position: FW ▪  Footed: Right 182cm, 73kg (5-11½, 161lb) Born: March 1, 1991 (Age: 31-176d) in Abidjan, Côte d'Ivoire ci Citizenship: Côte d'Ivoire ci Club: Bangladesh Police FC",Côte d'Ivoire 
59,50,"4,415",4,1,4,0,0,10,6,,6,,,,,,,,"Raoul Kouakou Position: DF 191cm, 89kg (6-3, 196lb) Born: January 3, 1980 in Abidjan, Côte d'Ivoire ci National Team: Côte d'Ivoire ci",Côte d'Ivoire 
170,114,"10,505",32,22,31,1,1,19,1,0,121,197,44,62,41,59,2,0,"Christian Kouamé Position: FW ▪  Footed: 84% Right* 185cm, 78kg (6-½, 172lb) Born: December 6, 1997 (Age: 24-261d) in Abidjan, Côte d'Ivoire ci National Team: Côte d'Ivoire ci Club: Fiorentina Wages: € 42,692 Weekly Expires June 2024. Via Capology.",Côte d'Ivoire 
3,3,165,0,0,0,0,0,0,1,0,,,,,,,,,"Zacharie Kouamé Konan Zacharie Kouamé Position: FW Born: March 6, 2000 Citizenship: Côte d'Ivoire ci",Côte d'Ivoire 
75,45,"4,131",10,2,10,0,0,18,4,4,94,70,9,17,36,34,0,0,"Christian Kouan Position: MF Born: January 1, 1999 (Age: 23-235d) Citizenship: Côte d'Ivoire ci Club: Perugia",Côte d'Ivoire 
33,26,"2,349",2,1,2,0,0,13,1,0,40,33,1,67,40,41,,,"Koffi Kouao Position: DF Born: May 20, 1998 (Age: 24-096d) Youth National Team: Côte d'Ivoire ci Club: FC Vizela",Côte d'Ivoire 
5,1,177,0,1,0,0,0,0,0,0,,,,,,,,,"Alexandre Kouassi Kouamé Alexandre Kouassi Position: FW Born: December 28, 1988 Citizenship: Côte d'Ivoire ci",Côte d'Ivoire 
2,0,21,0,0,0,0,0,0,0,0,,,,,,,,,"Arthur Kouassi Koffi Desmos Arthur Kouassi N'gnan Position: FW 188cm (6-2) Born: November 17, 1989 Citizenship: Côte d'Ivoire ci",Côte d'Ivoire 
12,12,970,2,0,1,1,1,2,1,0,,,,,,,,,"Bernard Kouassi Bernard Yao Kouassi Position: FW Born: July 7, 1994 (Age: 28-048d) Citizenship: Côte d'Ivoire ci Club: Real Kashmir FC",Côte d'Ivoire 
128,124,"10,953",1,1,1,0,0,34,8,,13,,,,,,,,"Blaise Kouassi Blaise Koffi Kouassi Position: DF (CB) 182cm, 74kg (5-11½, 163lb) Born: February 2, 1975 in Abidjan, Côte d'Ivoire ci National Team: Côte d'Ivoire ci",Côte d'Ivoire 
62,42,"3,633",1,1,1,0,0,18,1,0,71,25,0,6,21,19,0,0,"Eboue Kouassi Jules Christ Eboue Kouassi Position: MF ▪  Footed: Right 185cm, 69kg (6-½, 152lb) Born: December 13, 1997 (Age: 24-254d) in Abidjan, Côte d'Ivoire ci Youth National Team: Côte d'Ivoire ci",Côte d'Ivoire 
278,258,"22,695",3,7,3,0,0,88,13,5,126,119,0,14,223,129,0,0,"Xavier Kouassi Xavier Laglais Kouassi Position: DF-MF (CB) 173cm, 68kg (5-8, 150lb) Born: December 28, 1989 (Age: 32-239d) in San-Pédro, Côte d'Ivoire ci National Team: Côte d'Ivoire ci Club: Pau FC",Côte d'Ivoire 
11,4,325,1,0,1,0,0,0,0,,5,,,,,,,,"Aimé Koudou Position: FW 180cm (5-10½) Born: November 18, 1976 Citizenship: Côte d'Ivoire ci",Côte d'Ivoire 
45,27,"2,459",6,1,6,0,1,7,0,,,,,,,,,,"Alain Koudou Alain Koudou Arunina Position: FW 172cm (5-7½) Born: October 21, 1984 in Abidjan, Côte d'Ivoire ci Citizenship: Côte d'Ivoire ci",Côte d'Ivoire 
11,7,708,0,0,0,0,0,2,0,,0,,,,,,,,"Arnaud Kouyo Arnaud Ange Gballon Kouyo Position: DF 183cm, 83kg (6-0, 183lb) Born: August 4, 1984 in Abidjan, Côte d'Ivoire ci Citizenship: Côte d'Ivoire ci",Côte d'Ivoire 
2,2,128,0,0,0,0,0,0,0,0,1,,,,,,,,"Nina Kpaho Position: DF 163cm (5-4) Born: December 30, 1996 (Age: 25-237d) National Team: Côte d'Ivoire ci Club: FC Minsk",Côte d'Ivoire 
15,8,626,0,2,0,0,0,2,0,,17,,,,,,,,"Guy-Roland Kpene Position: FW 180cm (5-10½) Born: November 23, 1983 in Abidjan, Côte d'Ivoire ci Citizenship: Côte d'Ivoire ci",Côte d'Ivoire 
35,23,"2,102",9,3,7,2,2,12,0,0,,,,,,,,,"Gnohere Krizo Position: FW 193cm (6-3½) Born: June 20, 1997 (Age: 25-065d) in Saïoua, Côte d'Ivoire ci Citizenship: Côte d'Ivoire ci Club: Churchill Brothers SC",Côte d'Ivoire 
54,22,"2,097",11,3,7,4,4,6,1,0,9,,,,,,,,"Élie Kroupi Éli Verges Napoles Kroupi Zahi Position: FW Born: October 18, 1979 in Sassandra, Côte d'Ivoire ci National Team: Côte d'Ivoire ci",Côte d'Ivoire 
24,18,"1,474",6,0,6,0,0,3,0,0,,,,,,,,,"Khallil Lambin Khallil Moustapha Lambin Position: FW ▪  Footed: Left 177cm, 68kg (5-9½, 150lb) Born: August 3, 1992 Citizenship: Côte d'Ivoire ci",Côte d'Ivoire 
42,18,"1,821",0,1,0,0,0,12,2,1,63,50,6,14,41,43,,,"Houssou Landry Houssou Landry Houssou Landry Position: MF 178cm, 77kg (5-10, 170lb) Born: December 28, 2000 (Age: 21-239d) Citizenship: Côte d'Ivoire ci Club: D.C. United",Côte d'Ivoire 
75,65,"5,720",2,1,2,0,0,15,4,0,17,,,,,,,,"Saliou Lassissi Position: DF (CB) 185cm, 79kg (6-½, 174lb) Born: August 15, 1978 in Abidjan, Côte d'Ivoire ci National Team: Côte d'Ivoire ci",Côte d'Ivoire 
23,12,"1,058",5,1,5,0,0,5,0,0,23,30,5,10,7,7,,,"Emmanuel Latte Lath Position: FW ▪  Footed: Right 180cm, 71kg (5-10½, 157lb) Born: January 2, 1999 (Age: 23-234d) in Marcory, Côte d'Ivoire ci Citizenship: Côte d'Ivoire ci Club: St Gallen",Côte d'Ivoire 
1,0,9,0,0,0,0,0,0,0,0,0,0,0,0,0,0,0,0,"Félix Lemaréchal Félix Lemaréchal Position: MF ▪  Footed: Right Born: August 7, 2003 (Age: 19-017d) in Tours, France fr Citizenship: Côte d'Ivoire ci  Other: France Club: Monaco",Côte d'Ivoire 
51,21,"2,349",2,2,2,0,0,12,1,0,78,69,0,25,40,28,0,1,"Ben Lhassine Kone Benjamin Lhassine Kone Position: MF Born: March 14, 2000 (Age: 22-163d) Citizenship: Côte d'Ivoire ci Club: Crotone Wages: € 7,115 Weekly Expires June 2024. Via Capology.",Côte d'Ivoire 
2,2,162,0,0,0,0,0,0,0,0,,,,,,,,,"Didier Liberé Didier Liberé Grekou Position: FW Born: August 13, 1983 Citizenship: Côte d'Ivoire ci",Côte d'Ivoire 
20,14,"1,310",0,0,0,0,0,5,1,1,,,,,,,,,"Hassan Lingani Position: DF (CB) 184cm, 78kg (6-0, 172lb) Born: December 30, 1987 (Age: 34-237d) in Côte d'Ivoire ci Citizenship: Côte d'Ivoire ci Club: AS Muret",Côte d'Ivoire 
23,5,721,5,2,4,1,1,2,0,,,,,,,,,,"Alain Liri Serge Alain Liri Position: FW 170cm (5-6½) Born: March 23, 1979 in Abidjan, Côte d'Ivoire ci Citizenship: Côte d'Ivoire ci",Côte d'Ivoire 
130,127,"11,504",0,0,0,0,0,12,0,,0,,,,,,,,"Stephan Loboué Stephan Raphael Loboué Position: GK 194cm, 89kg (6-4, 196lb) Born: August 23, 1981 in Pforzheim, Germany de National Team: Côte d'Ivoire ci  Other: Germany",Côte d'Ivoire 
3,3,258,0,0,0,0,0,0,0,0,6,,,,,,,,"Christine Lohoues Position: MF 158cm (5-2) Born: October 18, 1992 (Age: 29-310d) National Team: Côte d'Ivoire ci",Côte d'Ivoire 
190,164,"14,896",7,7,7,0,0,52,5,,68,,,,,,,,"Igor Lolo Igor Alexander Lolo Position: DF (FB, right) ▪  Footed: Right 179cm, 77kg (5-10, 170lb) Born: July 22, 1982 in Abidjan, Côte d'Ivoire ci National Team: Côte d'Ivoire ci",Côte d'Ivoire 
3,3,211,1,0,1,0,0,1,0,0,,,,,,,,,"Christ Lorougnon Christ Remi Lorougnon Position: FW Born: September 2, 1992 Citizenship: Côte d'Ivoire ci",Côte d'Ivoire 
112,77,"6,968",11,16,11,0,0,14,0,0,,,,,,,,,"Adriel Loua Adriel D'Avila Ba Loua Position: FW ▪  Footed: Left 170cm, 63kg (5-6½, 139lb) Born: July 25, 1996 (Age: 26-030d) Youth National Team: Côte d'Ivoire ci Club: Lech Poznań",Côte d'Ivoire 
9,9,750,0,0,0,0,0,2,0,,,,,,,,,,"Edgar Loué Edgard Gnoleba Loué Position: DF-MF 185cm (6-½) Born: December 27, 1983 in Abidjan, Côte d'Ivoire ci Citizenship: Côte d'Ivoire ci",Côte d'Ivoire 
94,50,"5,353",10,8,10,0,0,21,0,0,94,0,0,0,0,0,0,0,"Jean Luc Gbayara Jean Luc Gbayara Assoubre Position: MF (WM) 170cm (5-6½) Born: August 8, 1992 in Département de Lakota, Côte d'Ivoire ci Citizenship: Côte d'Ivoire ci",Côte d'Ivoire 
40,30,"2,772",0,2,0,0,0,4,1,0,14,25,0,73,18,19,,,"Aristide Mabea Kouya Aristide Mabea Position: DF 177cm (5-9½) Born: October 23, 1998 (Age: 23-305d) Citizenship: Côte d'Ivoire ci Club: Westerlo",Côte d'Ivoire 
